Keyword,Location,rating,Company,Job_title,Place,salary,post_date,Job_URLs,Job_description
 Data scientist ,United States,4.3,Google,"Senior Data Scientist, Product, Workspace","New York, NY",,24h,https://www.glassdoor.com/partner/jobListing.htm?pos=701&ao=1136043&s=58&guid=0000019601b7cbf8a1ecdb5fd5fa96d6&src=GD_JOB_AD&t=SR&vt=w&cs=1_fa23f823&cb=1743785545423&jobListingId=1009698229974&jrtk=5-yul1-0-1io0rfj4021g2000-25b73647dbb25ea2,"Bachelor's degree in Statistics, Mathematics, Data Science, Engineering, Physics, Economics, or a related quantitative field.&hellip;
      
        Skills: Data structures, R, SQL, Product management, Python
      
    "
 Data scientist ,United States,4.0,Larimar Therapeutics,"Manager, Statistical Programming","Bala Cynwyd, PA",$85K - $137K (Glassdoor est.),2d,https://www.glassdoor.com/partner/jobListing.htm?pos=702&ao=1110586&s=58&guid=0000019601b7cbf8a1ecdb5fd5fa96d6&src=GD_JOB_AD&t=SR&vt=w&ea=1&cs=1_3672d3f8&cb=1743785545424&jobListingId=1009694710264&cpc=8795CF9063CD573D&jrtk=5-yul1-0-1io0rfj4021g2000-c9eae4c7e75babf8---6NYlbfkN0D0ff9e8Lfwlpl5zGbQmpn59AL71QmFd7VKOAnfyjZzp5sdngV8WPgYe0dov1m7Y2kv_vSeAeHJhFCnmd4L0tm6CVHRUeRocq1EYWT5cvcHjVxwFu-EPL1-RuLWWGDPudnmIFoKRvUIAfvgF6LY3s9X_SQwGY6aW4mCufulU3z5L1qvxztUevkBqhpovpPYh3vY5mP7ZrjbVjnXy4kw9TnDLdq-9TpKPvaW1dUXnhHLKLbB3B-5PETYtl6SxearOmi7UoA5boBupDrZ1zluxReikiXwyO9lWfiWkrgow3dFo7oguT4bqIqqAhVNcfUkmITabps0DbsQE-iAUYH3XL7w3TFROgFqrVoygcD8LKBoKT2NDYTTgW5J8ECEYfzTK1IzdyRu7eyrlw8dkrPwoAa8On-cP_wN987TqXTYRZSySsq6YmM8JAky5OYXtrUewe-pjR3WeahyqijQACdSHRrIQRo2TUlp1JrBnZmk37IVwVl3QeS9iHCGqCFArtF6DfzNd8nztfY97FE81VYu5Sj-4rMd6nM4atnxyteBGb5lTMY4EUIg7nnp-GSoxrQEkETz3JxxpuwHI0Asn_eMWyQ0E9w-YPGaSK5uiIcH0LXjdvcxPeFVdu0cok_99v5I5ckvP3x7iJ3vuWrW85rTe670Ox9BuUTZZy52b98cIkXxG2HZSwc1zjTomrsVoxBoOMk0Z4cZDrk6PP0tgDeiEE0uU_TkiwN84m7uhosQ9PenaNnPrSsH4CQK,"Contributes technical expertise to develop global tools that increase the efficiency and capacity of the Statistical Programming group (e.g., macros or…&hellip;
      
        Skills: Management, Clinical development, SAS, R, Quality control
      
    "
 Data scientist ,United States,4.3,Google,"Senior Software Engineering Manager, AI/ML, SecLM, Cloud","San Francisco, CA",,2d,https://www.glassdoor.com/partner/jobListing.htm?pos=703&ao=1136043&s=58&guid=0000019601b7cbf8a1ecdb5fd5fa96d6&src=GD_JOB_AD&t=SR&vt=w&cs=1_6db50741&cb=1743785545424&jobListingId=1009694879344&jrtk=5-yul1-0-1io0rfj4021g2000-f7db867483eaddd7,"Master’s degree or PhD in Engineering, Computer Science, or a related technical field. Teams work all across the company, in areas such as information retrieval…&hellip;
      
        Skills: Management, Java, C++, Supervising experience, C
      
    "
 Data scientist ,United States,4.3,Genworth,"Senior Data Analyst, In-Force Pricing, Long Term Care","Richmond, VA",$63K - $92K (Glassdoor est.),3d,https://www.glassdoor.com/partner/jobListing.htm?pos=704&ao=1110586&s=58&guid=0000019601b7cbf8a1ecdb5fd5fa96d6&src=GD_JOB_AD&t=SR&vt=w&cs=1_2645bef5&cb=1743785545424&jobListingId=1009692780503&cpc=334ABAF5D42DC775&jrtk=5-yul1-0-1io0rfj4021g2000-1576ff243bd4693f---6NYlbfkN0DveHtaohNZTTr4NJ6iQ6LvBAugsddynFItxJfHbw6F-Apcu9BSZNSXnXhmpJE8pofO7LpgCgImeKxJLqZUKna0Vr-WkBN1CUuiIcZFFc2U7IUe84NwgJ0HnVOyIGRg6BAFcIDfqaxUmSSUEoFa4xX0H9vSJCuiOi9ZEIfjcoQht426CuAC28qkvgGWycA3BmL5Y2MrqSgF6u3mpT4n3AtZ1uPHOVIhUbjegw-ZWkER4AhhCog_uxcMQZQdRE9LRfWmf9NNmynTiFJhtV0UHQw0S68APQcfZoLqIND_adKPJDCZsS77ODzyTTmprKnExCaXcNivYVQ3jyPHC0Jy4wb6dEgrqmBraeEDu1kWCDIt_rIDre7GkXJZAwJVfnT9UgBXiy9xgbanuQN8vNYBXy9tWtJHh4Ey92Q8qA61Kvbzwk4_Ud6kd-X_tko-eCccdIT3TXsy93Tc9i1YR_S0fHN00YV9gKLbCmqijzeDeJLf61sK8Rytt6xGgSyWMwBdcGlG_qoTG0c-HEJ4cGLUqYGuG8ZqiwhATa_eLSMtYPVdmCvZWJDUPkCwK3cbMuKfafSu3tOy9Im69fM-fnDhg9-1hznhH4dK0tztGOcmxITjQcRrnnPhTKPIp4TiSW7FjmQeTFSu0QJ7mGrQab8o48W4lRNCiDE3ia9yBeagKUlxWVFLfSuGEekDmH1OZpdE0nWH68zIxwMrDSDY_9FHq8BPcPkujcbYdP0%3D,"Data Analysis & Trending experience with demonstrated proficiency in analytical methodologies, tools, and dashboard development to interpret, visualize,…&hellip;
      
        Skills: Power BI, Data modeling, Microsoft Excel, R, Alteryx
      
    "
 Data scientist ,United States,4.1,Yale University,Statistician 2,"New Haven, CT",$85K - $135K (Glassdoor est.),3d,https://www.glassdoor.com/partner/jobListing.htm?pos=705&ao=1136043&s=58&guid=0000019601b7cbf8a1ecdb5fd5fa96d6&src=GD_JOB_AD&t=SR&vt=w&cs=1_4fa0341c&cb=1743785545424&jobListingId=1009692271708&jrtk=5-yul1-0-1io0rfj4021g2000-43ba84ebf9f712dd,"All candidates for employment will be subject to pre-employment background screening for this position, which may include motor vehicle, DOT certification, drug…&hellip;
      
        Skills: Biostatistics, SAS, Relational databases, Writing skills, Stata
      
    "
 Data scientist ,United States,4.3,Ansys,R&D Engineer II - Deep Learning in Quantum,"Ann Arbor, MI",$96K - $128K (Glassdoor est.),9d,https://www.glassdoor.com/partner/jobListing.htm?pos=706&ao=1110586&s=58&guid=0000019601b7cbf8a1ecdb5fd5fa96d6&src=GD_JOB_AD&t=SR&vt=w&cs=1_6953f517&cb=1743785545425&jobListingId=1009685572907&cpc=AC285F3A3ECA6BB0&jrtk=5-yul1-0-1io0rfj4021g2000-8d5a885e026b4604---6NYlbfkN0C_VxUQDhzcEtU5UIQUIXNdycmbXVRtU8htuAzRK_ilEq88FSnkbh8bK7OHsM_2RDTbaFQHzVjlEpI-MR3ySow2-DgXmNMVeetueoXERbdIyYfn1Hq8ExmGmxWq_avwlsKnMt2PsFyNGl_ywACg8IOFEFtAPgWZkqOTju3LO8EXYlEK3ozxcrf1s0LR3sFuuN2mOfaFIIWdvmgIchriXzWXJcfNPo64z77rhbTET40DKiqlUPTXiKg0KWd8MbES6l0Wbs2Kjpl19ccBIJF5rNKhAw8fwuns7wfjg-OCuPX4Zt0x4UrRoAL0tnq7fXEcHbMsvNtY9Yx-YDnF7gH6JUU8DU8Tqgl3xNLeT6H8YxPki7ibbhELk5pWYPF6KZOgsqi55LktKoccGyybcPtzL2jp2IF4N64sxr5xKnY-vnl7BJh1eRhOnjL_y3FZMRGCsPurFF67q4czFYT3oUu93DUhbSB-E0iSvPAFZkWWsyndt16oYVdd6X-Xp1ei5bTX0PIEBXDWd3WK202x6_51m8bhNd087Du2VvOJXvs9j15CsTRenDDIzd_UYjFE9hA2H_e8wawhJ5HZpeyvqgdA9PBuo-HohvOk76_rtmYiqPO09wCQejDq_GpqbNE5F4bzLnm2WWwDC02CnL2XAsFwIZWjG6B76AKBDhmcoLWwtIYqeaX7j293GcZNE_aVlwTDVE6792sEReZMZUuc34hg8ozoZv--o5CU0Yps7mhk6VF2nEQyMIhSQeA_GLRqPhsuC0XhzW8B3cZkFcixoyfY6YcCXMLsrEZg98I9LJjJjDvq1BOcIFtbAhNkXFgPmkM6iMSUGHHSjU32HCFtfagiGj8NA_c12pSRFTjMv8QTl8oZYKqNleag1UajUBKrIjd3KzLKC9s7kblqbLVrPK7rzYfZCm62JV_dVDJ-w5yd7jZBh6IyJOAsWZ9d_Qa2mgJKlB07xKT7DyBsr49eZ7L8KqZzE9EiPHurhVKdF_s_CzXDQaZGpXnmbhyjRXH0khWoccmLWiOcQZvjEKFLVCVFIwBKgvsrLJj1PjzKe2iDH1cWSAstAXcehG-bzBvtHeDUQ1OAzPsvacuWcnkl3U01mZMiAOM8nppAdo42WCyohgEOyRMoVlEHzgIt3Dp3WiPLueZZVfz6RkYU1qMzioQo5zg3vbTXAF1KP0gU7DyFXToSjqtJj4jY3XJP1U1f4IYktyQnu5Whuh4DZuWnhTJblhpEUStThXfbHgs3k522FiGSscJkFAlU6Gj-n97q9RuoCZCsp4tImtADWX4bmbQsadBpfQFS9EgZOPpb0T3DkjpoktuOtqSvii50VNlLWJO0PGUQdDRLyxmyXzikW2pRZ-5v9fkJLin4Ax8%3D,"Our team is passionate about pushing the limits of world-class simulation technology, empowering our customers to turn their design concepts into successful,…&hellip;
      
        Skills: Computer science, C++, Deep learning, Software development, AI
      
    "
 Data scientist ,United States,4.0,KLA,Sr. Engineer - AI/ML,"Ann Arbor, MI",$108K - $184K (Employer est.),13d,https://www.glassdoor.com/partner/jobListing.htm?pos=707&ao=1136043&s=58&guid=0000019601b7cbf8a1ecdb5fd5fa96d6&src=GD_JOB_AD&t=SR&vt=w&cs=1_2d2e45e8&cb=1743785545425&jobListingId=1009682036658&jrtk=5-yul1-0-1io0rfj4021g2000-f1ca9e2f78b126e7,"Minimum eight (8) years of proven experience in software engineering, AI engineering, cloud engineering, or a similar role.&hellip;
      
        Skills: Cloud infrastructure, Azure, Cloud architecture, Software troubleshooting, Software deployment
      
    "
 Data scientist ,United States,4.1,McKinsey & Company,"Senior Data Scientist II - Growth, Marketing & Sales - Retail","Atlanta, GA",$119K - $184K (Glassdoor est.),7d,https://www.glassdoor.com/partner/jobListing.htm?pos=708&ao=1136043&s=58&guid=0000019601b7cbf8a1ecdb5fd5fa96d6&src=GD_JOB_AD&t=SR&vt=w&cs=1_e7e264f1&cb=1743785545424&jobListingId=1009688940023&jrtk=5-yul1-0-1io0rfj4021g2000-8065654def09f5df,"5+ years of experience in the field of consulting and/or development, retail pricing or promotional management with experience in practical data analysis.&hellip;
      
        Skills: Pricing, Management, R, Data analysis skills, Data science
      
    "
 Data scientist ,United States,4.2,Delta Airlines,Senior Technical Product Owner - Artificial Intelligence,"Atlanta, GA",,7d,https://www.glassdoor.com/partner/jobListing.htm?pos=709&ao=1136043&s=58&guid=0000019601b7cbf8a1ecdb5fd5fa96d6&src=GD_JOB_AD&t=SR&vt=w&cs=1_d3985b62&cb=1743785545426&jobListingId=1009688402896&jrtk=5-yul1-0-1io0rfj4021g2000-49d0940b127ab34e,"Bachelor’s degree in Computer Science, Electronics Engineering, or a related field, and 5 years of experience in IT.&hellip;
      
        Skills: Jira, LabView, Statistics, MATLAB, Microsoft Excel
      
    "
 Data scientist ,United States,5.0,Amazee Global Ventures Inc,Senior Data Scientist,"Iowa City, IA",$55.00 - $60.00 Per Hour (Employer est.),8d,https://www.glassdoor.com/partner/jobListing.htm?pos=710&ao=1136043&s=58&guid=0000019601b7cbf8a1ecdb5fd5fa96d6&src=GD_JOB_AD&t=SR&vt=w&ea=1&cs=1_34719514&cb=1743785545426&jobListingId=1009686980268&jrtk=5-yul1-0-1io0rfj4021g2000-d0506fc6984f8432,"Promote ethical AI practices and stay informed of best practices in the data science field. *Technical Strengths:* Skilled in big data analysis, programming,…&hellip;
      
        Skills: Statistics, Data modeling, SAS, Big data, Software deployment
      
    "
 Data scientist ,United States,4.1,"Merz Pharmaceuticals, LLC","Data Science Lead, Healthcare Insights","Raleigh, NC",$95K - $144K (Glassdoor est.),8d,https://www.glassdoor.com/partner/jobListing.htm?pos=711&ao=1136043&s=58&guid=0000019601b7cbf8a1ecdb5fd5fa96d6&src=GD_JOB_AD&t=SR&vt=w&ea=1&cs=1_96e5c99f&cb=1743785545425&jobListingId=1009686723777&jrtk=5-yul1-0-1io0rfj4021g2000-d03210d8149d8640,"Bachelors in Data Science or Science, Technology, Engineering, or Mathematics related field required. Master’s degree in Data Science, Statistics, or a related…&hellip;
      
        Skills: Machine learning, Data analytics, Organizational skills, Regression analysis, Data science
      
    "
 Data scientist ,United States,5.0,Information Technology Senior Management Forum,"Senior Associate, Data Science","McLean, VA",$133K - $152K (Employer est.),7d,https://www.glassdoor.com/partner/jobListing.htm?pos=712&ao=1136043&s=58&guid=0000019601b7cbf8a1ecdb5fd5fa96d6&src=GD_JOB_AD&t=SR&vt=w&cs=1_e7b133c4&cb=1743785545425&jobListingId=1009688301420&jrtk=5-yul1-0-1io0rfj4021g2000-91536fa4be6a467d,"A Bachelor's Degree in a quantitative field (Statistics, Economics, Operations Research, Analytics, Mathematics, Computer Science, or a related quantitative…&hellip;
      
        Skills: SQL, AWS, Machine learning, Scripting, Data analytics
      
    "
 Data scientist ,United States,4.5,Blue Coding,Machine Learning Operations Engineer (V),Remote,,13d,https://www.glassdoor.com/partner/jobListing.htm?pos=713&ao=1136043&s=58&guid=0000019601b7cbf8a1ecdb5fd5fa96d6&src=GD_JOB_AD&t=SR&vt=w&cs=1_76887501&cb=1743785545427&jobListingId=1009681938297&jrtk=5-yul1-0-1io0rfj4021g2000-d70efb17c38c84d7,"A bachelor’s degree in computer science, information systems, related field, or equivalent work experience. Collaborate with data scientists, ML engineers, and…&hellip;
      
        Skills: Jira, TensorFlow, CI/CD, Computer science, Go
      
    "
 Data scientist ,United States,4.0,AbbVie,"Manager, Statistical Programming","Hartford, CT",$102K - $145K (Glassdoor est.),8d,https://www.glassdoor.com/partner/jobListing.htm?pos=714&ao=1136043&s=58&guid=0000019601b7cbf8a1ecdb5fd5fa96d6&src=GD_JOB_AD&t=SR&vt=w&ea=1&cs=1_788617d8&cb=1743785545425&jobListingId=1009686619276&jrtk=5-yul1-0-1io0rfj4021g2000-40f734337d51ba71,"MS in Statistics, Computer Science or a related field with 8+ years of relevant experience. OR BS in Statistics, Computer Science or a related field with 10+…&hellip;
      
        Skills: SAS, CDISC standards, Organizational skills, Leadership
      
    "
 Data scientist ,United States,4.7,ImagineX Consulting,Data Engineering & AI/ML Practice Lead,Remote,,9d,https://www.glassdoor.com/partner/jobListing.htm?pos=715&ao=1136043&s=58&guid=0000019601b7cbf8a1ecdb5fd5fa96d6&src=GD_JOB_AD&t=SR&vt=w&ea=1&cs=1_2bbabeff&cb=1743785545425&jobListingId=1009685523510&jrtk=5-yul1-0-1io0rfj4021g2000-f5b69991a8ed312e,"Strategic Insight: Proven ability to align technical solutions with business objectives while driving process innovation and change management.&hellip;
      
        Skills: Management, Analysis skills, Software development, AI, Leadership
      
    "
 Data scientist ,United States,4.2,"Availity, LLC.",Machine Learning Engineer III,Remote,,10d,https://www.glassdoor.com/partner/jobListing.htm?pos=716&ao=1136043&s=58&guid=0000019601b7cbf8a1ecdb5fd5fa96d6&src=GD_JOB_AD&t=SR&vt=w&cs=1_9289c8d5&cb=1743785545426&jobListingId=1009685158457&jrtk=5-yul1-0-1io0rfj4021g2000-e7369f362df0f2e5,"This “Data science Operations Engineer” focused role is for an engineer who is a data science cloud architect and tools expert with specialized skills in data…&hellip;
      
        Skills: Jira, CI/CD, Cloud architecture, Kubernetes, DevOps
      
    "
 Data scientist ,United States,4.0,Virginia Commonwealth University,Postdoctoral Research Fellow- Mathematics & Applied Mathematics,"Richmond, VA",$48K - $80K (Glassdoor est.),13d,https://www.glassdoor.com/partner/jobListing.htm?pos=717&ao=1136043&s=58&guid=0000019601b7cbf8a1ecdb5fd5fa96d6&src=GD_JOB_AD&t=SR&vt=w&cs=1_e7be2c3e&cb=1743785545426&jobListingId=1009682270196&jrtk=5-yul1-0-1io0rfj4021g2000-6f02e241e5c71308,"As a Postdoctoral Research Fellow, you will be instrumental in driving research on student interactions and belonging within active learning undergraduate…&hellip;
      
        Skills: Qualitative research, Research, Analysis skills, Math
      
    "
 Data scientist ,United States,4.1,Apple,"AIML - Sr. Data Scientist, Smart Home Devices","Seattle, WA",$135K - $251K (Employer est.),8d,https://www.glassdoor.com/partner/jobListing.htm?pos=718&ao=1136043&s=58&guid=0000019601b7cbf8a1ecdb5fd5fa96d6&src=GD_JOB_AD&t=SR&vt=w&cs=1_3f792ea2&cb=1743785545426&jobListingId=1009686622205&jrtk=5-yul1-0-1io0rfj4021g2000-3980ccca7ae41aac,"Master’s Degree in a technical or quantitative field such as; Statistics, Mathematics, Computer Science, Engineering, Economics or Physics.&hellip;
      
        Skills: SQL, Presentation skills, Machine learning, Deep learning, Natural language processing
      
    "
 Data scientist ,United States,5.0,Information Technology Senior Management Forum,"Senior Associate, Data Scientist - Upmarket Credit Line Increase Program","McLean, VA",$133K - $152K (Employer est.),10d,https://www.glassdoor.com/partner/jobListing.htm?pos=719&ao=1136043&s=58&guid=0000019601b7cbf8a1ecdb5fd5fa96d6&src=GD_JOB_AD&t=SR&vt=w&cs=1_c625770f&cb=1743785545427&jobListingId=1009684158114&jrtk=5-yul1-0-1io0rfj4021g2000-df2a17331724e7ea,"A Bachelor's Degree in a quantitative field (Statistics, Economics, Operations Research, Analytics, Mathematics, Computer Science, or a related quantitative…&hellip;
      
        Skills: Spark, R, SQL, AWS, Analysis skills
      
    "
 Data scientist ,United States,4.3,"University of California, Riverside",Postdoctoral Scholar - Advanced Statistical Modeling,"Riverside, CA",$67K - $80K (Employer est.),7d,https://www.glassdoor.com/partner/jobListing.htm?pos=720&ao=1136043&s=58&guid=0000019601b7cbf8a1ecdb5fd5fa96d6&src=GD_JOB_AD&t=SR&vt=w&ea=1&cs=1_9e637641&cb=1743785545427&jobListingId=1009688181365&jrtk=5-yul1-0-1io0rfj4021g2000-ef8bdcad3287f739,"A Ph.D. in quantitative psychology, statistics, biostatistics, data science, or related field. A Ph.D. in quantitative psychology, statistics, biostatistics,…&hellip;
      
        Skills: Statistical software, R, Data analysis skills, Statistical analysis, Analysis skills
      
    "
 Data scientist ,United States,4.1,Honeywell,Sr. Customer Experience Specialist - Dispatch Data Analyst,"Raleigh, NC",,8d,https://www.glassdoor.com/partner/jobListing.htm?pos=721&ao=1136043&s=58&guid=0000019601b7cbf8a1ecdb5fd5fa96d6&src=GD_JOB_AD&t=SR&vt=w&cs=1_132615f7&cb=1743785545427&jobListingId=1009686785140&jrtk=5-yul1-0-1io0rfj4021g2000-038eb9751b1400c9,"Proficient in data analysis and reporting tools. Bachelor's degree in Business Administration or a related field. Strong analytical and problem-solving skills.&hellip;
      
        Skills: Microsoft Excel, Management, Customer service, Data analysis skills, Process improvement
      
    "
 Data scientist ,United States,4.0,Waymo,"Staff Product Data Scientist, Marketplace Management","Mountain View, CA",$230K - $292K (Employer est.),7d,https://www.glassdoor.com/partner/jobListing.htm?pos=722&ao=1136043&s=58&guid=0000019601b7cbf8a1ecdb5fd5fa96d6&src=GD_JOB_AD&t=SR&vt=w&cs=1_f1048e72&cb=1743785545427&jobListingId=1009688153017&jrtk=5-yul1-0-1io0rfj4021g2000-d2239fb06c67cc85,"8+ years of industry experience solving data science problems (or 5+ years of experience with a PhD in a quantitative field).&hellip;
      
        Skills: SQL, Data science, Data visualization, Leadership, Communication skills
      
    "
 Data scientist ,United States,4.1,Samsara,Senior Data Science and Analytics Manager,"Los Angeles, CA",$119K - $180K (Employer est.),9d,https://www.glassdoor.com/partner/jobListing.htm?pos=723&ao=1136043&s=58&guid=0000019601b7cbf8a1ecdb5fd5fa96d6&src=GD_JOB_AD&t=SR&vt=w&cs=1_da245582&cb=1743785545428&jobListingId=1009685454510&jrtk=5-yul1-0-1io0rfj4021g2000-a34787f69ad1db55,"5+ years of relevant data science or advanced analytics work experience and 3+ years of experience building and deploying predictive models to inform company…&hellip;
      
        Skills: Web analytics, R, Marketing mix modeling, Tableau, SQL
      
    "
 Data scientist ,United States,4.4,State Compensation Insurance Fund,RESEARCH DATA SPECIALIST II,California,$7K - $9K (Employer est.),9d,https://www.glassdoor.com/partner/jobListing.htm?pos=724&ao=1136043&s=58&guid=0000019601b7cbf8a1ecdb5fd5fa96d6&src=GD_JOB_AD&t=SR&vt=w&cs=1_188fecb9&cb=1743785545428&jobListingId=1009685800608&jrtk=5-yul1-0-1io0rfj4021g2000-f7258a04273b6774,"This position will also be responsible for leading efforts to develop, design, and execute strategies for automating the control testing for 2-3 Model Audit…&hellip;
      
        Skills: Power BI, Business intelligence, Data analysis skills, Data analytics, Data visualization
      
    "
 Data scientist ,United States,4.2,Adobe,Senior Machine Learning Engineer,"San Jose, CA",$162K - $301K (Employer est.),8d,https://www.glassdoor.com/partner/jobListing.htm?pos=725&ao=1136043&s=58&guid=0000019601b7cbf8a1ecdb5fd5fa96d6&src=GD_JOB_AD&t=SR&vt=w&cs=1_c55484ca&cb=1743785545428&jobListingId=1009686894011&jrtk=5-yul1-0-1io0rfj4021g2000-5f0568cb35bc6261,"Collaborate with product management and engineering groups to develop new products and features. We are looking for someone who will apply AI and machine…&hellip;
      
        Skills: TensorFlow, Data mining, Computer vision, Objective-C, Java
      
    "
 Data scientist ,United States,4.0,Freshfields Bruckhaus Deringer LLP,AI & Innovation Learning Leader,"New York, NY",$150K - $200K (Employer est.),9d,https://www.glassdoor.com/partner/jobListing.htm?pos=726&ao=1136043&s=58&guid=0000019601b7cbf8a1ecdb5fd5fa96d6&src=GD_JOB_AD&t=SR&vt=w&cs=1_aa74b821&cb=1743785545428&jobListingId=1009685611903&jrtk=5-yul1-0-1io0rfj4021g2000-d2904de715de4cf0,"Proven experience in developing and implementing learning programs, preferably in the field of Artificial Intelligence or related technologies.&hellip;
      
        Skills: Management, Project management, Organizational skills, LMS, AI
      
    "
 Data scientist ,United States,4.0,Sanofi,Associate Statistical Project Leader,"Cambridge, MA",$122K - $177K (Employer est.),13d,https://www.glassdoor.com/partner/jobListing.htm?pos=727&ao=1136043&s=58&guid=0000019601b7cbf8a1ecdb5fd5fa96d6&src=GD_JOB_AD&t=SR&vt=w&cs=1_d664ed13&cb=1743785545428&jobListingId=1009682083439&jrtk=5-yul1-0-1io0rfj4021g2000-1f5732b279a8b68d,"Provide high quality input into the design of the clinical study (including protocol development), the setup and conduct of the study to make sure data are…&hellip;
      
        Skills: Clinical research, Clinical development, SAS, R, English
      
    "
 Data scientist ,United States,4.2,Toyota Research Institute,Senior Machine Learning Researcher,"Los Altos, CA",$202K - $302K (Employer est.),8d,https://www.glassdoor.com/partner/jobListing.htm?pos=728&ao=1136043&s=58&guid=0000019601b7cbf8a1ecdb5fd5fa96d6&src=GD_JOB_AD&t=SR&vt=w&cs=1_08687f4d&cb=1743785545428&jobListingId=1009686786895&jrtk=5-yul1-0-1io0rfj4021g2000-69fbace52ce38569,"Conduct ambitious research to advance the state-of-the-art in using new capabilities in generative AI (e.g., recent results in diffusion policy [1],[2]) for end…&hellip;
      
        Skills: C++, Machine learning, Linux, AI, Robotics
      
    "
 Data scientist ,United States,4.4,NYU Langone Health,Senior Data Analyst,"New York, NY",$68K - $93K (Employer est.),13d,https://www.glassdoor.com/partner/jobListing.htm?pos=729&ao=1136043&s=58&guid=0000019601b7cbf8a1ecdb5fd5fa96d6&src=GD_JOB_AD&t=SR&vt=w&cs=1_4edec646&cb=1743785545428&jobListingId=1009682143228&jrtk=5-yul1-0-1io0rfj4021g2000-2f53dda6ed77032e,"5+ years of experience in health sciences research, public health, or a related field. Specifically, the Senior Data Analyst will lead data extraction and…&hellip;
      
        Skills: ArcGIS, Customer service, R, Data analysis skills, Research
      
    "
 Data scientist ,United States,4.5,Noblis,Senior Data Analyst,"Bethesda, MD",$118K - $184K (Employer est.),13d,https://www.glassdoor.com/partner/jobListing.htm?pos=730&ao=1136043&s=58&guid=0000019601b7cbf8a1ecdb5fd5fa96d6&src=GD_JOB_AD&t=SR&vt=w&cs=1_68da1d7a&cb=1743785545428&jobListingId=1009681975751&jrtk=5-yul1-0-1io0rfj4021g2000-3e102a659ebce994,"Experience with data science tools and languages, such as Python, R, and Scala, in various data science environments. Doctorate degree in technical domain.&hellip;
      
        Skills: Power BI, Management, Cloud architecture, Data structures, R
      
    "
 Data scientist ,United States,4.3,Ansys,R&D Engineer II - Deep Learning in Quantum,"Cottonwood Heights, UT",$94K - $135K (Glassdoor est.),9d,https://www.glassdoor.com/partner/jobListing.htm?pos=801&ao=1110586&s=58&guid=0000019601b7e8d9b29f1a7f5102c660&src=GD_JOB_AD&t=SR&vt=w&cs=1_44e21905&cb=1743785552575&jobListingId=1009685572915&cpc=AC285F3A3ECA6BB0&jrtk=5-yul1-0-1io0rfq8si96n800-dfef3866bc63110d---6NYlbfkN0C_VxUQDhzcEtU5UIQUIXNdycmbXVRtU8htuAzRK_ilEq88FSnkbh8bK7OHsM_2RDTbaFQHzVjlEjj41-t56z6_5StLMca9_vLaukVYLQ2CSLhg80n5YYIdCLhn2Kw68mXPoJVEEhSTD4vcD7WzR6cF6jmabKhViy8t-3byEo8LYAuUVsE_qz8rJmDs50a8Q0A3nDw2RiwcVEO2SSAo6QqXqtTFv10uaTJT3VmJ1hyph_FmwUgdjgiFvHy0e7aFLa7SZSpj5xNJ_SDtWZyznGapUcmN08xkl2x-JZUqpEdVdqdc8Qfa4_ZvMiDvZF7g9h4HZxmpezzWQW9I0kqpafT4c0BG6uy4cAIXEaHohCLP2l3OI9yClMvW6KVZsn1ALRl9pv4ftcCKaVANhCLfVqJV-DnQHDRpsXHorFEZ13YbV5vF6IQMiO4i9SpnJWZg04CG4gUSh29JH0fysFo6TuUORQ_l6vMoRfcKFG2e1vqVHFykgxjkclbwG3KyPmIIJrkCFAdDlVKCQybRIvWmNwz4ZuBsRDioRstjicvAG_Xn5pJ8vwhseueLSyLNkxQyXP5KVNrRNZwCcyVHUpOYKZNYQL17_UfsBoDduGBtrazjqHVkZQKb6DBuC6jULk6DUx_gK38MyMOq3gU64DRuCmFRKm0xCjnPb2QoJ4IDCuWPxEdXw4QLbyWWplR--iO4ALkD1CeTTC8APeliv9nuDjWKWLWVzpohk26KHtIqFVdV43OV2zdmRpk8bKjZ8-36lQi7kH7eaEVyOpGOBi12YY_mc5arWhIlhkk4AM6ZeG0i51Dhul7-e2bSvaPdX6NJnQCawe-W4_rNFeggmLEoo77PV-vYMWVK-R-o4LwbUZ0ArsloWkhFwOmkeM0PHndPCZ1chhN_n0nzHeRKKR0HkXnIfcc9aW1EbHo5ibmtTDFeUhBkW4eT8fUyQfv5tbLc3pSoAd8JaMTOpAp2wK8ytblEfERp_73D_Z9rdUR6CfNjf-x8Hs-D3vedWN1HKEIMyuzLl_JeXsYm6L5nyTcz8G-AaWlx8UooCkiCCqI-GTxPYkg0IKcovKmd-Nn-gTJGiLapc2HKbn3sEtdGoRP2mcZ_BZM5ondCPTdo3MkH5PurWvNeNZWLOFEBmsGukQ-YIXKGWeoyFa1nrXRU2H_5_QQKvtyiycXU2D374iWxC0Zq-JPkpNK0IAwkHS2AFWZmVLRVFYIoXlJWqoH986YobJO8uNc1ZYA4cR87Y7ZbrsA2Rkpq6nLw25Lez0fLVtA3wMBR1fikfvS9FQ4iVQWcK9t-lC-1SWLM-DTZDRWd6Al_QrKfYlw07QeKJb202fYSdI-9WwijyIegivgfNUZ_SC1M,"BS in Engineering, Computer Science, or related field. Research and prototype existing deep learning, generative AI or RL tools to improve quantum algorithms…&hellip;
      
        Skills: Computer science, C++, Deep learning, Software development, AI
      
    "
 Data scientist ,United States,4.3,Google,"Principal, Emerging AI Strategy","Washington, DC",,9d,https://www.glassdoor.com/partner/jobListing.htm?pos=802&ao=1136043&s=58&guid=0000019601b7e8d9b29f1a7f5102c660&src=GD_JOB_AD&t=SR&vt=w&cs=1_18535301&cb=1743785552575&jobListingId=1009686421101&jrtk=5-yul1-0-1io0rfq8si96n800-47f4b49861b49f9a,"Excellent verbal and written communication skills with the ability to articulate concepts to both technical and non-technical stakeholders to influence decision…&hellip;
      
        Skills: Google Ads, AI, Communication skills
      
    "
 Data scientist ,United States,4.2,Sidley Austin LLP,"Lead, Spend Data Analytics","Chicago, IL",$146K - $160K (Employer est.),7d,https://www.glassdoor.com/partner/jobListing.htm?pos=803&ao=1136043&s=58&guid=0000019601b7e8d9b29f1a7f5102c660&src=GD_JOB_AD&t=SR&vt=w&cs=1_8de8a06d&cb=1743785552575&jobListingId=1009688302890&jrtk=5-yul1-0-1io0rfq8si96n800-18fad4b62bbd561b,"Bachelor's degree in a quantitative field such as statistics, applied mathematics, financial mathematics, computer science, engineering, operations research, or…&hellip;
      
        Skills: Data mining, Spark, R, Apache Hive, Java
      
    "
