Keyword,Location,rating,Company,Job_title,Place,salary,post_date,Job_URLs,Job_description
 Data scientist ,United States,4.0,City of Austin,IT Data Analyst or IT Data Analyst Senior,"Austin, TX",$32.23 - $47.98 Per Hour (Employer est.),17d,https://www.glassdoor.com/partner/jobListing.htm?pos=1018&ao=1136043&s=58&guid=0000019601b8253ab0bfc160b185e3ff&src=GD_JOB_AD&t=SR&vt=w&cs=1_7a660e34&cb=1743785568000&jobListingId=1009676181338&jrtk=5-yul1-0-1io0rg9bfkuq9800-8120d839474a6135,"Graduation with a Bachelor’s degree from an accredited college or university with major course work in a field related to the job plus two (2) years’ related…&hellip;
      
        Skills: ArcGIS, Microsoft Excel, Data mining, R, Analysis skills
      
    "
 Data scientist ,United States,4.3,Innova IT Services LLC,Senior Data Analyst,Arizona,$90K - $95K (Employer est.),16d,https://www.glassdoor.com/partner/jobListing.htm?pos=1019&ao=1136043&s=58&guid=0000019601b8253ab0bfc160b185e3ff&src=GD_JOB_AD&t=SR&vt=w&ea=1&cs=1_c39e843d&cb=1743785568000&jobListingId=1009678731618&jrtk=5-yul1-0-1io0rg9bfkuq9800-f5b5c31caa4a0e4d,"Creating appropriate documentation that allows stakeholders to understand the steps of the data analysis process and duplicate or replicate the analysis if…&hellip;
      
        Skills: Cloud infrastructure, Microsoft Excel, Cloud architecture, Waterfall, Kanban
      
    "
 Data scientist ,United States,5.0,Amazee Global Ventures Inc,Senior Machine Learning Engineer,"Bentonville, AR",$55.00 - $60.00 Per Hour (Employer est.),18d,https://www.glassdoor.com/partner/jobListing.htm?pos=1020&ao=1136043&s=58&guid=0000019601b8253ab0bfc160b185e3ff&src=GD_JOB_AD&t=SR&vt=w&ea=1&cs=1_f998c85b&cb=1743785568001&jobListingId=1009675616885&jrtk=5-yul1-0-1io0rg9bfkuq9800-1112847086049fd1,"*Product Development Collaboration:* Partner with cross-functional teams to design, develop, and deliver innovative solutions aligned with client needs and…&hellip;
      
        Skills: TensorFlow, Statistics, Big data, Java, SQL
      
    "
 Data scientist ,United States,4.3,Purdue University,Senior Research Data Analyst,Remote,,20d,https://www.glassdoor.com/partner/jobListing.htm?pos=1021&ao=1136043&s=58&guid=0000019601b8253ab0bfc160b185e3ff&src=GD_JOB_AD&t=SR&vt=w&cs=1_e1f60773&cb=1743785568000&jobListingId=1009673653174&jrtk=5-yul1-0-1io0rg9bfkuq9800-8b1db00fc7c48e22,"In either case, experience must include (1) Visualizing data in business intelligence tools, (2) Working with data governance tools or data definition…&hellip;
      
        Skills: Cognos, SQL, PL/SQL
      
    "
 Data scientist ,United States,4.1,GE Aerospace,Staff Data Scientist,"Atlanta, GA",,14d,https://www.glassdoor.com/partner/jobListing.htm?pos=1022&ao=1136043&s=58&guid=0000019601b8253ab0bfc160b185e3ff&src=GD_JOB_AD&t=SR&vt=w&cs=1_b7648050&cb=1743785568001&jobListingId=1009680483369&jrtk=5-yul1-0-1io0rg9bfkuq9800-18f7fae37185e60e,"You will be part of a data science or cross-disciplinary team driving AI business solutions involving large, complex data sets.&hellip;
      
        Skills: Computer vision, Military, Google Cloud Platform, AWS, Analysis skills
      
    "
 Data scientist ,United States,4.1,University of Oklahoma,Senior Data Analyst,"Oklahoma City, OK",$87K (Employer est.),15d,https://www.glassdoor.com/partner/jobListing.htm?pos=1023&ao=1136043&s=58&guid=0000019601b8253ab0bfc160b185e3ff&src=GD_JOB_AD&t=SR&vt=w&cs=1_fe1cea73&cb=1743785568001&jobListingId=1009678976862&jrtk=5-yul1-0-1io0rg9bfkuq9800-abb51ae142732274,"48 months experience as a Data Analyst or in related field. Equivalency/Substitution: Will accept 48 months data analysis, business analysis experience in lieu…&hellip;
      
        Skills: Data mining, Relational databases, Data structures, Business analysis, Data analysis skills
      
    "
 Data scientist ,United States,4.2,Adobe,Sr AI Engineer,"San Francisco, CA",$154K - $287K (Employer est.),19d,https://www.glassdoor.com/partner/jobListing.htm?pos=1024&ao=1136043&s=58&guid=0000019601b8253ab0bfc160b185e3ff&src=GD_JOB_AD&t=SR&vt=w&cs=1_0eb28d02&cb=1743785568001&jobListingId=1009674515717&jrtk=5-yul1-0-1io0rg9bfkuq9800-a7441dc58b913ddd,"Design and implement data organization and retrieval mechanisms for AI agents using vector databases and knowledge graphs.&hellip;
      
        Skills: Computer science, Windows, Databases, Software development, AI
      
    "
 Data scientist ,United States,4.0,"Shermco Industries, Inc.",Sr CRM Sales Data Analyst,"Houston, TX",$90K - $110K (Employer est.),16d,https://www.glassdoor.com/partner/jobListing.htm?pos=1025&ao=1136043&s=58&guid=0000019601b8253ab0bfc160b185e3ff&src=GD_JOB_AD&t=SR&vt=w&cs=1_03896d7d&cb=1743785568001&jobListingId=1009678252355&jrtk=5-yul1-0-1io0rg9bfkuq9800-4250b0f489942a1d,"We are seeking a Sr. CRM Sales Data Analyst to support our Executive Sales Leadership team with data analytics and reporting and also develop presentations for…&hellip;
      
        Skills: Power BI, Microsoft Excel, Sales, Salesforce, Data analysis skills
      
    "
 Data scientist ,United States,5.0,Amazee Global Ventures Inc,Lead Data Scientist,"Trenton, NJ",$55.00 - $60.00 Per Hour (Employer est.),18d,https://www.glassdoor.com/partner/jobListing.htm?pos=1026&ao=1136043&s=58&guid=0000019601b8253ab0bfc160b185e3ff&src=GD_JOB_AD&t=SR&vt=w&ea=1&cs=1_c1bf3334&cb=1743785568002&jobListingId=1009675705989&jrtk=5-yul1-0-1io0rg9bfkuq9800-4f2d5daf714e58f5,"Partner with cross-functional teams—such as sales, marketing, product, and engineering—to design data-driven solutions aimed at enhancing customer experience…&hellip;
      
        Skills: Statistics, Power BI, Microsoft Excel, Data mining, Management
      
    "
 Data scientist ,United States,4.0,JPMorganChase,Lead Data Scientist,"Columbus, OH",$122K - $175K (Glassdoor est.),14d,https://www.glassdoor.com/partner/jobListing.htm?pos=1027&ao=1136043&s=58&guid=0000019601b8253ab0bfc160b185e3ff&src=GD_JOB_AD&t=SR&vt=w&cs=1_caaf0e09&cb=1743785568001&jobListingId=1009680915043&jrtk=5-yul1-0-1io0rg9bfkuq9800-4e150d03bbe28382,"Bachelors or Master's degree with at least 5 years of experience in computer science, statistics, artificial intelligence, machine learning, or a related field…&hellip;
      
        Skills: TensorFlow, CI/CD, Statistics, Computer science, Microsoft Excel
      
    "
 Data scientist ,United States,4.0,Logistics Management Institute,Data Analytics & AI Engineering Lead,Remote,$95K - $168K (Employer est.),14d,https://www.glassdoor.com/partner/jobListing.htm?pos=1028&ao=1136043&s=58&guid=0000019601b8253ab0bfc160b185e3ff&src=GD_JOB_AD&t=SR&vt=w&cs=1_de839d60&cb=1743785568001&jobListingId=1009680543853&jrtk=5-yul1-0-1io0rg9bfkuq9800-08964175378aa3ac,"Perform analysis of alternatives (AoA) on analytic tools, data environments, and implementation strategies. This individual will also provide thought leadership…&hellip;
      
        Skills: Statistics, Power BI, Cloud infrastructure, Kanban, R
      
    "
 Data scientist ,United States,4.1,Apple,"Data Science Manager, Maps POI Evaluation","Cupertino, CA",$173K - $301K (Employer est.),14d,https://www.glassdoor.com/partner/jobListing.htm?pos=1029&ao=1136043&s=58&guid=0000019601b8253ab0bfc160b185e3ff&src=GD_JOB_AD&t=SR&vt=w&cs=1_3a350d8b&cb=1743785568001&jobListingId=1009681207189&jrtk=5-yul1-0-1io0rg9bfkuq9800-bbd6a45cb9507843,"In this role, you will: - Provide clear feedback and guidance to your team to enable the development of new leaders - Guide teams in the development of online…&hellip;
      
        Skills: Management, Writing skills, Spark, Data analysis skills, SQL
      
    "
 Data scientist ,United States,4.3,Google,"Data Scientist III, Product, Operations Data Science","San Francisco, CA",,14d,https://www.glassdoor.com/partner/jobListing.htm?pos=1030&ao=1136043&s=58&guid=0000019601b8253ab0bfc160b185e3ff&src=GD_JOB_AD&t=SR&vt=w&cs=1_964a105e&cb=1743785568001&jobListingId=1009680310177&jrtk=5-yul1-0-1io0rg9bfkuq9800-f636440a7d54903d,"Master's degree in Statistics, Mathematics, Data Science, Engineering, Physics, Economics, a related quantitative field, or equivalent practical experience.&hellip;
      
        Skills: Data mining, Data structures, R, Data analysis skills, SQL
      
    "
 Data scientist ,United States,4.1,Lockheed Martin,AI Engineer Sr (Mid-Career) - Classified Deployments / Hybrid,"Fort Worth, TX",$93K - $186K (Employer est.),24h,https://www.glassdoor.com/partner/jobListing.htm?pos=1101&ao=1110586&s=58&guid=0000019601b84289a0505cd6fb34d240&src=GD_JOB_AD&t=SR&vt=w&cs=1_e88141ae&cb=1743785575491&jobListingId=1009698892500&cpc=C4A69CCDBB3B9599&jrtk=5-yul1-0-1io0rggm9k8h5800-e11d32fd4ed7af98---6NYlbfkN0C1ihjj1FYx73_02yGTS96r3SNeUtc-9S9zmnK0ry7bjsylrXdmc2Sqv5lux8xYxDeDVMY4xChyBhBxj9xJVWxu-OYekQHijNx39k0QND_72YbLGb7CVdoA876rgsUHvfigT0kFXhxCe1OGLYWoLv7b4cC5LYDP6aaVRWz4MKo1boPPnAykiMvJolYwUKrFs-Oyh-5FqnbSWx4Kustr3f95X3X4xHHvSegTM1nEjhxQPC2TLFmK_VMonBsG_m_YyKtmdzesuFluayCUzrIbaliqPt67i0lwWVG05Qmah_O8z6SbbEr5QVxIE9FF85e1HL9fu54ww0n-M5EXVfUbD31CiOAAA0-OvNxYHlKmb0JQfychw_BLwG9NKBbUFvCIZnBBbDjnSz6t5rmaOhsB8mkO926HUOhwbBR6H-8XBYX2NMnCZvpagyWC1oWk-VmmTPHoKr_0EpMyUmQB3KRWIviqxPuKatsyQm6ek3grbfUTjwb42HEOfIe95X8UE3FPcN9h9iFP0UxXpjzvr1VByuLN-G3gFsvqNliMOgfUu-L28vJFdfwQROLAYR89XRAB-h8un-wPN_1R8rQCeJDfUm3O0aaVzBnlGUSNtafQXgjz3abJ2fZACv8qy8MlskEZEpM337JdEwYNyj16d5BSEPAM5T-H5Qvvngx2mWncMjL8tku1FY6nLqFs74Wfh3pCuF7FKEz-YS8ujEbvsKoc3oXvS0kMrwpu-Es%3D,"(Washington state applicants only) Non-represented full-time employees: accrue at least 10 hours per month of Paid Time Off (PTO) to be used for incidental…&hellip;
      
        Skills: CI/CD, Azure, Go, Kubernetes, Google Cloud Platform
      
    "
 Data scientist ,United States,4.3,Genworth,"Senior Data Analyst, In-Force Pricing, Long Term Care","Richmond, VA",$63K - $92K (Glassdoor est.),7d,https://www.glassdoor.com/partner/jobListing.htm?pos=1102&ao=1136043&s=58&guid=0000019601b84289a0505cd6fb34d240&src=GD_JOB_AD&t=SR&vt=w&cs=1_d0ca45fd&cb=1743785575490&jobListingId=1009688049490&jrtk=5-yul1-0-1io0rggm9k8h5800-6d6a857e75e26f8f,"Data Analysis & Trending experience with demonstrated proficiency in analytical methodologies, tools, and dashboard development to interpret, visualize,…&hellip;
      
        Skills: Power BI, Data modeling, Microsoft Excel, R, Alteryx
      
    "
 Data scientist ,United States,4.0,RELX,Principal Data Scientist II,"Horsham, PA",$135K - $174K (Glassdoor est.),17d,https://www.glassdoor.com/partner/jobListing.htm?pos=1103&ao=1136043&s=58&guid=0000019601b84289a0505cd6fb34d240&src=GD_JOB_AD&t=SR&vt=w&cs=1_5b6f99e9&cb=1743785575490&jobListingId=1009676264843&jrtk=5-yul1-0-1io0rggm9k8h5800-fe2c4178ced26717,"Assessing the risks associated with AI implementation, including bias, security, and compliance. You will lead development teams in research, design, and…&hellip;
      
        Skills: R, Machine learning, Mentoring, Data science, AI
      
    "
 Data scientist ,United States,4.1,Leonardo.Ai,Senior Machine Learning Engineer,California,,14d,https://www.glassdoor.com/partner/jobListing.htm?pos=1104&ao=1136043&s=58&guid=0000019601b84289a0505cd6fb34d240&src=GD_JOB_AD&t=SR&vt=w&ea=1&cs=1_1c69fac2&cb=1743785575490&jobListingId=1009680922077&jrtk=5-yul1-0-1io0rggm9k8h5800-3ffd86eedbf052b4,"Collaborate with DevOps teams to implement and manage cloud infrastructure, focusing on AWS (e.g., S3, EC2, SageMaker) using tools like Terraform and…&hellip;
      
        Skills: CI/CD, Cloud infrastructure, Kubernetes, DevOps, Spark
      
    "
 Data scientist ,United States,4.4,Cedar Inc,Data Scientist III (Commercial Analytics),United States,$149K - $175K (Employer est.),16d,https://www.glassdoor.com/partner/jobListing.htm?pos=1105&ao=1136043&s=58&guid=0000019601b84289a0505cd6fb34d240&src=GD_JOB_AD&t=SR&vt=w&cs=1_fce0e57f&cb=1743785575490&jobListingId=1009678648810&jrtk=5-yul1-0-1io0rggm9k8h5800-2e570bb475aa2a76,"Design, develop, and optimize comprehensive analytics tooling and dashboards that drive strategic decision-making.&hellip;
      
        Skills: Power BI, Data analysis skills, Tableau, SQL, Medical billing
      
    "
 Data scientist ,United States,4.2,"Ionis Pharmaceuticals, Inc.",Clinical Data Associate - Clinical Data Science,"Carlsbad, CA",$67K - $81K (Employer est.),20d,https://www.glassdoor.com/partner/jobListing.htm?pos=1106&ao=1136043&s=58&guid=0000019601b84289a0505cd6fb34d240&src=GD_JOB_AD&t=SR&vt=w&ea=1&cs=1_447b2228&cb=1743785575490&jobListingId=1009673648176&jrtk=5-yul1-0-1io0rggm9k8h5800-4b18047265669732,"Ability to effectively develop and manage relationships with internal and external stakeholders. Supports the CDM to prepare for study team meetings and…&hellip;
      
        Skills: Microsoft Powerpoint, Microsoft Word, Microsoft Excel, Microsoft Office, Clinical trials
      
    "
 Data scientist ,United States,4.2,Adobe,"Senior Machine Learning Engineer, Digital Video and Audio","Seattle, WA",$183K - $335K (Employer est.),15d,https://www.glassdoor.com/partner/jobListing.htm?pos=1107&ao=1136043&s=58&guid=0000019601b84289a0505cd6fb34d240&src=GD_JOB_AD&t=SR&vt=w&cs=1_c5862ea7&cb=1743785575491&jobListingId=1009678835987&jrtk=5-yul1-0-1io0rggm9k8h5800-fd45cb9ab22695a4,"Master's degree in Computer Science or a related field, or 3 years of industry experience Required expertise in one or more of.&hellip;
      
        Skills: Computer science, Cloud infrastructure, C++, Machine learning, Distributed systems
      
    "
 Data scientist ,United States,4.0,"JMA Solutions, LLC",Senior Data Scientist/Analyst,"Oklahoma City, OK",$125K - $135K (Employer est.),16d,https://www.glassdoor.com/partner/jobListing.htm?pos=1108&ao=1136043&s=58&guid=0000019601b84289a0505cd6fb34d240&src=GD_JOB_AD&t=SR&vt=w&cs=1_e10947a3&cb=1743785575491&jobListingId=1009678335779&jrtk=5-yul1-0-1io0rggm9k8h5800-50630a4374abfe89,"Education: Position requires a Bachelor’s degree in Data Science, Computer Science, Engineering, Mathematics, or a related field, with 8+ years of relevant…&hellip;
      
        Skills: Jira, CI/CD, Software troubleshooting, Kubernetes, SAS
      
    "
 Data scientist ,United States,4.5,RealmOne,Data Scientist 2,Maryland,$119K - $179K (Employer est.),15d,https://www.glassdoor.com/partner/jobListing.htm?pos=1109&ao=1136043&s=58&guid=0000019601b84289a0505cd6fb34d240&src=GD_JOB_AD&t=SR&vt=w&cs=1_b15f2a6c&cb=1743785575492&jobListingId=1009152902603&jrtk=5-yul1-0-1io0rggm9k8h5800-0aecd39c7a0b514e,"Bachelor’s Degree must be in Mathematics, Applied Mathematics Statistics, Applied Statistics, Machine learning, Data Science, Operations Research, or Computer…&hellip;
      
        Skills: Computer science, Data mining, Data structures, Statistical analysis, Analysis skills
      
    "
 Data scientist ,United States,4.1,Apple,Data Science Manager,"Cupertino, CA",$200K - $301K (Employer est.),20d,https://www.glassdoor.com/partner/jobListing.htm?pos=1110&ao=1136043&s=58&guid=0000019601b84289a0505cd6fb34d240&src=GD_JOB_AD&t=SR&vt=w&cs=1_e2e51ffe&cb=1743785575491&jobListingId=1009673545575&jrtk=5-yul1-0-1io0rggm9k8h5800-2c371e1dba34a5ec,"KEY RESPONSIBILITIES: Lead R&D in automated AI evaluation, including development of LLM-based assessment systems that can reliably evaluate model outputs Drive…&hellip;
      
        Skills: Research, Machine learning, AI, Leadership, Communication skills
      
    "
 Data scientist ,United States,4.2,CommandLink,Staff AI/ML Engineer - Smart Voice Agent,Remote,$150K - $200K (Employer est.),16d,https://www.glassdoor.com/partner/jobListing.htm?pos=1111&ao=1136043&s=58&guid=0000019601b84289a0505cd6fb34d240&src=GD_JOB_AD&t=SR&vt=w&ea=1&cs=1_c90e5740&cb=1743785575492&jobListingId=1009677419416&jrtk=5-yul1-0-1io0rggm9k8h5800-150ce64207ff4df0,"As one of the first ML engineers on our team, you will shape the architecture, design, and implementation of cutting-edge conversational AI systems that…&hellip;
      
        Skills: TensorFlow, Software deployment, IT service management, Google Cloud Platform, AWS
      
    "
 Data scientist ,United States,4.0,RELX,Senior Data Scientist III,"Alpharetta, GA",$121K - $151K (Glassdoor est.),16d,https://www.glassdoor.com/partner/jobListing.htm?pos=1112&ao=1136043&s=58&guid=0000019601b84289a0505cd6fb34d240&src=GD_JOB_AD&t=SR&vt=w&cs=1_59bd2b2e&cb=1743785575492&jobListingId=1009678653021&jrtk=5-yul1-0-1io0rggm9k8h5800-b12f1d5e5dca9c66,"Our core expertise lies in mortality risk modeling and analysis, leveraging data from public records, credit history, driving behavior, medical profiles, and…&hellip;
      
        Skills: Medical coding, R, SQL, Statistical analysis, Analysis skills
      
    "
 Data scientist ,United States,4.1,Yale University,"Lead, AI Support Program","New Haven, CT",$66K - $107K (Glassdoor est.),17d,https://www.glassdoor.com/partner/jobListing.htm?pos=1113&ao=1136043&s=58&guid=0000019601b84289a0505cd6fb34d240&src=GD_JOB_AD&t=SR&vt=w&cs=1_54d4a6c7&cb=1743785575492&jobListingId=1009676069102&jrtk=5-yul1-0-1io0rggm9k8h5800-025c9cfaa735e2d7,"The ideal candidate has experience developing or delivering research services in an academic setting, has a deep understanding of the social science research…&hellip;
      
        Skills: R, Research, Machine learning, Organizational skills, APIs
      
    "
 Data scientist ,United States,4.4,Cambridge Mobile Telematics,Senior Data Scientist,"Cambridge, MA",$149K - $202K (Glassdoor est.),15d,https://www.glassdoor.com/partner/jobListing.htm?pos=1114&ao=1136043&s=58&guid=0000019601b84289a0505cd6fb34d240&src=GD_JOB_AD&t=SR&vt=w&cs=1_211ceb54&cb=1743785575500&jobListingId=1009679987085&jrtk=5-yul1-0-1io0rggm9k8h5800-353be6bed11e5d79,"Communicate and present the data science work within the data science team as well as to stakeholders across the org and to collaborate across different teams.&hellip;
      
        Skills: TensorFlow, Statistics, Computer science, Big data, Spark
      
    "
 Data scientist ,United States,4.4,Sprinter Health,Senior Software Engineer - Applied AI,"Menlo Park, CA",$165K - $195K (Employer est.),14d,https://www.glassdoor.com/partner/jobListing.htm?pos=1115&ao=1136043&s=58&guid=0000019601b84289a0505cd6fb34d240&src=GD_JOB_AD&t=SR&vt=w&ea=1&cs=1_20454c4f&cb=1743785575492&jobListingId=1009680205640&jrtk=5-yul1-0-1io0rggm9k8h5800-5acad118d38bd564,"Mentorship & coaching: Ability to guide and develop engineers. Orchestrate multimodal AI agents to streamline patient care navigation.&hellip;
      
        Skills: Elasticsearch, Management, JavaScript, AI, Leadership
      
    "
 Data scientist ,United States,4.0,GSK,Principal Statistician,"Collegeville, PA",$110K - $152K (Glassdoor est.),16d,https://www.glassdoor.com/partner/jobListing.htm?pos=1116&ao=1136043&s=58&guid=0000019601b84289a0505cd6fb34d240&src=GD_JOB_AD&t=SR&vt=w&cs=1_c0f9babc&cb=1743785575493&jobListingId=1009677849968&jrtk=5-yul1-0-1io0rggm9k8h5800-349db3899650ff7c,"Provide statistical input to the design, analysis, reporting and interpretation of clinical studies using a wide range of statistical approaches and/or…&hellip;
      
        Skills: Statistics, Organizational skills, Clinical trials, Communication skills, Time management
      
    "
 Data scientist ,United States,4.1,Hewlett Packard,Senior AI Software Engineer,"Boise, ID",$130K - $201K (Employer est.),17d,https://www.glassdoor.com/partner/jobListing.htm?pos=1117&ao=1136043&s=58&guid=0000019601b84289a0505cd6fb34d240&src=GD_JOB_AD&t=SR&vt=w&cs=1_4835b070&cb=1743785575498&jobListingId=1009677078006&jrtk=5-yul1-0-1io0rggm9k8h5800-703323c3736993a0,"This role is hands-on, contributing to technical need analysis, project management, and the implementation of modern AI models.&hellip;
      
        Skills: TensorFlow, Computer science, C#, Java, C++
      
    "
 Data scientist ,United States,4.3,MIT,"Senior Data Analyst and Reporting Specialist,OER","Cambridge, MA",$97K - $163K (Employer est.),20d,https://www.glassdoor.com/partner/jobListing.htm?pos=1118&ao=1136043&s=58&guid=0000019601b84289a0505cd6fb34d240&src=GD_JOB_AD&t=SR&vt=w&cs=1_46dac411&cb=1743785575494&jobListingId=1009673609745&jrtk=5-yul1-0-1io0rggm9k8h5800-2b23514cf9d0ffdd,"SENIOR DATA ANALYST AND REPORTING SPECIALIST, OER, Sloan Office of External Relations, to lead the development and execution of MIT Sloan's Office of External…&hellip;
      
        Skills: CRM software, Microsoft Excel, Oracle, Relational databases, Salesforce
      
    "
 Data scientist ,United States,4.0,Experian,"Staff Software Engineer, Analytics & AI Architecture",United States,,18d,https://www.glassdoor.com/partner/jobListing.htm?pos=1119&ao=1136043&s=58&guid=0000019601b84289a0505cd6fb34d240&src=GD_JOB_AD&t=SR&vt=w&ea=1&cs=1_3ccb032e&cb=1743785575501&jobListingId=1009675593235&jrtk=5-yul1-0-1io0rggm9k8h5800-c660764f2f8a33c8,"You will work with cross-functional teams to design and implement scalable, cost-effective, and business-led solutions that drive our enterprise's AI-powered…&hellip;
      
        Skills: Live chat, CI/CD, Cloud infrastructure, Cloud architecture, Kubernetes
      
    "
 Data scientist ,United States,4.1,Photon,Senior Data Analyst - Data Analysis,"Las Vegas, NV",$42K - $147K (Employer est.),16d,https://www.glassdoor.com/partner/jobListing.htm?pos=1120&ao=1136043&s=58&guid=0000019601b84289a0505cd6fb34d240&src=GD_JOB_AD&t=SR&vt=w&cs=1_635517a6&cb=1743785575498&jobListingId=1009678026418&jrtk=5-yul1-0-1io0rggm9k8h5800-82b38abaa8798fd4,"This position is available for independent contractors. Master's degree in Statistics, Mathematics, Economics, Computer Science, or a related field.&hellip;
      
        Skills: Computer science, Power BI, Big data, Spark, Data analysis skills
      
    "
 Data scientist ,United States,4.1,Impact Advisors LLC,Data and AI Engagement Lead,United States,$140K - $170K (Employer est.),15d,https://www.glassdoor.com/partner/jobListing.htm?pos=1121&ao=1136043&s=58&guid=0000019601b84289a0505cd6fb34d240&src=GD_JOB_AD&t=SR&vt=w&ea=1&cs=1_49867122&cb=1743785575494&jobListingId=1009678969544&jrtk=5-yul1-0-1io0rggm9k8h5800-ee1e71aadc5cee00,"They will work under the strategic direction of a VP of Analytics, Chief Data Officer or other executive leader and will partner with the transformation team…&hellip;
      
        Skills: Program management, Process improvement, Change management, Project management, SharePoint
      
    "
 Data scientist ,United States,4.0,Grainger,Senior Applied Machine Learning Scientist,"Lake Forest, IL",$122K - $203K (Employer est.),17d,https://www.glassdoor.com/partner/jobListing.htm?pos=1122&ao=1136043&s=58&guid=0000019601b84289a0505cd6fb34d240&src=GD_JOB_AD&t=SR&vt=w&cs=1_d9d6fc14&cb=1743785575494&jobListingId=1009676639819&jrtk=5-yul1-0-1io0rggm9k8h5800-0c57c3539d193572,"Work with a team of product managers, data scientists, data engineers and architects to build targeted products that help customers solve and answer specific…&hellip;
      
        Skills: TensorFlow, Computer science, Kubernetes, Multilingual, Computer vision
      
    "
 Data scientist ,United States,4.1,Amgen,CDnA - Data Science Manager,"Thousand Oaks, CA",$138K - $169K (Employer est.),17d,https://www.glassdoor.com/partner/jobListing.htm?pos=1123&ao=1136043&s=58&guid=0000019601b84289a0505cd6fb34d240&src=GD_JOB_AD&t=SR&vt=w&cs=1_7e2324a9&cb=1743785575494&jobListingId=1009676877675&jrtk=5-yul1-0-1io0rggm9k8h5800-a4682fb36436bebc,"A discretionary annual bonus program, or for field sales representatives, a sales-based incentive plan. Supporting the development of data science, machine…&hellip;
      
        Skills: TensorFlow, SAS, Spark, R, Apache Hive
      
    "
 Data scientist ,United States,4.1,Apple,"Sr. Software Engineer (Data), Ai & Data Platforms","Austin, TX",$156K - $229K (Glassdoor est.),14d,https://www.glassdoor.com/partner/jobListing.htm?pos=1124&ao=1136043&s=58&guid=0000019601b84289a0505cd6fb34d240&src=GD_JOB_AD&t=SR&vt=w&cs=1_b89086a1&cb=1743785575496&jobListingId=1009681207254&jrtk=5-yul1-0-1io0rggm9k8h5800-e90b0def97eff04e,"Understanding of fundamentals of object-oriented design, data structures, algorithm design, and problem solving. Experience in developing with SQL.&hellip;
      
        Skills: Azure, Kubernetes, Big data, Data structures, Spark
      
    "
 Data scientist ,United States,4.4,Sprinter Health,Engineering Manager - AI/Data,"Menlo Park, CA",$170K - $215K (Employer est.),14d,https://www.glassdoor.com/partner/jobListing.htm?pos=1125&ao=1136043&s=58&guid=0000019601b84289a0505cd6fb34d240&src=GD_JOB_AD&t=SR&vt=w&ea=1&cs=1_5d675081&cb=1743785575499&jobListingId=1009680831519&jrtk=5-yul1-0-1io0rggm9k8h5800-5ad72f0bd3649d11,"3+ years of experience managing and growing engineering teams (5-10 engineers), including hiring, mentoring, and performance management.&hellip;
      
        Skills: Growing experience, Management, Node.js, React, Big data
      
    "
 Data scientist ,United States,4.1,University of Massachusetts Medical School,Sr Healthcare Data Analyst,"North Quincy, MA",$92K - $129K (Glassdoor est.),16d,https://www.glassdoor.com/partner/jobListing.htm?pos=1126&ao=1136043&s=58&guid=0000019601b84289a0505cd6fb34d240&src=GD_JOB_AD&t=SR&vt=w&cs=1_9c8b8e1b&cb=1743785575499&jobListingId=1009677646302&jrtk=5-yul1-0-1io0rggm9k8h5800-73921544218b586f,"Master’s degree in a public policy, public administration, economics, health care administration, epidemiology, statistics, or a related field.&hellip;
      
        Skills: Cognos, Data mining, SAS, Customer service, Writing skills
      
    "
