Keyword,Location,rating,Company,Job_title,Place,salary,post_date,Job_URLs,Job_description
 Security analyst ,United States,4.2,FLEXTECHS,Identity/Access Analyst,"Boise, ID",$18.00 - $24.00 Per Hour (Employer est.),24h,https://www.glassdoor.com/partner/jobListing.htm?pos=101&ao=1110586&s=58&guid=00000195fc818e8ca33c15b7fde6f250&src=GD_JOB_AD&t=SR&vt=w&ea=1&cs=1_d663736a&cb=1743698105008&jobListingId=1009697567536&cpc=8A48E7D5890B96AC&jrtk=5-yul1-0-1inu833rpjn35800-2e1f06647afdb8b3---6NYlbfkN0CsCtlpeKn5BYeJlIvBOsXz-EtSqS0G9m5P3xmxrynt8c1aHWNwD585nkIO5N6UItccVAHSH0N0ptFGwqKbmGcSv0Ywg0ojAa7DA6ggDk0jSxRQlr0mN8-2g41cI6XcpKjGEQiDqa3Q9GMgMnwAuGCZtrBg7EFTvx-1ILPWDQU1_svgqZ_mIeTgrdRkavwqCN_gSFYdsmqd-18G8y6pWIOP9Kj5XFZfnnj1jORfyLOQ5XIKNbglRUj65df_eWGdbwuSA73VkVnY1Bl4UKSpCAnCYFoTCM8NUrdQJGcnSV5593zeqIK5OBc3i5x9uzQLK_jHSLsXBwEN6_gVnbqP6OMzoldfylXcNaXsgTNh_ARF9b5FFulSF4h7xW4B_ir1cyrrijxuayKfp1j1FxxKKqp28KBQ-ZysC8PGmmb8m95QKArmN9SYp797PhRksnhJwTCcasv26BZx94AgrCR0KV72QHz7l04K-z8vnQzcXpwBEUtzbicSt1VYubkXlJHJ4N4t55DZSltE9TUTUh4NfkBCWAs3YxVyuTQ7S2aQ2wcc8-iBi6kzbUwYTspdoRekdwQKGOY5S7qp8VZgEWVtuabfBjTQtiqMmCqCre33Nm1vhFJPhqqJYPpx_j3Muao-s1STRoCSsXheQIDSIChF5DSPSBjz3lD23YcTdA62vkVIkTNVzcta2Gqlxe_czh0ITxbc4fVW3NR7HRhZV8YupQhzzwnHHgHVeobTe8IVJHlRbA%3D%3D,"May assess and resolve user access issues to minimize business impact while maintaining alignment with security controls. Job Types: Full-time, Contract.&hellip;
      
        Skills: Authentication, Management, Customer service, Continuous improvement, Identity & access management
      
    "
 Security analyst ,United States,3.7,Broadway Ventures,Cyber Security Analyst,"Dayton, OH",,24h,https://www.glassdoor.com/partner/jobListing.htm?pos=102&ao=1136043&s=58&guid=00000195fc818e8ca33c15b7fde6f250&src=GD_JOB_AD&t=SR&vt=w&cs=1_acc065b8&cb=1743698105008&jobListingId=1009480712967&jrtk=5-yul1-0-1inu833rpjn35800-e2d5a5b81e00ac01,"Candidate MUST have IAT Level II Security+ certification or higher and Certified Ethical Hacker (CEH) within 6 months. Job Type: Full-time, 8 hour shifts, M-F.&hellip;
      
        Skills: Program management, Scripting, Communication skills, Python, Shell Scripting
      
    "
 Security analyst ,United States,,RedCloud Consulting (Adobe),Senior Cyber Defense Analyst,"Lehi, UT",$65.00 - $86.00 Per Hour (Employer est.),24h,https://www.glassdoor.com/partner/jobListing.htm?pos=103&ao=1110586&s=58&guid=00000195fc818e8ca33c15b7fde6f250&src=GD_JOB_AD&t=SR&vt=w&ea=1&cs=1_dcc83257&cb=1743698105008&jobListingId=1009697585112&cpc=32EE424DE2B657EB&jrtk=5-yul1-0-1inu833rpjn35800-c395a29fc87aa7b0---6NYlbfkN0CRkcgO0FkP3_FIgxGiBGYrV_Rc71ShBMLff9Aa_v35L67_yldwWCgt5v4sMctu77T5y1Ta7u2jhTdH1xSI7bJo8AlVetX13nV3FB42GlLAhJyrQRg1lXdhTAkmh2W-0pLNYp915XLxl82Qbh-remb4_K4Nwe4tow4OGJhCUWN4gd8gn-5TKXG8Sd1SUE-kaeGwDn5PAh-TOmpHcbMbij9gZgpAkOCwgSv9Pd72mn58IwjWcfAQmuMkGRE0B4FFZ63anVzQiNFI7O0D-TFEfP2rad9zGyZ0tNNQJ0XRU6DzCg8tlSv18JKLlAkfLKhHmoYOJNgZ9Qejn9vdEsFz8YKEeQItiBovtfPDFLRArJvNjOCWdHrxUFKSmAuyfADMEFM9HmAIaPeSnOeEExgSBv-hTuxd2pgtcBt5iOE248MdrsekyrF0o5aLcXGaTCAqVM9p-CHjOjznnILRiDraldHm-5PvHYd6qiq1VkWZr6BveOL70UJGuRZlttneC99czqo1K1t0Q9-qkN7o8Lkf5HNwRomP8wVh0ScfPdUBraIcaw5SAO0X7_QrImQ_VLVO4O9hBOZWwleG45JGgBXdcoNmN97f_KHBY_vWmy4fZEHGG37B5loEXN4_QRpi0JKsFqMNrmKY5Pjpyvodc48F4ha7vzHq8jR4nXuvozoSHwiAihieE77k4nJxtF7789ScCoiO8lcQ9KMXczHovzQQMDgkshddeYrpij7zb6L5DoNAhw%3D%3D,"*Technical Skills:* Hands-on experience with *Security Information and Event Management (SIEM)* systems and familiarity with a broad set of security tools and…&hellip;
      
        Skills: Security analysis, Analysis skills, Incident response, Case management, Organizational skills
      
    "
 Security analyst ,United States,3.7,Raytheon,"Principal Analyst, Security (CPSO) - Tucson, AZ","Tucson, AZ",$82K - $164K (Employer est.),24h,https://www.glassdoor.com/partner/jobListing.htm?pos=104&ao=1136043&s=58&guid=00000195fc818e8ca33c15b7fde6f250&src=GD_JOB_AD&t=SR&vt=w&cs=1_8975e7ab&cb=1743698105008&jobListingId=1009697423323&jrtk=5-yul1-0-1inu833rpjn35800-45ca115403a222f4,This position may require travel on company business- must possess a valid driver’s license for escorting individuals across business locations.&hellip;
 Security analyst ,United States,3.5,State Street,"Technology Risk Analyst, Officer","Quincy, MA",$70K - $115K (Employer est.),24h,https://www.glassdoor.com/partner/jobListing.htm?pos=105&ao=1136043&s=58&guid=00000195fc818e8ca33c15b7fde6f250&src=GD_JOB_AD&t=SR&vt=w&cs=1_9f00d4a8&cb=1743698105008&jobListingId=1009697372950&jrtk=5-yul1-0-1inu833rpjn35800-445deb2e6d6deb74,"ETRM is a diverse organization with many interconnected activities; accordingly, this role can also provide additional opportunity to the candidate based on…&hellip;
      
        Skills: Microsoft Powerpoint, Power BI, Microsoft Excel, Customer service, Writing skills
      
    "
 Security analyst ,United States,4.1,PG&E Corporation,"Threat Analyst, Career","Concord, CA",$49.03 - $77.88 Per Hour (Employer est.),24h,https://www.glassdoor.com/partner/jobListing.htm?pos=106&ao=1136043&s=58&guid=00000195fc818e8ca33c15b7fde6f250&src=GD_JOB_AD&t=SR&vt=w&cs=1_9564319e&cb=1743698105009&jobListingId=1009697206518&jrtk=5-yul1-0-1inu833rpjn35800-7de82b48f9c4bbab,"The ability to write and convey technical concepts and threats in a non-technical manner. Conducts analysis using a variety of tools and data sets to identify…&hellip;
      
        Skills: Computer science, Operating systems, Writing skills, SOX, Windows
      
    "
 Security analyst ,United States,3.4,7-ELEVEN,Lead IT Risk Management Analyst,"Irving, TX",$89K - $129K (Glassdoor est.),24h,https://www.glassdoor.com/partner/jobListing.htm?pos=107&ao=1136043&s=58&guid=00000195fc818e8ca33c15b7fde6f250&src=GD_JOB_AD&t=SR&vt=w&cs=1_38b410b6&cb=1743698105008&jobListingId=1009697285366&jrtk=5-yul1-0-1inu833rpjn35800-55768872be2de212,"A bachelor's degree or higher in information technology, computer science, or related fields. Critical analysis skills to reduce IT risk at 7-Eleven.&hellip;
      
        Skills: Computer science, PCI, Analysis skills, Project management, NIST standards
      
    "
 Security analyst ,United States,3.3,ASMGi,Cyber Incident Response Analyst,"Cleveland, OH",,24h,https://www.glassdoor.com/partner/jobListing.htm?pos=108&ao=1136043&s=58&guid=00000195fc818e8ca33c15b7fde6f250&src=GD_JOB_AD&t=SR&vt=w&ea=1&cs=1_45f9cda4&cb=1743698105009&jobListingId=1009697338371&jrtk=5-yul1-0-1inu833rpjn35800-bbe239040e5d87f9,"Ability to effectively communicate risk including corrective action plans/recommendations to non-technical audiences including the ASMGi MDR / MSOC plus client…&hellip;
      
        Skills: Writing skills, Regulatory reporting, Microsoft Office, Information security, Presentation skills
      
    "
 Security analyst ,United States,5.0,"Inferno Systems, Inc.",NETWORK SECURITY ANALYST- TS/SCI with Full Scope Poly,"Chantilly, VA",$150K - $275K (Employer est.),24h,https://www.glassdoor.com/partner/jobListing.htm?pos=109&ao=1136043&s=58&guid=00000195fc818e8ca33c15b7fde6f250&src=GD_JOB_AD&t=SR&vt=w&ea=1&cs=1_6995f00b&cb=1743698105010&jobListingId=1009697398078&jrtk=5-yul1-0-1inu833rpjn35800-f8563efd5a549ba2,"Proficiency in PCAP analysis using tools such as Wireshark or Snort, as well as other network analysis data sets and tools such as Red Seal or EnCase.&hellip;
      
        Skills: Ansible, Writing skills, Data analysis skills, Databases, Analysis skills
      
    "
 Security analyst ,United States,3.9,Zachary Piper LLC,Cybersecurity Analyst (TS/SCI),"Fort Meade, MD",$150K - $160K (Employer est.),24h,https://www.glassdoor.com/partner/jobListing.htm?pos=110&ao=1136043&s=58&guid=00000195fc818e8ca33c15b7fde6f250&src=GD_JOB_AD&t=SR&vt=w&cs=1_2124f65c&cb=1743698105010&jobListingId=1009697445302&jrtk=5-yul1-0-1inu833rpjn35800-910ee71fa0cefa84,"Familiarity with all aspects of cybersecurity operations/analysis (e.g., incident response, forensic media analysis, malware analysis/reverse-engineering, cyber…&hellip;
      
        Skills: Analysis skills, Network protocols, Computer networking, Intelligence experience, Cybersecurity
      
    "
 Security analyst ,United States,3.8,Leidos,"Team Lead, Cyber Fusion and Threats Analyst","Odenton, MD",$105K - $189K (Employer est.),24h,https://www.glassdoor.com/partner/jobListing.htm?pos=111&ao=1136043&s=58&guid=00000195fc818e8ca33c15b7fde6f250&src=GD_JOB_AD&t=SR&vt=w&cs=1_21a6120a&cb=1743698105010&jobListingId=1009697439729&jrtk=5-yul1-0-1inu833rpjn35800-ac80268289658d17,"Must have DoD-8570 IAT Level 2 baseline certification (Security+ CE or higher) at start date and be able to obtain CSSP-A certification within 180 days of start…&hellip;
      
        Skills: TCP, Research, DoD experience, Information security, Analysis skills
      
    "
 Security analyst ,United States,3.8,Santander US,Cloud Security Analyst,"Dallas, TX",$81K - $133K (Employer est.),24h,https://www.glassdoor.com/partner/jobListing.htm?pos=112&ao=1136043&s=58&guid=00000195fc818e8ca33c15b7fde6f250&src=GD_JOB_AD&t=SR&vt=w&cs=1_77ac2b70&cb=1743698105009&jobListingId=1009696769895&jrtk=5-yul1-0-1inu833rpjn35800-d558a4c775979ff6,"Ability to conduct thorough risk assessments and develop effective mitigation strategies. Conducts regular security assessments and vulnerability scans using…&hellip;
      
        Skills: Node.js, Mobile applications, Information security, AWS, Splunk
      
    "
 Security analyst ,United States,4.0,JPMorganChase,Attack Analysis - SOC Analyst,"New York, NY",$119K - $150K (Employer est.),24h,https://www.glassdoor.com/partner/jobListing.htm?pos=113&ao=1136043&s=58&guid=00000195fc818e8ca33c15b7fde6f250&src=GD_JOB_AD&t=SR&vt=w&cs=1_caca44c6&cb=1743698105010&jobListingId=1009696803193&jrtk=5-yul1-0-1inu833rpjn35800-7f98144b30277dc6,"Experience with security tools and technologies, including SIEM, intrusion detection systems, log analysis, and malware analysis.&hellip;
      
        Skills: Authentication, TCP, Cloud architecture, Encryption, Windows
      
    "
 Security analyst ,United States,3.0,"Denver, CO Corporate Office",IT Security Analyst,"Greenwood Village, CO",$80K - $90K (Employer est.),24h,https://www.glassdoor.com/partner/jobListing.htm?pos=114&ao=1136043&s=58&guid=00000195fc818e8ca33c15b7fde6f250&src=GD_JOB_AD&t=SR&vt=w&cs=1_0bd9207b&cb=1743698105012&jobListingId=1009697075896&jrtk=5-yul1-0-1inu833rpjn35800-d3f49e73e259da7c,"Perform monthly internal vulnerability scans, research and document remediation steps, disseminate to application/server owners in the field, and track to…&hellip;
      
        Skills: Vulnerability research, PCI, Writing skills, HIPAA, Microsoft Office
      
    "
 Security analyst ,United States,3.8,Verizon,Security Risk Analyst,"Temple Terrace, FL",$82K - $125K (Glassdoor est.),24h,https://www.glassdoor.com/partner/jobListing.htm?pos=115&ao=1136043&s=58&guid=00000195fc818e8ca33c15b7fde6f250&src=GD_JOB_AD&t=SR&vt=w&cs=1_0a4dd573&cb=1743698105010&jobListingId=1009696595113&jrtk=5-yul1-0-1inu833rpjn35800-0b8fe7a5cde0dd1f,"Provide risk consulting and/or training to business and technical partners to improve business effectively protecting information and other projects and duties…&hellip;
      
        Skills: Information security, Project management, Risk analysis, Communication skills, Negotiation
      
    "
 Security analyst ,United States,3.7,"Arrow Electronics, Inc.",IT Data Security Analyst,"Alpharetta, GA",$70K - $121K (Employer est.),24h,https://www.glassdoor.com/partner/jobListing.htm?pos=116&ao=1136043&s=58&guid=00000195fc818e8ca33c15b7fde6f250&src=GD_JOB_AD&t=SR&vt=w&cs=1_e82a4c3e&cb=1743698105012&jobListingId=1009696744425&jrtk=5-yul1-0-1inu833rpjn35800-dd711e59aca8df43,"Excellent communication and presentation skills, including the ability to explain complex technical concepts to non-technical stakeholders.&hellip;
      
        Skills: FedRAMP, COBIT, PCI, Internet of things, IT auditing
      
    "
 Security analyst ,United States,3.8,United Airlines,Analyst - Catering Safety & Security,"Chicago, IL",$65K - $88K (Employer est.),24h,https://www.glassdoor.com/partner/jobListing.htm?pos=117&ao=1136043&s=58&guid=00000195fc818e8ca33c15b7fde6f250&src=GD_JOB_AD&t=SR&vt=w&cs=1_2868a934&cb=1743698105010&jobListingId=1009696766553&jrtk=5-yul1-0-1inu833rpjn35800-c5e210345a4c51c1,"Identify existing and potential hazards and conduct formal analysis of risk levels; recommend risk management processes to control risk of acceptable levels.&hellip;
      
        Skills: Management, Catering, Microsoft Office, Analysis skills, Conflict management
      
    "
 Security analyst ,United States,3.8,Crown Equipment Corporation,Cyber Security Analyst - DLP,"New Bremen, OH",$76K - $112K (Glassdoor est.),24h,https://www.glassdoor.com/partner/jobListing.htm?pos=118&ao=1136043&s=58&guid=00000195fc818e8ca33c15b7fde6f250&src=GD_JOB_AD&t=SR&vt=w&cs=1_934e1b0a&cb=1743698105012&jobListingId=1009696715309&jrtk=5-yul1-0-1inu833rpjn35800-5bfc51a3cc0cc61c,"Oversee the implementation and management of data protection strategies within an organization. Manage and respond to data loss incidents, coordinating with…&hellip;
      
        Skills: Computer science, Encryption, Firewall, Analysis skills, IDS
      
    "
 Security analyst ,United States,4.9,BTS Software Solutions,COMPUTER NETWORK DEFENSE ANALYST (Levels I-IV),"San Antonio, TX",$120K - $260K (Employer est.),24h,https://www.glassdoor.com/partner/jobListing.htm?pos=119&ao=1136043&s=58&guid=00000195fc818e8ca33c15b7fde6f250&src=GD_JOB_AD&t=SR&vt=w&cs=1_e035b747&cb=1743698105010&jobListingId=1009696556815&jrtk=5-yul1-0-1inu833rpjn35800-9d7eff12ed9e4788,"Relevant experience must be in computer or information systems design/development, programming, information/cyber/network security, vulnerability analysis,…&hellip;
      
        Skills: System design, Analysis skills, Computer networking, Computer skills
      
    "
 Security analyst ,United States,3.7,Evolver Inc,Cyber Data Scientist/Analyst,"Washington, DC",$125K - $160K (Employer est.),24h,https://www.glassdoor.com/partner/jobListing.htm?pos=120&ao=1136043&s=58&guid=00000195fc818e8ca33c15b7fde6f250&src=GD_JOB_AD&t=SR&vt=w&ea=1&cs=1_8311dd20&cb=1743698105011&jobListingId=1009696557822&jrtk=5-yul1-0-1inu833rpjn35800-7ab06fbbfa216a9d,"Ability to articulate technical concepts clearly to both technical and non-technical audiences. Bachelor's degree in Computer Science, Information Security,…&hellip;
      
        Skills: CSS, Data analysis skills, Information security, Analysis skills, Machine learning
      
    "
 Security analyst ,United States,4.1,Adapt Forward,Cyber Threat Intel Analyst,"North Charleston, SC",$63K - $111K (Glassdoor est.),24h,https://www.glassdoor.com/partner/jobListing.htm?pos=121&ao=1136043&s=58&guid=00000195fc818e8ca33c15b7fde6f250&src=GD_JOB_AD&t=SR&vt=w&ea=1&cs=1_e77bd28a&cb=1743698105012&jobListingId=1009696607791&jrtk=5-yul1-0-1inu833rpjn35800-13f875e0255a2d10,"Ability to write finished products based off of highly technical subject matter and analysis for dissemination to a less technical or non-technical audience.&hellip;
      
        Skills: TCP, Social media management, Information security, IDS, Network protocols
      
    "
 Security analyst ,United States,4.0,LIGHTFEATHER IO LLC,Cloud Cybersecurity Analyst,"Washington, DC",$114K - $166K (Glassdoor est.),24h,https://www.glassdoor.com/partner/jobListing.htm?pos=122&ao=1136043&s=58&guid=00000195fc818e8ca33c15b7fde6f250&src=GD_JOB_AD&t=SR&vt=w&ea=1&cs=1_3e4427e0&cb=1743698105012&jobListingId=1009696625870&jrtk=5-yul1-0-1inu833rpjn35800-3f6a2cb1287072d9,"Bachelor’s degree in Computer Science, Cyber Security, Information Systems, or a related field. Strong communication skills, with the ability to provide…&hellip;
      
        Skills: Cloud infrastructure, Azure, Management, FedRAMP, Encryption
      
    "
 Security analyst ,United States,3.6,Delphinus Engineering,Information Assurance Analyst,"Norfolk, VA",$68K - $97K (Glassdoor est.),24h,https://www.glassdoor.com/partner/jobListing.htm?pos=123&ao=1136043&s=58&guid=00000195fc818e8ca33c15b7fde6f250&src=GD_JOB_AD&t=SR&vt=w&ea=1&cs=1_7c03f58b&cb=1743698105012&jobListingId=1009697082769&jrtk=5-yul1-0-1inu833rpjn35800-e950f957eb36f334,"Bachelor?s Degree or 5 years? experience in related field. An applicant that can demonstrate expert knowledge in the design, configuration, deployment and…&hellip;
      
        Skills: Software deployment, RBAC, WAN, Cybersecurity
      
    "
 Security analyst ,United States,4.1,JASINT,Functional Analyst Level 2,"Annapolis Junction, MD",$69K - $110K (Employer est.),24h,https://www.glassdoor.com/partner/jobListing.htm?pos=124&ao=1136043&s=58&guid=00000195fc818e8ca33c15b7fde6f250&src=GD_JOB_AD&t=SR&vt=w&ea=1&cs=1_fb248137&cb=1743698105011&jobListingId=1009696557143&jrtk=5-yul1-0-1inu833rpjn35800-c244c02cdde12df7,"JASINT cares about your work-life balance and offers competitive benefits to help you at every stage of your personal and professional life by providing the…&hellip;
      
        Skills: Information security, System testing, Risk management, RMF
      
    "
 Security analyst ,United States,3.3,Texas State Library & Archives Commission,Security Analyst,"Austin, TX",$7K - $8K (Employer est.),24h,https://www.glassdoor.com/partner/jobListing.htm?pos=125&ao=1136043&s=58&guid=00000195fc818e8ca33c15b7fde6f250&src=GD_JOB_AD&t=SR&vt=w&cs=1_090ffdaa&cb=1743698105011&jobListingId=1009696191111&jrtk=5-yul1-0-1inu833rpjn35800-97e46daa6b8c3619,"Graduation from an accredited four-year college or university with major coursework in information technology security, computer information systems, computer…&hellip;
      
        Skills: Operating systems, Management, Security analysis, Writing skills, Information security
      
    "
 Security analyst ,United States,3.3,Health System One,IS Security Analyst,Remote,,24h,https://www.glassdoor.com/partner/jobListing.htm?pos=126&ao=1136043&s=58&guid=00000195fc818e8ca33c15b7fde6f250&src=GD_JOB_AD&t=SR&vt=w&cs=1_5c9c277b&cb=1743698105011&jobListingId=1009696324134&jrtk=5-yul1-0-1inu833rpjn35800-85a1f231aab05c77,"The analyst will develop and enforce comprehensive security policies, conduct regular security audits, and ensure compliance with healthcare industry standards…&hellip;
      
        Skills: HITRUST, Windows, Information security, NIST standards, IT support
      
    "
 Security analyst ,United States,3.8,Webflow,Privacy and Security Analyst,"San Francisco, CA",$102K - $156K (Employer est.),24h,https://www.glassdoor.com/partner/jobListing.htm?pos=127&ao=1136043&s=58&guid=00000195fc818e8ca33c15b7fde6f250&src=GD_JOB_AD&t=SR&vt=w&cs=1_7d045c60&cb=1743698105011&jobListingId=1009696260486&jrtk=5-yul1-0-1inu833rpjn35800-8525f525d6c8d93d,"Ensure compliance with applicable federal, state and industry privacy regulations. Temporary employees may be eligible for paid holiday and time off, statutory…&hellip;
      
        Skills: Jira, Analysis skills, Project management, Confluence, Communication skills
      
    "
 Security analyst ,United States,3.5,"Southcoast Health System, Inc.",Govern-Risk-Compl Analyst I,"New Bedford, MA",$92K - $147K (Employer est.),24h,https://www.glassdoor.com/partner/jobListing.htm?pos=128&ao=1136043&s=58&guid=00000195fc818e8ca33c15b7fde6f250&src=GD_JOB_AD&t=SR&vt=w&cs=1_44b3f776&cb=1743698105012&jobListingId=1009696307856&jrtk=5-yul1-0-1inu833rpjn35800-309466315fe2a063,"Bachelors degree or equivalent, with a minimum of 2-4 years experience in risk management, IT audit, or similar field. Generous Earned Time Off Package**.&hellip;
      
        Skills: IT auditing, HIPAA, Microsoft Office, Project management, NIST standards
      
    "
 Security analyst ,United States,4.2,"SICK, Inc.",Cyber Security Analyst II,"Minneapolis, MN",$75K - $113K (Employer est.),24h,https://www.glassdoor.com/partner/jobListing.htm?pos=129&ao=1136043&s=58&guid=00000195fc818e8ca33c15b7fde6f250&src=GD_JOB_AD&t=SR&vt=w&ea=1&cs=1_3d22d838&cb=1743698105012&jobListingId=1009696243049&jrtk=5-yul1-0-1inu833rpjn35800-838d772049645845,"Actual starting salary will be based on a variety of factors including experience, skill set, education, performance, license/certifications, business needs,…&hellip;
      
        Skills: Cloud architecture, Firewall, Computer networking, IT, SIEM
      
    "
 Security analyst ,United States,3.4,Members 1st Federal Credit Union,IT Risk Analyst,Remote,$70K (Employer est.),24h,https://www.glassdoor.com/partner/jobListing.htm?pos=130&ao=1136043&s=58&guid=00000195fc818e8ca33c15b7fde6f250&src=GD_JOB_AD&t=SR&vt=w&cs=1_3c78c517&cb=1743698105012&jobListingId=1009696305416&jrtk=5-yul1-0-1inu833rpjn35800-8bd68fd987f702bf,"The key responsibilities of the IT Risk Analyst are to contribute to enterprise risk management by assessing and documenting risks and controls on all new and…&hellip;
      
        Skills: Management, PCI, Writing skills, Disaster recovery, English
      
    "
 Security analyst ,United States,4.0,Dominion Energy,Senior Information Security Analyst,"Richmond, VA",,24h,https://www.glassdoor.com/partner/jobListing.htm?pos=301&ao=1136043&s=58&guid=00000195fc822bc3b6ecc335cfce7287&src=GD_JOB_AD&t=SR&vt=w&cs=1_2c808c34&cb=1743698144667&jobListingId=1009697599577&jrtk=5-yul1-0-1inu84avvgc3e800-d1861abd3fb30a86,"Analyze and resolve technical issues in production environments. Advanced troubleshooting skills, including log and packet capture analysis.&hellip;
      
        Skills: Customer service, Information security, Firewall, Analysis skills, Project management
      
    "
 Security analyst ,United States,3.8,Chubb,Experienced IT Risk Analyst,"Philadelphia, PA",$92K - $129K (Glassdoor est.),24h,https://www.glassdoor.com/partner/jobListing.htm?pos=302&ao=1136043&s=58&guid=00000195fc822bc3b6ecc335cfce7287&src=GD_JOB_AD&t=SR&vt=w&cs=1_f5c65f55&cb=1743698144666&jobListingId=1009697585911&jrtk=5-yul1-0-1inu84avvgc3e800-d7bb4a8cd45de384,"IA team members develop strong business knowledge and control assessment skills to position the candidate for a broad range of potential future career…&hellip;
      
        Skills: IT auditing, SOX, Information security, Analysis skills, Data analytics
      
    "
 Security analyst ,United States,3.4,CSC (Corporation Service Company),Associate Brand Protection Analyst - Monitoring,"Wilmington, DE",$76K - $119K (Glassdoor est.),24h,https://www.glassdoor.com/partner/jobListing.htm?pos=303&ao=1136043&s=58&guid=00000195fc822bc3b6ecc335cfce7287&src=GD_JOB_AD&t=SR&vt=w&cs=1_d0afd55c&cb=1743698144666&jobListingId=1009697590379&jrtk=5-yul1-0-1inu84avvgc3e800-801847dd1529c452,"Work cohesively with global teams to ensure alignment with the customers brand monitoring strategy. Previous experience with online brand protection, or working…&hellip;
      
        Skills: Bilingual, Microsoft Word, Microsoft Excel, Microsoft Outlook, Multilingual
      
    "
 Security analyst ,United States,4.2,Leading Path Consulting,Cyber Technical Analyst Advisor (Cyber Analytics Support),"Chantilly, VA",,24h,https://www.glassdoor.com/partner/jobListing.htm?pos=304&ao=1136043&s=58&guid=00000195fc822bc3b6ecc335cfce7287&src=GD_JOB_AD&t=SR&vt=w&ea=1&cs=1_19ac8531&cb=1743698144667&jobListingId=1009697597520&jrtk=5-yul1-0-1inu84avvgc3e800-a8570c02e5d5f6da,"Demonstrated experience- understanding of ML/AI processes and be able to evaluate the efficiency of models. Demonstrated experience- understanding of networks…&hellip;
      
        Skills: Power BI, Tableau, SQL, Scripting, Cybersecurity
      
    "
 Security analyst ,United States,3.3,Technomics,Mid-Level Cybersecurity Analyst/Engineer,"Arlington, VA",$81K - $135K (Glassdoor est.),24h,https://www.glassdoor.com/partner/jobListing.htm?pos=305&ao=1136043&s=58&guid=00000195fc822bc3b6ecc335cfce7287&src=GD_JOB_AD&t=SR&vt=w&ea=1&cs=1_b9a7b302&cb=1743698144667&jobListingId=1009696556101&jrtk=5-yul1-0-1inu84avvgc3e800-12eb5403b784918b,"Advise DoD customers on secure design and implementation of systems and capabilities. Identify security vulnerabilities and weaknesses in SW, HW and…&hellip;
      
        Skills: NIST standards, Cybersecurity, RMF, Communication skills, Office experience
      
    "
 Security analyst ,United States,3.3,Technomics,Senior Cybersecurity Analyst/Engineer,"Arlington, VA",$92K - $146K (Glassdoor est.),24h,https://www.glassdoor.com/partner/jobListing.htm?pos=306&ao=1136043&s=58&guid=00000195fc822bc3b6ecc335cfce7287&src=GD_JOB_AD&t=SR&vt=w&ea=1&cs=1_ca8b92bd&cb=1743698144667&jobListingId=1009696556100&jrtk=5-yul1-0-1inu84avvgc3e800-556d5c2686165f1e,"Develop Tasked Planning Sheets (TPS) submitted by field activities for their cyber support for NAVSEA programs. Familiarity with Navy combat systems enclaves.&hellip;
      
        Skills: NIST standards, Cybersecurity, RMF, Communication skills, Office experience
      
    "
 Security analyst ,United States,3.6,Cherokee Federal,Scenario Development Analyst,"San Antonio, TX",$61K - $93K (Glassdoor est.),24h,https://www.glassdoor.com/partner/jobListing.htm?pos=307&ao=1136043&s=58&guid=00000195fc822bc3b6ecc335cfce7287&src=GD_JOB_AD&t=SR&vt=w&cs=1_0ee736a5&cb=1743698144667&jobListingId=1009696389084&jrtk=5-yul1-0-1inu84avvgc3e800-5c9b61ab2fb6eddf,"The ideal candidate will research and analyze cyber threats, develop realistic training scenarios, and coordinate the integration of these scenarios into wing…&hellip;
      
        Skills: Exercise planning, Malware analysis
      
    "
