Keyword,Location,rating,Company,Job_title,Place,salary,post_date,Job_URLs,Job_description
 Security analyst ,United States,3.2,CHS Corporate,Sr. IT Imaging Analyst,"Franklin, TN",$73K - $102K (Glassdoor est.),13d,https://www.glassdoor.com/partner/jobListing.htm?pos=2317&ao=1136043&s=58&guid=00000195fc84e6a0a3b34c31e8aa233e&src=GD_JOB_AD&t=SR&vt=w&cs=1_511f56e9&cb=1743698323738&jobListingId=1009680342915&jrtk=5-yul1-0-1inu89pn5l6hk800-35a5323058fb9bbc,"Critical thinking in developing proposals with sound analysis and achievable outcomes. Assist with business impact analysis and application criticality…&hellip;
      
        Skills: Management, Customer service, Project management, Organizational skills, Relationship management
      
    "
 Security analyst ,United States,2.7,Core Civic,System Analyst SOC-NOC II PRN,"Brentwood, TN",$62K - $89K (Glassdoor est.),8d,https://www.glassdoor.com/partner/jobListing.htm?pos=2318&ao=1136043&s=58&guid=00000195fc84e6a0a3b34c31e8aa233e&src=GD_JOB_AD&t=SR&vt=w&cs=1_d260ed37&cb=1743698323738&jobListingId=1009685593306&jrtk=5-yul1-0-1inu89pn5l6hk800-36f5ad345b82fd55,"Graduate from an accredited college or university with a Bachelor's degree in Computer Science, Information Systems or a related field is required.&hellip;
      
        Skills: Microsoft Office, Firewall, IDS, VPN
      
    "
 Security analyst ,United States,3.9,Loyola University Chicago,Technology Compliance and Business Continuity Analyst,"Chicago, IL",$108K (Employer est.),9d,https://www.glassdoor.com/partner/jobListing.htm?pos=2319&ao=1136043&s=58&guid=00000195fc84e6a0a3b34c31e8aa233e&src=GD_JOB_AD&t=SR&vt=w&cs=1_b28ba592&cb=1743698323739&jobListingId=1009684101391&jrtk=5-yul1-0-1inu89pn5l6hk800-fbb285719f337d4f,"Working closely with the ITS Audit Owner on audit & assessment projects, to ensure that information risks are managed and that risk assessment processes are…&hellip;
      
        Skills: Microsoft Powerpoint, Microsoft Word, Computer science, Microsoft Excel, PCI
      
    "
 Security analyst ,United States,3.8,Leidos,Cyber Threat Intelligence Analyst,"Ashburn, VA",$85K - $154K (Employer est.),9d,https://www.glassdoor.com/partner/jobListing.htm?pos=2320&ao=1136043&s=58&guid=00000195fc84e6a0a3b34c31e8aa233e&src=GD_JOB_AD&t=SR&vt=w&cs=1_79e36c5d&cb=1743698323739&jobListingId=1009683940228&jrtk=5-yul1-0-1inu89pn5l6hk800-136c0dd8793bbb48,"BS in IT related field or higher and 4-8 years’ experience in an information technology field with a minimum of 5 years of experience as a Tier II senior cyber…&hellip;
      
        Skills: XML, Visual Basic, LAN, Host/hostess experience, Analysis skills
      
    "
 Security analyst ,United States,3.8,"R&P Technologies, LLC",Mid-Level Cyber Systems Analyst,"Washington, DC",$86K - $133K (Glassdoor est.),12d,https://www.glassdoor.com/partner/jobListing.htm?pos=2321&ao=1136043&s=58&guid=00000195fc84e6a0a3b34c31e8aa233e&src=GD_JOB_AD&t=SR&vt=w&cs=1_5566cdbf&cb=1743698323738&jobListingId=1009682000311&jrtk=5-yul1-0-1inu89pn5l6hk800-b409b21684a7c912,"Analysis of RMF controls, as well as phases in the Cyber T&E guidebook including varying forms of cyber risk assessments, cyber tabletops, MBSE scans, and…&hellip;
      
        Skills: Microsoft Office, NIST standards, Systems engineering, CPT coding, Organizational skills
      
    "
 Security analyst ,United States,3.8,NTT DATA,Senior Vulnerability Assessment Analyst Job Details | NTT DATA Services,"Merrifield, VA",$73K - $117K (Glassdoor est.),13d,https://www.glassdoor.com/partner/jobListing.htm?pos=2322&ao=1136043&s=58&guid=00000195fc84e6a0a3b34c31e8aa233e&src=GD_JOB_AD&t=SR&vt=w&cs=1_d8bbc39b&cb=1743698323739&jobListingId=1009680461788&jrtk=5-yul1-0-1inu89pn5l6hk800-a9881e6d0ac0c606,"To include: Work experience and knowledge in; vulnerability assessment, analysis, and mitigation; analyzing security system logs, security tools, and data;…&hellip;
      
        Skills: Penetration testing, Program development, Enterprise software, Windows, Information security
      
    "
 Security analyst ,United States,4.6,Watershed Security,Cyber Support Analyst with DoD Secret Clearance,"Chesapeake, VA",$45K - $50K (Employer est.),12d,https://www.glassdoor.com/partner/jobListing.htm?pos=2323&ao=1136043&s=58&guid=00000195fc84e6a0a3b34c31e8aa233e&src=GD_JOB_AD&t=SR&vt=w&ea=1&cs=1_c93eb19d&cb=1743698323738&jobListingId=1009681899966&jrtk=5-yul1-0-1inu89pn5l6hk800-186ec6e1463f403b,"Must comply with certification requirements identified in DoD 8570.01M for IAT Level II or equivalent. Experience with cybersecurity tools to include ACAS, HBSS…&hellip;
      
        Skills: Microsoft Powerpoint, Microsoft Word, Microsoft Excel, Windows, Microsoft Office
      
    "
 Security analyst ,United States,3.9,Howden Group Holdings,Investment Banking - Insurance Linked Securities Analyst,"New York, NY",$105K (Employer est.),13d,https://www.glassdoor.com/partner/jobListing.htm?pos=2324&ao=1136043&s=58&guid=00000195fc84e6a0a3b34c31e8aa233e&src=GD_JOB_AD&t=SR&vt=w&cs=1_29e2dc79&cb=1743698323738&jobListingId=1009680251814&jrtk=5-yul1-0-1inu89pn5l6hk800-1e60a838800e2caa,"Bachelor’s Degree required; well-rounded academic background, with coursework in finance, economics, mathematics, risk management/insurance, engineering or…&hellip;
      
        Skills: Microsoft Powerpoint, Microsoft Excel, Underwriting, Writing skills, Bloomberg
      
    "
 Security analyst ,United States,3.6,Cherokee Federal,"IT Analyst, Tier 4 SME","Dahlgren, VA",$140K (Employer est.),8d,https://www.glassdoor.com/partner/jobListing.htm?pos=2325&ao=1136043&s=58&guid=00000195fc84e6a0a3b34c31e8aa233e&src=GD_JOB_AD&t=SR&vt=w&ea=1&cs=1_4eb592d7&cb=1743698323739&jobListingId=1009685346617&jrtk=5-yul1-0-1inu89pn5l6hk800-cf4cd97734f6968e,"The candidate must have the ability to lead complex technology assignments, provide technical guidance, and implement robust IAM solutions across multiple…&hellip;
      
        Skills: SSO, Management, RBAC, AWS, Terraform
      
    "
 Security analyst ,United States,3.8,Oasys Inc.,Sr Information Technology / Operational Technology Analyst,"Huntsville, AL",$93K - $141K (Glassdoor est.),13d,https://www.glassdoor.com/partner/jobListing.htm?pos=2326&ao=1136043&s=58&guid=00000195fc84e6a0a3b34c31e8aa233e&src=GD_JOB_AD&t=SR&vt=w&ea=1&cs=1_6c43b3cc&cb=1743698323740&jobListingId=1009680318995&jrtk=5-yul1-0-1inu89pn5l6hk800-2d716727f1707896,"OASYS, INC., a Leading-Edge Government contractor, is seeking applicants for a Sr Information Technology / Operational Technology Analyst position who will…&hellip;
      
        Skills: Windows, Microsoft Office, Analysis skills, Team management, NIST standards
      
    "
 Security analyst ,United States,3.9,CACI,Navy Qualified Validator/Cybersecurity Analyst,Virginia,$68K - $144K (Employer est.),8d,https://www.glassdoor.com/partner/jobListing.htm?pos=2327&ao=1136043&s=58&guid=00000195fc84e6a0a3b34c31e8aa233e&src=GD_JOB_AD&t=SR&vt=w&cs=1_6f5e8412&cb=1743698323739&jobListingId=1009685456242&jrtk=5-yul1-0-1inu89pn5l6hk800-8d28ac1371bc5daf,"(BA/BS) degree in Information Systems or related field from an accredited college/university. Test & Evaluation: Experience in allocating assigned security…&hellip;
      
        Skills: Windows, Information security, Firewall, DIACAP, Virtualization
      
    "
 Security analyst ,United States,4.0,Allied Onesource,IT Security Analyst,"Topeka, KS",$60K - $65K (Employer est.),14d,https://www.glassdoor.com/partner/jobListing.htm?pos=2328&ao=1110586&s=58&guid=00000195fc84e6a0a3b34c31e8aa233e&src=GD_JOB_AD&t=SR&vt=w&cs=1_7deab9d1&cb=1743698323739&jobListingId=1009679107701&cpc=F45C15D234B746DE&jrtk=5-yul1-0-1inu89pn5l6hk800-0875b6946939c684---6NYlbfkN0CK-8nPx1PXKPyVwi8YM4tCpnZRQ_DYusyN8hYEsp4F2daY3dUfZVTnCbTdeVr5qQALKytEdUngczjJcyMcOWdLoNDtlcbviq7WsSGw9uvcdVFWxXvjXSscE9pYmw6Z3PhGW75vN6HfQulP-npY-Lws3m1_QHhAAAN0raQkG6-3RdXDAKrUwY3Xp6OUY4GgQOcqiqerWHwa7TcZDSW6kfIhJrqE1H0aEnSTz2g4VpZ356BjEfz-B30Rnrn9OVqGvjDjW_oHNm7WpSCBAVUxDLZ3UMK0jjScAkduUEgviAGo35D9ZlLBrv4kdwmwmJr0mUzMgzPZqQ8gpTVcmei3yIxsqy-mmLc8fMJB6JfoznGCJ1Xb8wtakBF7fw-lndOWGU9tzSd-CQjmGLtP-gzLj05fmpjczO8c5xB-gIUnznfzeOZoBAw0nXpF9iTym7xKihvsvuASVprRLif0Omo8_6lgGGxpzI8lF2dywBAMa-x4EBsDyY52f7b49pe099b8-y9sErXvwRAfcZadCb5NUTeE8U9NVZzcb4kFu8tXOFJrCAaocJQtZzEYjn396OnXWthspjW1wO1hYDsIUV_HhsUx8In_QN5UnHQuzA5ieEOQ_7T_fWeRGzsb73yXNRRju9hTG8msvT6s0H5Ar4BlI9_r-oxDlmzUtIAgNR62HmKBDOcq7yutLRwYTDFUbfhnuynW421Mc6oT-HMPo074DUQDnTigSB23rRL3w932WbQlMaxLfWn0-emnRgpBusFaLPl7HxJNHbpIvs5AIzy3_UUbMTaPdYhPWlEdp3VyD5177sbZCpeXZqJB1xGAW-lcV20%3D,"Security requirement analysis: Review and analyze reports generated by various tools and processes to recommend, plan, assess, and implement necessary security…&hellip;
      
        Skills: Security analysis, IT
      
    "
 Security analyst ,United States,3.4,NovaSource Power,"Security Analyst - (Chandler, AZ)","Chandler, AZ",$49K - $72K (Glassdoor est.),16d,https://www.glassdoor.com/partner/jobListing.htm?pos=2329&ao=1136043&s=58&guid=00000195fc84e6a0a3b34c31e8aa233e&src=GD_JOB_AD&t=SR&vt=w&ea=1&cs=1_52bf4839&cb=1743698323739&jobListingId=1009676160988&jrtk=5-yul1-0-1inu89pn5l6hk800-15e5e5acfae91cc3,"Monitor security tools, dashboards, and logs to detect and respond to security events. Experience or exposure to SIEM platforms such as Splunk, QRadar,…&hellip;
      
        Skills: TCP, Microsoft Excel, Operating systems, Windows, Analysis skills
      
    "
 Security analyst ,United States,,Zocalo Recruiting,IT Security Analyst,"San Antonio, TX",$85K - $95K (Employer est.),19d,https://www.glassdoor.com/partner/jobListing.htm?pos=2330&ao=1136043&s=58&guid=00000195fc84e6a0a3b34c31e8aa233e&src=GD_JOB_AD&t=SR&vt=w&ea=1&cs=1_2a7b9415&cb=1743698323740&jobListingId=1009673979913&jrtk=5-yul1-0-1inu89pn5l6hk800-aeed3d416633cb48,"Experience with SIEM tools (Splunk, QRadar, ArcSight), endpoint protection, and network security tools. Bachelors degree in Computer Science, Cybersecurity,…&hellip;
      
        Skills: Penetration testing, Computer science, Azure, PCI, Encryption
      
    "
 Security analyst ,United States,2.7,ImmunityBio,Security Operations Center Analyst,"Summit, NJ",$85K - $125K (Employer est.),14d,https://www.glassdoor.com/partner/jobListing.htm?pos=2401&ao=1136043&s=58&guid=00000195fc8517829a5a2410fa01d90c&src=GD_JOB_AD&t=SR&vt=w&cs=1_b979519f&cb=1743698336693&jobListingId=1009679324688&jrtk=5-yul1-0-1inu8a5u5gb2k800-1973569bab9df030,"Bachelor’s degree (preferred) in Computer Sciences, IT, engineering, or related field with some related experience. Lead escalated onsite IT support issues.&hellip;
      
        Skills: Computer science, Management, HITRUST, Windows, Information security
      
    "
 Security analyst ,United States,3.5,"Bond, Schoeneck & King PLLC",Security Analyst,"Syracuse, NY",$95K - $105K (Employer est.),20d,https://www.glassdoor.com/partner/jobListing.htm?pos=2402&ao=1136043&s=58&guid=00000195fc8517829a5a2410fa01d90c&src=GD_JOB_AD&t=SR&vt=w&cs=1_ca27e77e&cb=1743698336692&jobListingId=1009672164369&jrtk=5-yul1-0-1inu8a5u5gb2k800-c64aa86f4ef4986e,"Monitoring and Analysis: Continuously monitor security alerts and events using the firm’s cybersecurity tools and platforms.&hellip;
      
        Skills: COBIT, PCI, HIPAA, FISMA, SOX
      
    "
 Security analyst ,United States,4.6,Lyra Technology Group,Security Analyst,"Raleigh, NC",$75K - $85K (Employer est.),19d,https://www.glassdoor.com/partner/jobListing.htm?pos=2403&ao=1136043&s=58&guid=00000195fc8517829a5a2410fa01d90c&src=GD_JOB_AD&t=SR&vt=w&ea=1&cs=1_f9a6dbed&cb=1743698336692&jobListingId=1009673645690&jrtk=5-yul1-0-1inu8a5u5gb2k800-98d9173a3d9a34fa,"Conduct in-depth risk analysis to identify security gaps and develop strategic mitigation plans. This role will involve managing security tools, responding to…&hellip;
      
        Skills: Firewall, NIST standards, IDS, ISO 27001, SIEM
      
    "
 Security analyst ,United States,3.7,New Jersey Resources,Cyber Security Analyst II,"Wall Township, NJ",$80K - $106K (Glassdoor est.),16d,https://www.glassdoor.com/partner/jobListing.htm?pos=2404&ao=1136043&s=58&guid=00000195fc8517829a5a2410fa01d90c&src=GD_JOB_AD&t=SR&vt=w&cs=1_1ee4e632&cb=1743698336692&jobListingId=1009676407470&jrtk=5-yul1-0-1inu8a5u5gb2k800-c37a3541acbae309,"Bachelor's degree in Cybersecurity, Information Technology, or a related field, or equivalent work experience. Excellent analytical and problem-solving skills.&hellip;
      
        Skills: TCP, Encryption, Information security, IDS, SIEM
      
    "
 Security analyst ,United States,4.0,"Yardi Systems, Inc.",Security Analyst II,"Santa Barbara, CA",$85K - $95K (Employer est.),15d,https://www.glassdoor.com/partner/jobListing.htm?pos=2405&ao=1110586&s=58&guid=00000195fc8517829a5a2410fa01d90c&src=GD_JOB_AD&t=SR&vt=w&cs=1_37b64f36&cb=1743698336694&jobListingId=1009677490016&cpc=75B6770C194DCF89&jrtk=5-yul1-0-1inu8a5u5gb2k800-46f1e666720c5e81---6NYlbfkN0CV0HNUvoJHZLBsHZVlKdwBK3U3yTEE_byVWJUywqgs8BtnRfMjCsHQU2yWfYv6jCebNDLKKKk2itF1XhYW8oY1aPo8REd42ywWTySzVzHqkXc1qu8GZHgqwkfUmUex7suEGK7poju7onwPB5v4joeJPqngNVwTlT83aJyopDM_isg1I9HBR52FY2TMmpPlKPQx1Mk3dVqwY4KmXfiV5Zj2UdPGQxEuPBChIucBvY2U1a9IOn3EbDijYZjyCW7UfsgypyphT-BjY6kEeI0PAXr7ogpHn2o9r_S1-NVWGK3FbVufpzetURJoBxHfIVejRczVHkUtkTFT33HegLJHmv1-n5hA7TS4UynVQZyNdIW-pvxJT-FA_AT-S0bzBdrv3wII6Oh9V0UpaoPJALhdmFFZ0bpAAThwZamB5rYTid_xlMfcy_8FAPClwohkZPTVnpMOp_ZrITl2ioB-GQjutXeIvunpK5yjdAkEnapU26rP8PU2raHycEWHXTxKm3NF4M1H5quGqDQl8R3wAOe7tsj25CrM97_a8pVG0H7FHEtDu7aysMH7y_N8bN8k5s11M-mBLlCTldl4AfcL76LNCwesY_Z7mmjRRBROQ94xqOX_nHaguGOL-9_WP89_Km7exK_jsyMfKOJtSc-h9V1qCJzXdcWYFpB0WSA1fMtiQxk84_Yi37A9LI3WUdKBkilAySvMRv1ZQGNk1gXzHP6_S3cwMwtnHPa9fZ9hzYL8KNXop9jFOkTGDT4s,"Bachelor’s degree in Computer Science, Information Technology, or a related field, or equivalent experience. Experience with SIEM and security automation tools.&hellip;
      
        Skills: Computer science, TCP, Kubernetes, Yardi, Windows
      
    "
 Security analyst ,United States,3.3,"Barnes & Noble Education, Inc.",Information Security Analyst,"Basking Ridge, NJ",$57K - $62K (Employer est.),16d,https://www.glassdoor.com/partner/jobListing.htm?pos=2406&ao=1136043&s=58&guid=00000195fc8517829a5a2410fa01d90c&src=GD_JOB_AD&t=SR&vt=w&cs=1_09bad389&cb=1743698336693&jobListingId=1009676178385&jrtk=5-yul1-0-1inu8a5u5gb2k800-46b1e2c190074e9a,"Bachelor’s degree preferred, or a minimum of three years of experience in information security, system administration, or a related field.&hellip;
      
        Skills: Microsoft Powerpoint, Microsoft Word, System administration, Microsoft Excel, Microsoft Access
      
    "
 Security analyst ,United States,,Vertilocity,Security Analyst,"Bridgeville, PA",$52K - $86K (Glassdoor est.),16d,https://www.glassdoor.com/partner/jobListing.htm?pos=2407&ao=1136043&s=58&guid=00000195fc8517829a5a2410fa01d90c&src=GD_JOB_AD&t=SR&vt=w&ea=1&cs=1_cf92d604&cb=1743698336694&jobListingId=1009676032640&jrtk=5-yul1-0-1inu8a5u5gb2k800-912b740607f8800b,"Excellent communication skills to articulate security issues to both technical and non-technical audiences. Bachelor’s degree in Computer Science, Information…&hellip;
      
        Skills: Microsoft Windows Server, Computer science, Windows, IT, Cybersecurity
      
    "
 Security analyst ,United States,3.7,Citadel Federal Credit Union,IT Security Analyst,"Exton, PA",,16d,https://www.glassdoor.com/partner/jobListing.htm?pos=2408&ao=1136043&s=58&guid=00000195fc8517829a5a2410fa01d90c&src=GD_JOB_AD&t=SR&vt=w&cs=1_8bb4702a&cb=1743698336694&jobListingId=1009675899696&jrtk=5-yul1-0-1inu8a5u5gb2k800-7f591e66c2791a6c,"The role will primarily be responsible for the assessment of technology risk, including third party risk, developing remediation plans, and tracking to…&hellip;
      
        Skills: LAN, Disaster recovery, Information security, Analysis skills, WAN
      
    "
 Security analyst ,United States,3.2,Arkansas Tech University,Security Analyst,"Russellville, AR",$47K (Employer est.),19d,https://www.glassdoor.com/partner/jobListing.htm?pos=2409&ao=1136043&s=58&guid=00000195fc8517829a5a2410fa01d90c&src=GD_JOB_AD&t=SR&vt=w&cs=1_aedd3962&cb=1743698336695&jobListingId=1009673618972&jrtk=5-yul1-0-1inu8a5u5gb2k800-aee5a8e404f3f67f,"The candidate must be able to travel as necessary by driving, riding, flying, or using other public transportation systems, both within and outside the state.&hellip;
      
        Skills: TCP, Program management, Azure, PCI, Encryption
      
    "
 Security analyst ,United States,4.1,Arista Networks,IT Security Analyst,"Santa Clara, CA",,16d,https://www.glassdoor.com/partner/jobListing.htm?pos=2410&ao=1136043&s=58&guid=00000195fc8517829a5a2410fa01d90c&src=GD_JOB_AD&t=SR&vt=w&ea=1&cs=1_7628d0f1&cb=1743698336695&jobListingId=1009676257262&jrtk=5-yul1-0-1inu8a5u5gb2k800-e8da83a3b07d1ff1,"Have experience in threat modelling, red/blue teaming, working with best-in-class independent engineering teams. Experience with CSPM and SSPM tools.&hellip;
      
        Skills: Penetration testing, Authentication, Azure, Go, Kubernetes
      
    "
 Security analyst ,United States,3.7,Mass General Brigham,Information Security Business Analyst II,"Somerville, MA",,16d,https://www.glassdoor.com/partner/jobListing.htm?pos=2411&ao=1136043&s=58&guid=00000195fc8517829a5a2410fa01d90c&src=GD_JOB_AD&t=SR&vt=w&cs=1_3b3899f8&cb=1743698336695&jobListingId=1009676249620&jrtk=5-yul1-0-1inu8a5u5gb2k800-887949c832f415e5,"High proficiency with the tools and solutions supported by the team. Solid understanding of technology and design principles.&hellip;
      
        Skills: Process improvement, Information security, Cybersecurity, Communication skills
      
    "
 Security analyst ,United States,,Apollo Technology Solutions LLC,IT Security Analyst,"Richmond, VA",$80K - $114K (Glassdoor est.),14d,https://www.glassdoor.com/partner/jobListing.htm?pos=2412&ao=1136043&s=58&guid=00000195fc8517829a5a2410fa01d90c&src=GD_JOB_AD&t=SR&vt=w&ea=1&cs=1_abd7b001&cb=1743698336695&jobListingId=1009680076019&jrtk=5-yul1-0-1inu8a5u5gb2k800-abd89eeab21d4328,"Familiarity with web application security testing tools like Burp Suite, Fortify, and/or App Scan. Assess and document the security impact and risks of newly…&hellip;
      
        Skills: CSS, Visual Basic, C#, Information security, Java
      
    "
 Security analyst ,United States,4.0,Holland & Knight LLP,IT Security Analyst (Hybrid),"Brandon, FL",$71K - $106K (Glassdoor est.),16d,https://www.glassdoor.com/partner/jobListing.htm?pos=2413&ao=1136043&s=58&guid=00000195fc8517829a5a2410fa01d90c&src=GD_JOB_AD&t=SR&vt=w&cs=1_a687fc81&cb=1743698336696&jobListingId=1009675748693&jrtk=5-yul1-0-1inu8a5u5gb2k800-03d5fdfcb425e1dc,"Security Infrastructure Applications: Endpoint Detection and Response tools, automated systems management, vulnerability management tools, password management…&hellip;
      
        Skills: Microsoft Windows Server, Operating systems, LAN, Windows, Technical support
      
    "
 Security analyst ,United States,4.3,"Ryan, LLC","Information Security Analyst II, Information Security","Dallas, TX",$74K - $107K (Employer est.),15d,https://www.glassdoor.com/partner/jobListing.htm?pos=2414&ao=1136043&s=58&guid=00000195fc8517829a5a2410fa01d90c&src=GD_JOB_AD&t=SR&vt=w&cs=1_f6f93726&cb=1743698336697&jobListingId=1009677980567&jrtk=5-yul1-0-1inu8a5u5gb2k800-4c5bdad2a9f7005b,"Valid driver’s license required. Familiarity with malware analysis, phishing campaigns, and social engineering attacks. High School diploma or GED required.&hellip;
      
        Skills: Penetration testing, Information security, Firewall, Analysis skills, Nessus
      
    "
 Security analyst ,United States,,IHC SPECIALTY BENEFITS,Information Security Analyst,"Akron, OH",$80K - $95K (Employer est.),16d,https://www.glassdoor.com/partner/jobListing.htm?pos=2415&ao=1110586&s=58&guid=00000195fc8517829a5a2410fa01d90c&src=GD_JOB_AD&t=SR&vt=w&cs=1_189bde7b&cb=1743698336698&jobListingId=1009677053697&cpc=C4A69CCDBB3B9599&jrtk=5-yul1-0-1inu8a5u5gb2k800-f74967e18047ab61---6NYlbfkN0AaNrjtkMnsKSuuXDEj5GbGdU3VVu6PrYUN7uX12N2iBE9xPwXrn6RE4409rNhtA8YCAFHZaQXD4FFxCexrAdDQq5FkqMbLNq7oniRCrvsCKS5G8pMpYJ3i3RckITZubVP7wYB9zrmL2lTj4X9TJwBbzIBoVuL2OEB5aZ9Pu8SyqLRyKDio9LXEXzK-mNxD9pwQ7VRGXenvQ8lfnhtKyo_wGw0m282fKH8Ygx6Y1KArUxvDoISk2xPF06bWtE8JqYCBVZsypX3DxadNPvh5dNB2BPxNVgmG_2F-HDoagzuT64O4HNpd_lnq6xSTjXrmLudD3Hkl7pUgLMHJu0vibV9eWCrb9j0R5_SI7l-gA_uQuLrd5tK8KPE8Ne-QHwqulYUVR5vDSJf82pw1aN-43DY0nzBlExFLuwk_cbNaLzZoI6H9VfputpSXqch9V02cHq_HazKoQam7lsiydUmzfSz6jwsOC_OYPMEq79its38SKKALkwMS2ysbcGx7-4OHB2nmjS4hLT4XL_EwNVTCjO6krfSpg3Z3zuH4io0NjUA04O2bQEGeSzlIm-uCOqhGV6Q_6UMX2BYlWE_ZCRn_4QKFFYUvqPWRKsJFTC_3ChZ13MIJmYUyhassqXx_7edoIcIMYRZV2T-H4T-nczvVgtiAOPDK7HhhZkF1TDnhCVBBQoykWv6Zkc9Q2LJs3jEyVM0XwPpl8BQ2Pft2PhVtUzhLesMkBmEyd98RVxT6TPtZkmGGtdx--MkC_T2fxTY5KDF4akvvgHJ1rw-7sUM_jQaEMM2ai0M1UBJavosaJLzPbXGc_JxkSAfQ,"While a current information security certification (such as Security+, CISSP, or similar) is not required at the time of hire, the individual must obtain the…&hellip;
      
        Skills: Authentication, Computer science, Operating systems, PCI, WordPress
      
    "
 Security analyst ,United States,3.8,Goldman Sachs,Wealth Management-Richardson-Analyst-Security Engineering,"Richardson, TX",$88K - $134K (Glassdoor est.),16d,https://www.glassdoor.com/partner/jobListing.htm?pos=2416&ao=1136043&s=58&guid=00000195fc8517829a5a2410fa01d90c&src=GD_JOB_AD&t=SR&vt=w&cs=1_10cb96fb&cb=1743698336696&jobListingId=1009675833719&jrtk=5-yul1-0-1inu8a5u5gb2k800-55a618e66c0eac83,"Ability to assess and evaluate corporate risk tolerance and translate into goals and new processes including software engineering, IT teams, and engineering and…&hellip;
      
        Skills: Go, PCI, Encryption, Information security, Java
      
    "
 Security analyst ,United States,2.9,Lumifi Cyber,L2 Security Analyst,"Scottsdale, AZ",,15d,https://www.glassdoor.com/partner/jobListing.htm?pos=2417&ao=1136043&s=58&guid=00000195fc8517829a5a2410fa01d90c&src=GD_JOB_AD&t=SR&vt=w&cs=1_e45724f6&cb=1743698336696&jobListingId=1009677538049&jrtk=5-yul1-0-1inu8a5u5gb2k800-d0bd908e18175ffd,"Minimum of 3+ years of experience performing forensic analysis of logs and packet captures to identify malicious artifacts.&hellip;
      
        Skills: Jira, TCP, Remedy, Research, Analysis skills
      
    "
 Security analyst ,United States,3.7,WiseTech Global,Security Analyst,"Chicago, IL",$63K - $97K (Glassdoor est.),20d,https://www.glassdoor.com/partner/jobListing.htm?pos=2418&ao=1136043&s=58&guid=00000195fc8517829a5a2410fa01d90c&src=GD_JOB_AD&t=SR&vt=w&cs=1_60520670&cb=1743698336696&jobListingId=1009672298322&jrtk=5-yul1-0-1inu8a5u5gb2k800-ad82bf9b1af973f6,"You are continuously finding ways to grow your skills through self-study, technical projects, CTFs and engagement in technical forums.&hellip;
      
        Skills: Azure, PCI, NIST standards, IT support, SIEM
      
    "
 Security analyst ,United States,3.7,Lambda,Security GRC Analyst,"San Francisco, CA",$125K - $180K (Employer est.),19d,https://www.glassdoor.com/partner/jobListing.htm?pos=2419&ao=1136043&s=58&guid=00000195fc8517829a5a2410fa01d90c&src=GD_JOB_AD&t=SR&vt=w&ea=1&cs=1_5ef2c7fb&cb=1743698336696&jobListingId=1009673708034&jrtk=5-yul1-0-1inu8a5u5gb2k800-d9336ffb1260a914,"Communicate with technical and non-technical stakeholders on cybersecurity risk and control topics and program-specific reporting.&hellip;
      
        Skills: PCI, Information security, Project management, Machine learning, ISO 27002
      
    "
 Security analyst ,United States,4.2,ManTech,Cybersecurity Analyst,"Doral, FL",,19d,https://www.glassdoor.com/partner/jobListing.htm?pos=2420&ao=1136043&s=58&guid=00000195fc8517829a5a2410fa01d90c&src=GD_JOB_AD&t=SR&vt=w&cs=1_1b50c22f&cb=1743698336696&jobListingId=1009673867557&jrtk=5-yul1-0-1inu8a5u5gb2k800-be5feb9d5f71328b,"Monitor and secure information systems, identify any potential risks or breaches, and develop strategies to prevent security incidents.&hellip;
      
        Skills: Computer science, Encryption, Disaster recovery, DoD experience, Information security
      
    "
