Keyword,Location,rating,Company,Job_title,Place,salary,post_date,Job_URLs,Job_description
 Security analyst ,United States,4.0,Personnel Decisions Research Institutes LLC,Junior IT Security Analyst,"Chantilly, VA",$88K - $121K (Glassdoor est.),3d,https://www.glassdoor.com/partner/jobListing.htm?pos=912&ao=1136043&s=58&guid=00000195fc82cf4e9cb37df71bb6c42b&src=GD_JOB_AD&t=SR&vt=w&ea=1&cs=1_cd9dfba4&cb=1743698186649&jobListingId=1009691442903&jrtk=5-yul1-0-1inu85js8ia63800-6d6dc39efe99dcee,"A premier software, research, and consulting firm in the field of industrial-organizational psychology, PDRI designs, develops and implements human resource…&hellip;
      
        Skills: Microsoft Word, Microsoft Excel, Azure, Management, FedRAMP
      
    "
 Security analyst ,United States,4.2,Salt River Project,Cyber Security Analyst,"Tempe, AZ",$68K - $93K (Glassdoor est.),3d,https://www.glassdoor.com/partner/jobListing.htm?pos=913&ao=1136043&s=58&guid=00000195fc82cf4e9cb37df71bb6c42b&src=GD_JOB_AD&t=SR&vt=w&cs=1_08ce84a2&cb=1743698186649&jobListingId=1009691276399&jrtk=5-yul1-0-1inu85js8ia63800-1cf4ec8f2ae6e505,"Understanding of social engineering tactics, privacy, insider threats and data protection. A bachelor’s degree related to the assignment from an accredited…&hellip;
      
        Skills: Power BI, Management, Project management, Organizational skills, ServiceNow
      
    "
 Security analyst ,United States,3.0,Ephesus Solutions,Identity and Access Management Analyst,"Mount Juliet, TN",$100K - $115K (Employer est.),3d,https://www.glassdoor.com/partner/jobListing.htm?pos=914&ao=1110586&s=58&guid=00000195fc82cf4e9cb37df71bb6c42b&src=GD_JOB_AD&t=SR&vt=w&ea=1&cs=1_129bb88d&cb=1743698186649&jobListingId=1009691419568&cpc=9908D8D4413DBB8A&jrtk=5-yul1-0-1inu85js8ia63800-671f543b3b5c52a2---6NYlbfkN0C_82tN9TLu_XKPBJkUPiXBrIPs4kkfoElOxzU7zouLbxsjeoyiBO1H2ztewBAXUZNslFI4dIkvjnjUdwRmyoQ4_UWi_RKTz7OOisCvwy1EoGVE1EIdY8MY23Np9i4V04Yr6MowPc_oybmtvwT6mpzB-4-pF2d24IDpEmn9bi1SAyHXdVCvmAlA33KGrUl-lyWdZn3Z2pIbnh33LDcnRA3XScB6ejvw8-7gJCvRSQbOzhFj3VeZG8kd7PwC-lkJown2Z0LkAhl91BtiVn99s5nUFai4ijk0PnDrlSb0kOHhL2-fu1SDZgJ208kZtGMKCJvsPqW4TPKU5qft_pCDnaJxx4zTCUmi4_iwpa_mA6qGPQ8HPgNoUY-s2c8QCT5uz5kxbHCiXYUcq1va1iq2PamHw2BX2zSc5afV2voOGz4jQhqKbNgmPNhsSZNUIn-iLSRR7zukisR9GjGABSUeLUE2F2XbmPz6ccNDN4RV8FRQU_ISELXXXxIDBmLEg8WcGhvUjXU31WN6cJGoNdkr01MExGTZFkNd6Kh66GefPH55cPWZiaJ4RQxErKmZ2gxwERexSL-kvaJVtvjwsgZNJZDSNQ79u_nX4yh-i2bDQdXG91FZ6gFlyCBxEihqUOssqC-5X-2ztqk6Huvke-vSaH7cRuixQIKLGBAimaXrHTLoAG-Gt4oeIcPu1D54GSvSWw-bCmVdEPrEx6DY2NKKqbTMVdDa2G85caOFADe0bnQMcPlUjSFIAnB89t0KTmGZfgsTciYsgDF5ow%3D%3D,"Microsoft certification, network operating system, computer security and telecommunications knowledge preferred. User Provisioning: 2 years (Preferred).&hellip;
      
        Skills: Microsoft Powerpoint, Microsoft Word, Microsoft Excel, Operating systems, Management
      
    "
 Security analyst ,United States,3.2,Third Federal Savings & Loan,Senior Information Security Analyst,"Cleveland, OH",$100K - $141K (Glassdoor est.),3d,https://www.glassdoor.com/partner/jobListing.htm?pos=915&ao=1136043&s=58&guid=00000195fc82cf4e9cb37df71bb6c42b&src=GD_JOB_AD&t=SR&vt=w&ea=1&cs=1_8a703a21&cb=1743698186649&jobListingId=1009691381784&jrtk=5-yul1-0-1inu85js8ia63800-a8717b8a8aa324a3,"Capable of conducting security assessments, vulnerability testing (scanning) and risk analysis with having key abilities to identify vulnerabilities and assess…&hellip;
      
        Skills: Computer science, TCP, Azure, Software troubleshooting, Encryption
      
    "
 Security analyst ,United States,4.0,Blue Cross and Blue Shield of Alabama,Sr Cybersecurity Analyst,"Birmingham, AL",$76K - $110K (Glassdoor est.),3d,https://www.glassdoor.com/partner/jobListing.htm?pos=916&ao=1136043&s=58&guid=00000195fc82cf4e9cb37df71bb6c42b&src=GD_JOB_AD&t=SR&vt=w&cs=1_03472d47&cb=1743698186648&jobListingId=1009691060610&jrtk=5-yul1-0-1inu85js8ia63800-b86bc33a6f6a9acc,"Excellent human relations, listening, speaking and written communication skills in order to explain and discuss technical risks in both technical and business…&hellip;
      
        Skills: Information security, Burp Suite, IT, Leadership, Communication skills
      
    "
 Security analyst ,United States,3.7,black lantern security,Attack Surface Management (ASM) Cybersecurity Analyst,Remote,,3d,https://www.glassdoor.com/partner/jobListing.htm?pos=917&ao=1136043&s=58&guid=00000195fc82cf4e9cb37df71bb6c42b&src=GD_JOB_AD&t=SR&vt=w&cs=1_0bab1753&cb=1743698186649&jobListingId=1009691416814&jrtk=5-yul1-0-1inu85js8ia63800-df9d1cb1559efc64,"Must be US citizen (must be willing to submit to federal, state, and local background checks as well as other requirements).&hellip;
      
        Skills: Authentication, English, SQL, Perl, Scripting
      
    "
 Security analyst ,United States,3.9,Hilltop Holdings,IT Risk Analyst,"Irving, TX",$70K - $99K (Glassdoor est.),3d,https://www.glassdoor.com/partner/jobListing.htm?pos=918&ao=1136043&s=58&guid=00000195fc82cf4e9cb37df71bb6c42b&src=GD_JOB_AD&t=SR&vt=w&cs=1_8ce57dc0&cb=1743698186648&jobListingId=1009691121309&jrtk=5-yul1-0-1inu85js8ia63800-2475c94b93094e3f,"Bachelor’s degree or above in Business Administration, Accounting, Information Systems or equivalent experience in IT/Information Security field preferred.&hellip;
      
        Skills: Writing skills, IT auditing, SOX, Microsoft Office, Information security
      
    "
 Security analyst ,United States,,Totally Joined for Achieving Collaborati,Incident Response Analyst,"Washington, DC",,3d,https://www.glassdoor.com/partner/jobListing.htm?pos=919&ao=1136043&s=58&guid=00000195fc82cf4e9cb37df71bb6c42b&src=GD_JOB_AD&t=SR&vt=w&ea=1&cs=1_f5712f8f&cb=1743698186650&jobListingId=1009690425077&jrtk=5-yul1-0-1inu85js8ia63800-95485694670f9858,"Bachelor’s degree or equivalent practical experience in incident response, computer science, cybersecurity, information technology, software engineering,…&hellip;
      
        Skills: Computer science, Incident response, Machine learning, NIST standards, IDS
      
    "
 Security analyst ,United States,3.8,MetroStar,SOC Analyst (5803),"Washington, DC",$71K - $106K (Glassdoor est.),3d,https://www.glassdoor.com/partner/jobListing.htm?pos=920&ao=1136043&s=58&guid=00000195fc82cf4e9cb37df71bb6c42b&src=GD_JOB_AD&t=SR&vt=w&ea=1&cs=1_7ebd0043&cb=1743698186649&jobListingId=1009691377414&jrtk=5-yul1-0-1inu85js8ia63800-0a4b337b67ae6e85,"Ability to clearly document findings, write detailed incident reports, and effectively communicate with technical and non-technical stakeholders.).&hellip;
      
        Skills: Firewall, ITIL, Network protocols, Scripting, SIEM
      
    "
 Security analyst ,United States,4.7,"Interclypse, Inc.",Cyber/Indications and Warnings Analyst,"Annapolis Junction, MD",$75K - $109K (Glassdoor est.),3d,https://www.glassdoor.com/partner/jobListing.htm?pos=921&ao=1136043&s=58&guid=00000195fc82cf4e9cb37df71bb6c42b&src=GD_JOB_AD&t=SR&vt=w&cs=1_9f5c1d4f&cb=1743698186649&jobListingId=1009690403999&jrtk=5-yul1-0-1inu85js8ia63800-bd421807d65e2f2b,"A Bachelor’s Degree in Information Assurance or related field. The successful candidate will develop new dashboards and analytics to refine existing reports and…&hellip;
      
        Skills: SIEM, Network security, Analytics
      
    "
 Security analyst ,United States,3.2,Sysco,Senior Functional Analyst (Workday Security),"Houston, TX",$101K - $129K (Glassdoor est.),4d,https://www.glassdoor.com/partner/jobListing.htm?pos=922&ao=1136043&s=58&guid=00000195fc82cf4e9cb37df71bb6c42b&src=GD_JOB_AD&t=SR&vt=w&cs=1_ad9fca6e&cb=1743698186649&jobListingId=1009690148248&jrtk=5-yul1-0-1inu85js8ia63800-7f5cc262ba8b0d48,"Workday Security certification (preferred but not required). Work closely with Workday administrators and functional leads to optimize security configurations.&hellip;
      
        Skills: Management, SOX, RBAC, Analysis skills, Communication skills
      
    "
 Security analyst ,United States,3.4,Perdue Farms,Senior SAP Security Analyst (Onsite),"Salisbury, MD",$97K - $145K (Employer est.),4d,https://www.glassdoor.com/partner/jobListing.htm?pos=923&ao=1136043&s=58&guid=00000195fc82cf4e9cb37df71bb6c42b&src=GD_JOB_AD&t=SR&vt=w&cs=1_b786cc48&cb=1743698186650&jobListingId=1009689987858&jrtk=5-yul1-0-1inu85js8ia63800-1cbbae5cc74fc927,"Strong technical knowledge and experience of SAP security architecture and role-based authorization models within SAP system landscapes including SAP ECC, SAP…&hellip;
      
        Skills: SAP SuccessFactors, SAP, SOX, RBAC, Organizational skills
      
    "
 Security analyst ,United States,3.8,Municipality of Anchorage,ERP SECURITY ANALYST (Systems Analyst) - Range 16 / NON,"Anchorage, AK",$38.06 - $56.30 Per Hour (Employer est.),4d,https://www.glassdoor.com/partner/jobListing.htm?pos=924&ao=1136043&s=58&guid=00000195fc82cf4e9cb37df71bb6c42b&src=GD_JOB_AD&t=SR&vt=w&cs=1_2323fbf3&cb=1743698186650&jobListingId=1009690312156&jrtk=5-yul1-0-1inu85js8ia63800-01c8d13d0cbd0493,"Associate's degree in Computer Science, Business Administration or a related discipline and six (6) years of experience in an ERP Security field or/and…&hellip;
      
        Skills: Computer science, SAP, ERP systems, SAP ERP
      
    "
 Security analyst ,United States,4.0,General Dynamics Information Technology,Network Vulnerability Analyst | Secret clearance,"San Diego, CA",$102K - $138K (Employer est.),4d,https://www.glassdoor.com/partner/jobListing.htm?pos=925&ao=1136043&s=58&guid=00000195fc82cf4e9cb37df71bb6c42b&src=GD_JOB_AD&t=SR&vt=w&cs=1_1ec4acd4&cb=1743698186651&jobListingId=1009690319643&jrtk=5-yul1-0-1inu85js8ia63800-81c80afc53ac2e76,"Be familiar with researching and documenting remediation strategies for vulnerabilities, and build custom reports for data calls.&hellip;
      
        Skills: Microsoft Windows Server, Penetration testing, Fiddler, Vulnerability research, SCCM
      
    "
 Security analyst ,United States,4.0,Fairfax County Government,County Safety Manager (Loss Prevention Analyst IV),"Fairfax, VA",$85K - $142K (Employer est.),4d,https://www.glassdoor.com/partner/jobListing.htm?pos=926&ao=1136043&s=58&guid=00000195fc82cf4e9cb37df71bb6c42b&src=GD_JOB_AD&t=SR&vt=w&cs=1_28b6ad45&cb=1743698186650&jobListingId=1009690322536&jrtk=5-yul1-0-1inu85js8ia63800-4ec8756e322ef49d,"Graduation from an accredited college or university with a bachelor's degree in financial or business management with a focus on safety management, occupational…&hellip;
      
        Skills: Microsoft Powerpoint, Microsoft Word, Spanish, EPA, Microsoft Excel
      
    "
 Security analyst ,United States,4.2,Auria,Senior Malware Analyst/Reverse Engineer,United States,$115K - $135K (Employer est.),4d,https://www.glassdoor.com/partner/jobListing.htm?pos=927&ao=1136043&s=58&guid=00000195fc82cf4e9cb37df71bb6c42b&src=GD_JOB_AD&t=SR&vt=w&ea=1&cs=1_711516cf&cb=1743698186650&jobListingId=1009690052962&jrtk=5-yul1-0-1inu85js8ia63800-284e8baddbbfab81,"Performs complex static and dynamic analysis of malicious code from external sources ranging from commodity malware to advanced persistent threat (apt) nation…&hellip;
      
        Skills: Operating systems, Visual Basic, Analysis skills, C, JavaScript
      
    "
 Security analyst ,United States,,AI SPINS INC,Security Analyst,"Madison, WI",$60.00 - $65.00 Per Hour (Employer est.),5d,https://www.glassdoor.com/partner/jobListing.htm?pos=928&ao=1136043&s=58&guid=00000195fc82cf4e9cb37df71bb6c42b&src=GD_JOB_AD&t=SR&vt=w&ea=1&cs=1_a3517147&cb=1743698186650&jobListingId=1009689206912&jrtk=5-yul1-0-1inu85js8ia63800-c60d2c723d0c64ef,"Proficiency in security assessment tools and techniques, including penetration testing and vulnerability scanning.&hellip;
      
        Skills: Operating systems, Network protocols
      
    "
 Security analyst ,United States,5.0,Divine Global Solutions,security Analyst,"Columbia, SC",$60.00 Per Hour (Employer est.),5d,https://www.glassdoor.com/partner/jobListing.htm?pos=929&ao=1136043&s=58&guid=00000195fc82cf4e9cb37df71bb6c42b&src=GD_JOB_AD&t=SR&vt=w&ea=1&cs=1_95b38980&cb=1743698186650&jobListingId=1009689564390&jrtk=5-yul1-0-1inu85js8ia63800-653d2af02839b54c,"Ability to engage diverse audiences of varying technical and non-technical skill-levels to ensure effective alignment of technical requirements to business…&hellip;
      
        Skills: Microsoft Powerpoint, Microsoft Word, Computer science, Microsoft Excel, HIPAA
      
    "
 Security analyst ,United States,3.6,Akuna Capital,Security Analyst,"Chicago, IL",$100K (Employer est.),5d,https://www.glassdoor.com/partner/jobListing.htm?pos=930&ao=1136043&s=58&guid=00000195fc82cf4e9cb37df71bb6c42b&src=GD_JOB_AD&t=SR&vt=w&cs=1_e6d93969&cb=1743698186650&jobListingId=1009689525249&jrtk=5-yul1-0-1inu85js8ia63800-7a5858ec1a3f6bd2,"Stay current with emerging threats and continuously develop technical knowledge and skills. You will collaborate closely with cross-functional teams to enhance…&hellip;
      
        Skills: Windows, Firewall, Analysis skills, IDS, Scripting
      
    "
 Security analyst ,United States,3.7,Charles Schwab,Insider Threat Analyst - Hybrid,"Phoenix, AZ",$67K - $137K (Employer est.),24h,https://www.glassdoor.com/partner/jobListing.htm?pos=1001&ao=1110586&s=58&guid=00000195fc82ec62a55d00bb7d05755e&src=GD_JOB_AD&t=SR&vt=w&cs=1_578d0e99&cb=1743698194086&jobListingId=1009697557603&cpc=1FDE87803EF93CD3&jrtk=5-yul1-0-1inu85r8cl51t800-0342961be4a0491d---6NYlbfkN0CspiAC0MA2XQVRmzrasNU8iQ0KxRnARYAOOP-TCe0LuhcHH2N2S_X6xdEdv8ZfIeseWd4lfjDcGQBrGFY7tm-VQ2mR7OZHMvCw4PnMZ5XvsL4i6VZcR4UmxyxL1yKrsbS0ie1XJ9iulFyO43zbcEEBX7Z8Z1ctZHedhNi3TJeh01sRTCHq0Vdz83zSYVculyjwotkE6yTZemQ6S17gdqoLnEbLkn9ukJnLkublsc_7AG-3hqes_NCVXI8sDdELzIcoHkM_vTv_Tyd8v2MtLHHAeKRP1jDEP08D3YAO8SUqrVP5ijbpnrf_rwA29xIpQTn2r3egyj0meQ34RfqXbEb0A_dIFhsqfznwPtqGjSuYLdIrPtNFY30eBPzL0tPdtOtbQZeVaz8k3hXzAbXwBMcr5rvhFbwx6KoCbp6INIUQZ0Uz0PqkC6FcX2Eq2mYgxqc-zywS_eFvVgZd0puGwkU7oa6O_2yAPpOZnmWdCgjnOkpvAO0AYGz65xaM5kLH3FNb1j112t_KEbwn6Io1l_qRtYEUV7bdTtGhL0hO5EWSmGBRhU-bJliuYsGw0njHHbDLkbLn-iXLoFTDX5mY74ou_E6PYtVzgxkc2ZF9HaFLAI-fbRqOFJujJ7WyQsLr9M_Oe7XsURQPCu2dLukr7G7qSwPNdmBDVphvDUWAPvxlwylUvTbxdKsPKTsl7ZfbQIBk7Vtc-fPFMxxgMG0O3DPBSteiVEIi-rgQqfjK-XnXfaUeVIBpNBKa-VnuMlQojKqiPH7z7nY-qNI1OtaYiXNP_X7jcM-uxZGmw-sK4ZiFcqvRuWLzSnAJZeEHj1GCyiKJ0s7L21qdGLkKg-E_9N-EsqyWnImfcz16G_Ov5PS-1FjyZNXCpBHYP3tEi18TvtQeMQV_tORz-oJ7gPUBedDV,"Bachelor’s degree in cybersecurity, information technology, or a related field; advanced degree preferred. Familiarity with SIEM platforms, data analytics tools…&hellip;
      
        Skills: Analysis skills, Scripting, Data analytics, Intellectual property law, Cybersecurity
      
    "
 Security analyst ,United States,3.8,Leidos,Cybersecurity / RMF Analyst,"Odenton, MD",$68K - $122K (Employer est.),2d,https://www.glassdoor.com/partner/jobListing.htm?pos=1002&ao=1110586&s=58&guid=00000195fc82ec62a55d00bb7d05755e&src=GD_JOB_AD&t=SR&vt=w&cs=1_7fc2bb2e&cb=1743698194086&jobListingId=1009692170632&cpc=FB7E4A1762AE5BEC&jrtk=5-yul1-0-1inu85r8cl51t800-1825a90ff72b234e---6NYlbfkN0CZUO70VSdYKA8PR3jfrSh5ljhqJhfDt0PzQCMubt8cRmvypw7oDpSFoKSlg7BUk5gHegDOOv2D2vCcwxSK5d9AHDy4nf0jXuGoTdF2iBiNHoQqTIPQWvRzIlPQQBYtFytg1H0UY83tavvTwVUFGP8eMjK8UnegbE8kqr5_OSrp2bjV9haq4jvzzVVjNeZ5HelPmw5J31DTf-zobJ0o-4WIqIOBkbtvoWmXl6yukIZh8H9i2fyJ0zFe1Nv8dyvb6sDDXNS19exp4j1dtVPz5QRiI4APxwUuSEGJxc4IWruYhDG-fh1NSBj6CORSlIWGvd6JsLZhOmoyYU6YZgnj0E_eOpm7YNz68_-WP2wjA6yXGfupHib0YVJTcCUfzsBWnw6_h_GC4jO52iSyNptFApLMmrFl2LFx1szETpGnZyuLebwRU1X5g4XIZ6AlgsiWyL6clxud4HDSizPhfISSJvodqqBkDxay44GRI2cTiYuG7uT_DT0J74Q2ulVSi79phf4mptdUaX4xRs5oOHxdrvO_U3xXbaRNXnu0YeWvswLAgke_ooHGY6M9pBtu6WeZrWQjlMuXUlYAlC_vwZub9MkUHAA5epwxFJAitBUIblMJb_n0d38bFBZPR3R1h4c8FHKwImJGDixJhrToyDM-3yfP6hjC0ThOhIRzE0XtxuxuLDULLK__woS0YrPyKf76eUeXYcXQgZ3Xmckb8fh3QQesSyXdYZpQk4wSgVrN0ZY0-TbabDO3MI6Gr7MmvsDcrsBYvv1l_7dJ4OuXsp8bFwOZKQ3nKoGICAPuUf5KEL7HcvC4tSrnITBbwS7w6zdiiyAQw_MS9fIci1PoWHmjXRG9,"Support the implementation and administration of information security policies, procedures, and technologies to ensure the protection of systems, applications,…&hellip;
      
        Skills: Authentication, Encryption, IT auditing, FISMA, Information security
      
    "
 Security analyst ,United States,3.6,Cherokee Federal,Tier I Intrusion Analyst,"North Las Vegas, NV",$67K - $72K (Employer est.),2d,https://www.glassdoor.com/partner/jobListing.htm?pos=1003&ao=1136043&s=58&guid=00000195fc82ec62a55d00bb7d05755e&src=GD_JOB_AD&t=SR&vt=w&cs=1_cefe4f0c&cb=1743698194086&jobListingId=1009694098185&jrtk=5-yul1-0-1inu85r8cl51t800-9e4f2745ebe819f9,"Communication skills are critical with the ability to verbalize and provide documentation to both technical and non-technical audiences.&hellip;
      
        Skills: Computer science, Customer service, Host/hostess experience, Information security, Analysis skills
      
    "
 Security analyst ,United States,3.5,County of Henrico Police Division,Crime Analyst,"Henrico, VA",$60K - $63K (Employer est.),5d,https://www.glassdoor.com/partner/jobListing.htm?pos=1004&ao=1136043&s=58&guid=00000195fc82ec62a55d00bb7d05755e&src=GD_JOB_AD&t=SR&vt=w&cs=1_3844fcc4&cb=1743698194086&jobListingId=1009689417008&jrtk=5-yul1-0-1inu85r8cl51t800-e03b9949ea3bb966,"Performs in-depth data analysis using data sets from various Division databases related to offenses, calls for service, population demographics, and other…&hellip;
      
        Skills: ArcGIS, Microsoft Word, Statistics, Power BI, Microsoft Excel
      
    "
 Security analyst ,United States,3.1,Circle K,Cybersecurity Third-Party Risk Analyst,"Tempe, AZ",$54K - $85K (Glassdoor est.),5d,https://www.glassdoor.com/partner/jobListing.htm?pos=1005&ao=1136043&s=58&guid=00000195fc82ec62a55d00bb7d05755e&src=GD_JOB_AD&t=SR&vt=w&cs=1_c0286941&cb=1743698194086&jobListingId=1009689555353&jrtk=5-yul1-0-1inu85r8cl51t800-91a043d3a21b9781,"Bachelor’s degree in cybersecurity, information technology, risk management, or a related field. Familiarity with third-party risk management platforms and…&hellip;
      
        Skills: English, NIST standards, Risk management, ISO 27002, ISO 27001
      
    "
 Security analyst ,United States,3.6,ECi Software Solutions,SOC Analyst,United States,,5d,https://www.glassdoor.com/partner/jobListing.htm?pos=1006&ao=1136043&s=58&guid=00000195fc82ec62a55d00bb7d05755e&src=GD_JOB_AD&t=SR&vt=w&cs=1_659bfd41&cb=1743698194087&jobListingId=1009689194628&jrtk=5-yul1-0-1inu85r8cl51t800-ff8fd1191ee67b25,"Support risk management efforts by driving remediation initiatives and fostering stakeholder understanding of security risks and mitigation strategies.&hellip;
      
        Skills: Jira, Operating systems, FedRAMP, Information security, NIST standards
      
    "
 Security analyst ,United States,3.9,Event Risk Inc,Security Operations Center (SOC) Analyst,"San Antonio, TX",$25.00 Per Hour (Employer est.),5d,https://www.glassdoor.com/partner/jobListing.htm?pos=1007&ao=1136043&s=58&guid=00000195fc82ec62a55d00bb7d05755e&src=GD_JOB_AD&t=SR&vt=w&cs=1_c34a3a75&cb=1743698194087&jobListingId=1009689549647&jrtk=5-yul1-0-1inu85r8cl51t800-b9e1ac3208375ef0,"Client Request Management: Receive, acknowledge, and process incoming security requests from clients. Familiarity with security licensing and compliance…&hellip;
      
        Skills: Microsoft Office
      
    "
 Security analyst ,United States,4.6,Cabinet Peaks Medical Center,"Security Analyst, Part Time","Libby, MT",$28.17 - $39.44 Per Hour (Employer est.),5d,https://www.glassdoor.com/partner/jobListing.htm?pos=1008&ao=1136043&s=58&guid=00000195fc82ec62a55d00bb7d05755e&src=GD_JOB_AD&t=SR&vt=w&ea=1&cs=1_845f7518&cb=1743698194087&jobListingId=1009689478006&jrtk=5-yul1-0-1inu85r8cl51t800-80ca5c54959dca9d,"Communication Skills: Clear communication of security risks and recommendations to both technical and non-technical stakeholders.&hellip;
      
        Skills: Operating systems, Software troubleshooting, Information security, Analysis skills, Network protocols
      
    "
 Security analyst ,United States,4.0,General Dynamics Information Technology,Security Operation Center (SOC) Analyst II,"Colorado Springs, CO",$111K - $130K (Employer est.),5d,https://www.glassdoor.com/partner/jobListing.htm?pos=1009&ao=1110586&s=58&guid=00000195fc82ec62a55d00bb7d05755e&src=GD_JOB_AD&t=SR&vt=w&cs=1_03e212e0&cb=1743698194088&jobListingId=1009689552566&cpc=56C4EA4A1A191A49&jrtk=5-yul1-0-1inu85r8cl51t800-6931d9ad2808d736---6NYlbfkN0CaadLeoGiMM4ILB2UJu2ZywBTtYYlvv0AGLB0hyNDguT2YMyaOJxOXiD8PziwNMPTeDf2jwnVIBZ8apsF7p8gqH9X33S0pfH2zZ8Qh3u3isfOaZyXo6rxasBnhb_7fufZloS6jB5l861vOj-ag2_GbJoVq84zizUeQp4BKRevmW_47SGYlvmt2Cp5H36KuVFhPJinqEfS0tjPblq3t6bNlL4Gsx5hFbQ7araSkbEfzNSwAUVjnU3A8mgs9pK4yRwJW05HCN1MAacwCrWe8irsF7iQ1wgcLScWIcmweyu2iLNSKxKNyCaXWf8GMfVPTKAfTyFtVVk2rK78nlJb1XFzhkF8r_5BhAZfpmfHTYmLMb5yRfm3KGFwevh-lDKlrhcSmgsZd3lH_XsKLHu5SwSVlG_TK4wu2KIYnzJ1O00XdCrkfpqr_MRLnnkTFnaytcdgLbHZLk-gqhHCkoMdFOEIcAqEv4dCbKqKNR6W94Ano9JgoJgzuB_5YPVrQv0aDRH-iN2pFffHXg0gHooT0W2_rFHfQ-ie5tWwoM5W8aYswp1RPDQW6sVq1NOPvWc-dui2ipT-zgcu5y6MusPU8vP0xXHLAUfRvrGGrkhhQEiSVKrR9onGwyg4ZhHsRumv8DYccobnYe9hjPwRD7McLirScmr_zfvd9eu5AToXHjF0GvTpbXjx0zm5eAnamoBsSKptqTIb1yId9YirMKaxPC8B6ZuwWJkThgbw%3D,"Additionally, this candidate must be familiar with intrusion detection systems, intrusion analysis, security information event management platforms, endpoint…&hellip;
      
        Skills: TCP, Operating systems, Software deployment, SAP, Windows
      
    "
 Security analyst ,United States,3.2,American Credit Acceptance,Information Security Analyst I,"Spartanburg, SC",$68K - $97K (Glassdoor est.),5d,https://www.glassdoor.com/partner/jobListing.htm?pos=1010&ao=1136043&s=58&guid=00000195fc82ec62a55d00bb7d05755e&src=GD_JOB_AD&t=SR&vt=w&ea=1&cs=1_c8d1b18a&cb=1743698194087&jobListingId=1009689683848&jrtk=5-yul1-0-1inu85r8cl51t800-780e4ad9ec158c0b,"This role routinely uses standard office equipment such as computers, phones, photocopiers, filing cabinets, and fax machines.&hellip;
      
        Skills: Windows, Technical support, Information security, Analysis skills, Computer skills
      
    "
 Security analyst ,United States,3.1,1199SEIU Family of Funds,Information Security Analyst II,"New York, NY",$109K - $136K (Employer est.),5d,https://www.glassdoor.com/partner/jobListing.htm?pos=1011&ao=1136043&s=58&guid=00000195fc82ec62a55d00bb7d05755e&src=GD_JOB_AD&t=SR&vt=w&cs=1_26ae515f&cb=1743698194087&jobListingId=1009689633696&jrtk=5-yul1-0-1inu85r8cl51t800-4e58f8c4ce353d25,"Certified Information Systems Security Professional (CISSP) certification preferred; SANS and other Information Security related certification a plus.&hellip;
      
        Skills: Management, COBIT, Information security, Application development, Firewall
      
    "
 Security analyst ,United States,4.1,United Communications,Information Security Analyst,"Franklin, TN",,5d,https://www.glassdoor.com/partner/jobListing.htm?pos=1012&ao=1136043&s=58&guid=00000195fc82ec62a55d00bb7d05755e&src=GD_JOB_AD&t=SR&vt=w&ea=1&cs=1_7bb376d1&cb=1743698194088&jobListingId=1009689478135&jrtk=5-yul1-0-1inu85r8cl51t800-f267947880cfb452,"Valid driver's license with satisfactory driving record and current auto insurance. Bachelor’s degree in Cybersecurity, Computer Science, Information Technology…&hellip;
      
        Skills: Microsoft Windows Server, Microsoft Powerpoint, Microsoft Excel, Microsoft Outlook, Customer service
      
    "
 Security analyst ,United States,4.1,Digital Realty,IT Security Program Analyst,"Dallas, TX",$91K - $131K (Glassdoor est.),5d,https://www.glassdoor.com/partner/jobListing.htm?pos=1013&ao=1136043&s=58&guid=00000195fc82ec62a55d00bb7d05755e&src=GD_JOB_AD&t=SR&vt=w&cs=1_5d351ff0&cb=1743698194087&jobListingId=1009689242618&jrtk=5-yul1-0-1inu85r8cl51t800-df20e112a7fa03c2,"We develop infrastructures, design and build networks, support servers and provide the first line of support by delivering rich connectivity for our customers.&hellip;
      
        Skills: Operating systems, Management, Data analysis skills, Project coordination, Analysis skills
      
    "
 Security analyst ,United States,3.9,"Homeland Security and Emergency Services, Division of",Homeland Security Program Analyst 1,"Albany, NY",$65K - $83K (Employer est.),5d,https://www.glassdoor.com/partner/jobListing.htm?pos=1014&ao=1136043&s=58&guid=00000195fc82ec62a55d00bb7d05755e&src=GD_JOB_AD&t=SR&vt=w&cs=1_f16fd59d&cb=1743698194089&jobListingId=1009689230527&jrtk=5-yul1-0-1inu85r8cl51t800-74741709aac74516,"Minimum Qualifications Non-competitive: bachelor’s degree and two years of experience in intelligence analysis, homeland security, counter terrorism, emergency…&hellip;
      
        Skills: Analysis skills, Intelligence analysis, Intelligence experience
      
    "
 Security analyst ,United States,4.7,MTH Consulting,Senior IT Cyber Security Analyst,Remote,$110K - $130K (Employer est.),5d,https://www.glassdoor.com/partner/jobListing.htm?pos=1015&ao=1136043&s=58&guid=00000195fc82ec62a55d00bb7d05755e&src=GD_JOB_AD&t=SR&vt=w&ea=1&cs=1_91bd6778&cb=1743698194089&jobListingId=1009689329992&jrtk=5-yul1-0-1inu85r8cl51t800-ed20d0c3c46018de,"Bachelor’s degree in computer science, Electronics Engineering, or other engineering or technical discipline is required and 10 years of experience or a total…&hellip;
      
        Skills: Microsoft Windows Server, Computer science, Microsoft Excel, SCCM, Data analysis skills
      
    "
