Keyword,Location,rating,Company,Job_title,Place,salary,post_date,Job_URLs,Job_description
 Security analyst ,United States,3.3,Paycom Payroll Llc,IT Risk Analyst I,"Oklahoma City, OK",$62K - $84K (Glassdoor est.),24h,https://www.glassdoor.com/partner/jobListing.htm?pos=101&ao=1136043&s=58&guid=00000195fc73dbedb8cef1708623384a&src=GD_JOB_AD&t=SR&vt=w&cs=1_8b218f91&cb=1743697206726&jobListingId=1009695909953&jrtk=5-yul1-0-1inu77n22ljfn802-b064523de7643089,"The IT Risk team functions include assessing and mitigating risk through internal risk assessments and risk assessments for 3rd party vendors, providing client…&hellip;
      
        Skills: Research, Analysis skills, Risk management, IT, Communication skills
      
    "
 Security analyst ,United States,4.0,Personnel Decisions Research Institutes LLC,Junior IT Security Analyst,"Chantilly, VA",$88K - $121K (Glassdoor est.),3d,https://www.glassdoor.com/partner/jobListing.htm?pos=102&ao=1136043&s=58&guid=00000195fc73dbedb8cef1708623384a&src=GD_JOB_AD&t=SR&vt=w&ea=1&cs=1_682320c1&cb=1743697206727&jobListingId=1009691442903&jrtk=5-yul1-0-1inu77n22ljfn802-6d6dc39efe99dcee,"A premier software, research, and consulting firm in the field of industrial-organizational psychology, PDRI designs, develops and implements human resource…&hellip;
      
        Skills: Microsoft Word, Microsoft Excel, Azure, Management, FedRAMP
      
    "
 Security analyst ,United States,3.6,Peraton,Threat Analyst (I&W),"Rosslyn, VA",$86K - $138K (Employer est.),30d+,https://www.glassdoor.com/partner/jobListing.htm?pos=103&ao=1110586&s=58&guid=00000195fc73dbedb8cef1708623384a&src=GD_JOB_AD&t=SR&vt=w&cs=1_9cd18627&cb=1743697206728&jobListingId=1009563938126&cpc=334ABAF5D42DC775&jrtk=5-yul1-0-1inu77n22ljfn802-e8073b98f00dee1d---6NYlbfkN0BWrJOJIc9CpN6yMpv0V0AydpTkzwx7H4nhH8WAx3qz9DFPmyzxY6nkpvoqD-A7XLsv02LuwRELqWNE0BdMijaGdlIunubSi8YGvH5vGsj_OwRDSc1THFNOzheBcK4zWTzKU3crkZ-mIPe1UIXFSBXJ8BisuAujJMTTvmUkNENEKZs51czwoHeUE_mzMRuG9vRWS--DXmeySagQnwP6LUosFsk4Osly3Yz86MV_H8BZjWhwyQgW92HXXQJwve2hk9uKtPqsLywpbLkzlCG50VrPgAANGC1xSVdhvx0oTbg9Z6rUcm8yw_AdwMsYPHDlNw6NuneEwJDByHhFSo3RcYlmZ01LFDNiY911AdzlagLJOzxkY71pgJHnrvRz7t_3KRiEDAkgldkAvZWIc5CkVOhhS0FGONt8YDF954x1L83yWJ7fkdfH8q7b4_3mJgND-A9v0TxFeFCtpIsQCM4HXpamZqBDt0S2nR6v3kHQ10RpPQPgWhP5ShsTfDRFl3w9Vq1gQ7nV4NmAnrSVqbJl4TUOorkGm5858l08QGRAXmu7U_QWrVEUP-l0ifrkpzckAt0bOCEYk6IJMNbsUXJJGYyUJu2LRQWRPP4hRqeatMLuJ_ZrQ3qSYDUznVRzAXsgOP1IrAPay1saA_5z6b7BUJEZ1xe_-YKGK7Q8mZgN6oSzSnE1RQjS0esN_w69CRu_io_kBvC5svZP-ZP7IPZn5Gkmze5gOVoTjEICqqv0uGkXx3PejJT9V3M72hEVCUZTQzpIHFYVfUXNC97I3g5W_GZMP9XiPOXRNoTkbSVYr-g6WhjX6oJ-Dsuhi2WFdsEwxa_3FONJORMI3HvXaw0mlBDdbvuqgQwrs9g%3D,"Encompasses technical, engineering, data analytics, cyber security, management, operational, logistical, and administrative support for Bureau of Diplomatic…&hellip;
      
        Skills: Splunk, SIEM, Leadership, Communication skills
      
    "
 Security analyst ,United States,3.6,Peraton,Jr Industrial Control System Cyber Threat Intelligence Analyst,"Arlington, VA",$80K - $128K (Employer est.),30d+,https://www.glassdoor.com/partner/jobListing.htm?pos=104&ao=1110586&s=58&guid=00000195fc73dbedb8cef1708623384a&src=GD_JOB_AD&t=SR&vt=w&cs=1_8132e578&cb=1743697206727&jobListingId=1009565568301&cpc=334ABAF5D42DC775&jrtk=5-yul1-0-1inu77n22ljfn802-b58141df87117160---6NYlbfkN0BWrJOJIc9CpN6yMpv0V0AydpTkzwx7H4nhH8WAx3qz9DFPmyzxY6nkpvoqD-A7XLvA2rhtPrGAwg7Ut901z807FlsQ4Pq2ooyW5k1hvjeYT87BYagf4E0DZ8lzcImCBu23OPagwofaDNXZMkJcCJKe0oO0mdKtSDl2_v1cdhKAeqIXUJd26Ehi_fM2mMcQLXACAVx6hxETTSeg8eN-PC_FY4LQm8qiRNip7cXg6PmzFKyLySrC6PXlSL_I0Hn0XO2y-EmRUyxsrpvw7llULqHX2xZZvkSUKbXszs9dSdZL-GVx4g4TbHkIzWE_OREmItH7lVR0azfBPwth11vziuNHDAL85eMUg1GnxBRxPxDRqeJJxMHgRbG1MC-eC58EknCPvo-f6Az7XfV0oaR1L5euWUgK8b5m5-_Db17lugcTbLd2JhUuepzczCeDVeQdtewe6oOXGG8IxoCIvieElbAdCiIwv8ScieVOxolAQwIbf6RtCem53Y8Qg997FAUnjYZUtx6SqpMML-ezOINARijtU9THBqLLJBARwRD6ZeCWiHFIIFhnpNMG4sE45WWFsLAjUd0g2qSXNhRd7v2yZFLS6uzyRArqgnnkb-KfEXkJpCzCOfiMmqqVpMsiy7wyXj0SvJD2f2vWedSk0YoTSArGZ4ORaeeoV7gdEefKHniuZqUqj5tEBBCC23JKV-DnQBXKy39G7dfdtuHmqFZinuw4KFwTraUAqdpZJvw3g0tFRMGT9SUxUp8U_-Aacc6sN_3kCbuTiA3yzDNFhu_6h-AFA85q43yIJQR_e7NvCyDfgPWBvYRtVeUTHT5V6rYgdoL6pZ2kS1DeCaMVYsWs0b5IlZrLyrmX-ap8Ghj--BVNa0edODLZ8fzHql9hdaS3QVbiCQ3O_YC3EH6zcdx8LwfY,"Fuse multiple intelligence sources to develop products, recommendations, and inform priorities for the organization. SANS GIAC Cyber Threat Intelligence (GCTI).&hellip;
      
        Skills: Analysis skills
      
    "
 Security analyst ,United States,4.0,ISSE SERVICES LLC,Junior Security Operations Center (SOC) Analyst,"Clearfield, UT",$65K - $75K (Employer est.),22d,https://www.glassdoor.com/partner/jobListing.htm?pos=105&ao=1136043&s=58&guid=00000195fc73dbedb8cef1708623384a&src=GD_JOB_AD&t=SR&vt=w&cs=1_0b4ee81b&cb=1743697206728&jobListingId=1009669863505&jrtk=5-yul1-0-1inu77n22ljfn802-16166445ae77e3a9,"Education: Bachelor’s degree in Cybersecurity, Computer Science, IT, or related field (or equivalent experience).&hellip;
      
        Skills: Computer science, TCP, Firewall, Analysis skills, NIST standards
      
    "
 Security analyst ,United States,3.8,Uber,Security Analyst 1,"San Francisco, CA",$128K - $135K (Employer est.),7d,https://www.glassdoor.com/partner/jobListing.htm?pos=106&ao=1136043&s=58&guid=00000195fc73dbedb8cef1708623384a&src=GD_JOB_AD&t=SR&vt=w&cs=1_32e0cfc2&cb=1743697206727&jobListingId=1009686853680&jrtk=5-yul1-0-1inu77n22ljfn802-b58363549593b620,"You will be on the front-line of defense for the Uber Security Incident Response program by handling triage and investigations for all security alerts for Uber…&hellip;
      
        Skills: TCP, SoC, TCP/IP, Cybersecurity, Leadership
      
    "
 Security analyst ,United States,3.4,LivaNova,Junior Security Analyst,"Houston, TX",$65K - $85K (Employer est.),30d+,https://www.glassdoor.com/partner/jobListing.htm?pos=107&ao=1136043&s=58&guid=00000195fc73dbedb8cef1708623384a&src=GD_JOB_AD&t=SR&vt=w&cs=1_717ac904&cb=1743697206728&jobListingId=1009594581015&jrtk=5-yul1-0-1inu77n22ljfn802-0d6d1dc2f04fe526,"BS in Business, Computer Science, Information Security, or a related field. It is expected that certification will be earned within 3 years of hire date.&hellip;
      
        Skills: COSO, Management, COBIT, SOX, Information security
      
    "
 Security analyst ,United States,3.5,"Southcoast Health System, Inc.",Govern-Risk-Compl Analyst I,"New Bedford, MA",$92K - $147K (Employer est.),24h,https://www.glassdoor.com/partner/jobListing.htm?pos=108&ao=1136043&s=58&guid=00000195fc73dbedb8cef1708623384a&src=GD_JOB_AD&t=SR&vt=w&cs=1_4bc71051&cb=1743697206728&jobListingId=1009696307856&jrtk=5-yul1-0-1inu77n22ljfn802-309466315fe2a063,"Bachelors degree or equivalent, with a minimum of 2-4 years experience in risk management, IT audit, or similar field. Generous Earned Time Off Package**.&hellip;
      
        Skills: IT auditing, HIPAA, Microsoft Office, Project management, NIST standards
      
    "
 Security analyst ,United States,3.6,Peraton,Cyber Intel Analyst SME - I&W,"Arlington, VA",$112K - $179K (Employer est.),26d,https://www.glassdoor.com/partner/jobListing.htm?pos=109&ao=1110586&s=58&guid=00000195fc73dbedb8cef1708623384a&src=GD_JOB_AD&t=SR&vt=w&cs=1_43297b13&cb=1743697206729&jobListingId=1009665371239&cpc=AC285F3A3ECA6BB0&jrtk=5-yul1-0-1inu77n22ljfn802-027ea1a21ff74dcd---6NYlbfkN0BWrJOJIc9CpN6yMpv0V0AydpTkzwx7H4nhH8WAx3qz9DFPmyzxY6nkpvoqD-A7XLvYXzg0K7KC0N8NK50QJMHrFXgTQAG8-OA1Q9nMp0xbCrT-z2_KgYcwVAQDzDnBiyx6v6IlwNswz7CbMnntFehePmbRI-K_NjVtY8sACl_GUS1XBTSIKezbrKF3y-V-djUcw-8chQcNHMtiVmaqfpYNJbRl4xa71TYSabBRMermUkO8Cj9p-GOuhhi0pjvlBy3j9PB21LL3A1tu9GJFSJmzoxGT9XbgCT0aF7sW5CWTxLHgQaxm13zEeKwOROUYhuWA__k2uMme4yQl2lpDnKeZasHP39H9zBykfqpZpXA0epMayuYHIMF7d7tblUNGzk8k3Zyhk3EbKi3o52sFTrcb8wGGx3qsyBqixpzyvBKD5F7CM66mlJ0V9QwcB2GYympuLi8EAcL7X64aJQwlELO-PCjBWBkfUyIp3ybhI7tjcECM_YAU38cchq9qH-nDnK6IHMNp4oWOQJQv2snXIFWuBLA3c_eomrM9FB520FBa9YDxJ-44xCz_22ZyoI1233oefxEJB1PQFblitjLzFeUmTrfePROOXVJZQGs7HuqFL7XHfsDY4nfOfNyFiYDr75SZ1qlz0IrI5o01_TwVxlFz7jjEa8uJXbel1gD2zuxO-rCzgCrUSGk9CQDpl99jhJogE16hMegbYJ2tXr5_fn0yJRU-pGy-QkOs1l6QF6rZ3WYy545-PQPPTlBck5PqujEjfl0nzBWtGBjuVzDH2-D1DSjuQb5tkl7T6JBNPDWBl6JwibZ3xE_4IpA-CzJmko_tjOS5Z3jcgT_43NfDu4dBBgPOfol6gPZifwxAZiHTIQ%3D%3D,"Encompasses technical, engineering, data analytics, cyber security, management, operational, logistical, and administrative support for Bureau of Diplomatic…&hellip;
      
        Skills: Splunk, SIEM, Leadership, Communication skills
      
    "
 Security analyst ,United States,3.5,United Center,Information Security Analyst I,"Chicago, IL",$65K - $85K (Employer est.),29d,https://www.glassdoor.com/partner/jobListing.htm?pos=110&ao=1136043&s=58&guid=00000195fc73dbedb8cef1708623384a&src=GD_JOB_AD&t=SR&vt=w&cs=1_72c88001&cb=1743697206729&jobListingId=1009660901783&jrtk=5-yul1-0-1inu77n22ljfn802-8966e010382d508d,"Bachelor’s degree in computer science, Information Security, or related field. Effective communication skills with the ability to effectively communicate…&hellip;
      
        Skills: Information security, Analysis skills, Math, Cybersecurity, Communication skills
      
    "
 Security analyst ,United States,4.0,Missouri Farm Bureau Services,Security Analyst I,"Jefferson City, MO",$70K - $85K (Employer est.),7d,https://www.glassdoor.com/partner/jobListing.htm?pos=111&ao=1136043&s=58&guid=00000195fc73dbedb8cef1708623384a&src=GD_JOB_AD&t=SR&vt=w&cs=1_6c97f831&cb=1743697206729&jobListingId=1009686747173&jrtk=5-yul1-0-1inu77n22ljfn802-c46c7132a8f6cce1,"Can be noisier due to conversations, phone calls, office and environmental equipment. Support the implementation of security tools such as firewalls, antivirus,…&hellip;
      
        Skills: Computer science, Operating systems, Encryption, Analysis skills, IDS
      
    "
 Security analyst ,United States,3.9,New Jersey Courts,Information Technology Analyst 1,Township of Hamilton,$59K - $97K (Employer est.),7d,https://www.glassdoor.com/partner/jobListing.htm?pos=112&ao=1136043&s=58&guid=00000195fc73dbedb8cef1708623384a&src=GD_JOB_AD&t=SR&vt=w&cs=1_795b523e&cb=1743697206730&jobListingId=1009686887713&jrtk=5-yul1-0-1inu77n22ljfn802-18602b7f28d6ef1e,"Driver's License: Appointee will be required to possess a driver's license valid in New Jersey only if the operation of a vehicle is necessary to perform…&hellip;
      
        Skills: Software troubleshooting
      
    "
 Security analyst ,United States,3.6,Summit Credit Union,Information Security Analyst 1,"Cottage Grove, WI",$56K - $79K (Glassdoor est.),26d,https://www.glassdoor.com/partner/jobListing.htm?pos=113&ao=1136043&s=58&guid=00000195fc73dbedb8cef1708623384a&src=GD_JOB_AD&t=SR&vt=w&cs=1_4e86c573&cb=1743697206729&jobListingId=1009665297051&jrtk=5-yul1-0-1inu77n22ljfn802-3539f643993946e7,"Associate degree with a focus in information systems, security, computer science or a related technical field of study preferred. 41 CFR 60-1.35(c).&hellip;
      
        Skills: TCP, Operating systems, Writing skills, Windows, Information security
      
    "
 Security analyst ,United States,,Turn Up Talent,Junior Security Analyst,"Fort Wayne, IN",$65K (Employer est.),7d,https://www.glassdoor.com/partner/jobListing.htm?pos=114&ao=1136043&s=58&guid=00000195fc73dbedb8cef1708623384a&src=GD_JOB_AD&t=SR&vt=w&ea=1&cs=1_90809b9b&cb=1743697206729&jobListingId=1009686882728&jrtk=5-yul1-0-1inu77n22ljfn802-0319722ceeefa896,"This role is ideal for a detail-oriented and security-focused professional with *3-5 years of experience* in IT security, patch management, or a related field.&hellip;
      
        Skills: Management, Firewall, Analysis skills, IT, Communication skills
      
    "
 Security analyst ,United States,3.6,Metropolitan Transportation Authority,Transit Management Analyst Trainee - Security,"Brooklyn, NY",$56K - $65K (Employer est.),13d,https://www.glassdoor.com/partner/jobListing.htm?pos=115&ao=1136043&s=58&guid=00000195fc73dbedb8cef1708623384a&src=GD_JOB_AD&t=SR&vt=w&cs=1_000ffbb2&cb=1743697206730&jobListingId=1009680916199&jrtk=5-yul1-0-1inu77n22ljfn802-74cfbaef8cdfe544,"A master's degree from an accredited college in accounting, architecture, business administration, computer science, economics, engineering, engineering…&hellip;
      
        Skills: Microsoft Powerpoint, Microsoft Word, Microsoft Excel, Windows, Organizational skills
      
    "
 Security analyst ,United States,3.9,Major League Baseball (MLB),Jr. Identity Security Analyst (seasonal),"New York, NY",$23.00 - $30.00 Per Hour (Employer est.),22d,https://www.glassdoor.com/partner/jobListing.htm?pos=116&ao=1136043&s=58&guid=00000195fc73dbedb8cef1708623384a&src=GD_JOB_AD&t=SR&vt=w&cs=1_89c85773&cb=1743697206730&jobListingId=1009669676718&jrtk=5-yul1-0-1inu77n22ljfn802-335d4e6dab195875,"Previous experience in an entry-level security role or as a technical information security consultant is beneficial but not required.&hellip;
      
        Skills: Authentication, SSO, Computer science, Azure, Management
      
    "
 Security analyst ,United States,3.3,Essentia Health,"Infrastructure Security Analyst I, II, or III","Duluth, MN",$64K - $96K (Employer est.),24h,https://www.glassdoor.com/partner/jobListing.htm?pos=117&ao=1136043&s=58&guid=00000195fc73dbedb8cef1708623384a&src=GD_JOB_AD&t=SR&vt=w&ea=1&cs=1_78bdf88c&cb=1743697206730&jobListingId=1009694818700&jrtk=5-yul1-0-1inu77n22ljfn802-3b647972e52476c2,"Bachelors Degree in Computer Science, Management Information Systems or a related technology field. Preferred certifications: Industry standard technology…&hellip;
      
        Skills: IT
      
    "
 Security analyst ,United States,4.2,UNS Energy Corporation,IT Security Analyst I-III,"Tucson, AZ",$77K - $106K (Glassdoor est.),2d,https://www.glassdoor.com/partner/jobListing.htm?pos=118&ao=1136043&s=58&guid=00000195fc73dbedb8cef1708623384a&src=GD_JOB_AD&t=SR&vt=w&cs=1_c267d919&cb=1743697206730&jobListingId=1009694231207&jrtk=5-yul1-0-1inu77n22ljfn802-233231e1fcad3f47,"Performs security analysis, including architecture review, baselines, vulnerability assessments, and risk assessments to proactively identify security risks and…&hellip;
      
        Skills: Computer science, TCP, Oracle, PCI, Project planning
      
    "
 Security analyst ,United States,3.8,Vulcan Materials Company,Junior Network Security Analyst - Skillbridge,"Birmingham, AL",$53K - $81K (Glassdoor est.),24h,https://www.glassdoor.com/partner/jobListing.htm?pos=119&ao=1136043&s=58&guid=00000195fc73dbedb8cef1708623384a&src=GD_JOB_AD&t=SR&vt=w&cs=1_1da5e524&cb=1743697206731&jobListingId=1009696529358&jrtk=5-yul1-0-1inu77n22ljfn802-f8d400209c7aad22,"Ability to write and speak English clearly, including the ability to communicate technical issues to non-technical people. Experience with SIEM and SOAR tools.&hellip;
      
        Skills: TCP, Customer service, English, Information security, Analysis skills
      
    "
 Security analyst ,United States,3.6,F.N.B. Corp.,Security Access Management Analyst 1,"Pittsburgh, PA",$60K - $86K (Glassdoor est.),30d+,https://www.glassdoor.com/partner/jobListing.htm?pos=120&ao=1136043&s=58&guid=00000195fc73dbedb8cef1708623384a&src=GD_JOB_AD&t=SR&vt=w&cs=1_db9ec291&cb=1743697206731&jobListingId=1009645650653&jrtk=5-yul1-0-1inu77n22ljfn802-5cdbdc78d2dcddfa,"Conducts regular security audits, analysis and assessments per security policy. Assesses and resolves user access problems related to security controls to…&hellip;
      
        Skills: Microsoft Powerpoint, Microsoft Word, Microsoft Excel, Customer service, Analysis skills
      
    "
 Security analyst ,United States,3.8,State of South Carolina,Risk Management & Compliance Analyst I / IT Security Risk Analyst - 174821,"Blythewood, SC",$64K - $67K (Employer est.),12d,https://www.glassdoor.com/partner/jobListing.htm?pos=121&ao=1136043&s=58&guid=00000195fc73dbedb8cef1708623384a&src=GD_JOB_AD&t=SR&vt=w&cs=1_77dc7396&cb=1743697206730&jobListingId=1009682098148&jrtk=5-yul1-0-1inu77n22ljfn802-36d4bdc13703ff2f,"Required to keep state provided cell phone on and nearby at all times. In coordination with the Security Team Manager works on outlining and planning DMV’s…&hellip;
      
        Skills: Management, Information security, NIST standards
      
    "
 Security analyst ,United States,4.0,Holland & Knight LLP,IT Risk & Vendor Junior Analyst (Hybrid),"Brandon, FL",$54K - $85K (Glassdoor est.),6d,https://www.glassdoor.com/partner/jobListing.htm?pos=122&ao=1136043&s=58&guid=00000195fc73dbedb8cef1708623384a&src=GD_JOB_AD&t=SR&vt=w&cs=1_03698818&cb=1743697206732&jobListingId=1009688212856&jrtk=5-yul1-0-1inu77n22ljfn802-968a9f7bc7d06f63,"Bachelor’s degree in information technology, Business Administration, or related field. The incumbent in this role will assist in identifying potential risks,…&hellip;
      
        Skills: COBIT, Vendor management, Microsoft Office, Information security, Analysis skills
      
    "
 Security analyst ,United States,3.8,State of Utah,Information Security Analyst I - Security Operations Center,"Salt Lake City, UT",$25.33 - $43.57 Per Hour (Employer est.),9d,https://www.glassdoor.com/partner/jobListing.htm?pos=123&ao=1136043&s=58&guid=00000195fc73dbedb8cef1708623384a&src=GD_JOB_AD&t=SR&vt=w&cs=1_6987926a&cb=1743697206730&jobListingId=1009684452241&jrtk=5-yul1-0-1inu77n22ljfn802-178765e64d29306f,"The chosen candidate will perform working level Information security technology related duties in the areas of GRAMA, incident response, security event analysis…&hellip;
      
        Skills: Information security, IDS
      
    "
 Security analyst ,United States,3.1,Mount Nittany Health,Security Analyst I,"State College, PA",$47K - $66K (Glassdoor est.),30d+,https://www.glassdoor.com/partner/jobListing.htm?pos=124&ao=1136043&s=58&guid=00000195fc73dbedb8cef1708623384a&src=GD_JOB_AD&t=SR&vt=w&cs=1_c29e6cfa&cb=1743697206732&jobListingId=1009643012622&jrtk=5-yul1-0-1inu77n22ljfn802-0748cb8672154d21,"B) Communicates with third party providers to design IT security architecture changes, enhancements or other mitigating controls.&hellip;
      
        Skills: Computer science, Encryption, Information security, Analysis skills, IT
      
    "
 Security analyst ,United States,3.8,"Skyline Technology Solutions, LLC",Junior Cyber Defense Analyst,"Glen Burnie, MD",$55K - $65K (Employer est.),24h,https://www.glassdoor.com/partner/jobListing.htm?pos=125&ao=1136043&s=58&guid=00000195fc73dbedb8cef1708623384a&src=GD_JOB_AD&t=SR&vt=w&cs=1_021d02d7&cb=1743697206731&jobListingId=1009694761599&jrtk=5-yul1-0-1inu77n22ljfn802-8fe145db66228e67,"Continual professional growth in the security field through the pursuit of security-related certifications and learning.&hellip;
      
        Skills: TCP, Management, Information security, Firewall, Continuous improvement
      
    "
 Security analyst ,United States,4.0,KeyLogic Systems,Junior-level Vulnerability Assessment Analyst (VAT),"Alexandria, VA",$62K (Employer est.),2d,https://www.glassdoor.com/partner/jobListing.htm?pos=126&ao=1136043&s=58&guid=00000195fc73dbedb8cef1708623384a&src=GD_JOB_AD&t=SR&vt=w&cs=1_d2853f4c&cb=1743697206731&jobListingId=1009692259349&jrtk=5-yul1-0-1inu77n22ljfn802-2b1268ba305acc67,"Strong analytical and technical skills in conducting vulnerability assessments, conduct troubleshooting of failed scans, as well as abilities and prior…&hellip;
      
        Skills: TCP, Operating systems, Management, FISMA, Windows
      
    "
 Security analyst ,United States,3.2,State of Maryland,IT Service Delivery & Security Analyst Jr. (IT TECHNICAL SUPPORT SPECIALIST II),"Linthicum, MD",$37.84 - $61.12 Per Hour (Employer est.),9d,https://www.glassdoor.com/partner/jobListing.htm?pos=127&ao=1136043&s=58&guid=00000195fc73dbedb8cef1708623384a&src=GD_JOB_AD&t=SR&vt=w&cs=1_4e5d1825&cb=1743697206731&jobListingId=1009685077771&jrtk=5-yul1-0-1inu77n22ljfn802-fa3ff75a8ededddf,"Candidates may substitute thirty credit hours from an accredited college or university in Computer Information Technology, Computer Science, Management…&hellip;
      
        Skills: Jira, Bilingual, Operating systems, Military, System design
      
    "
 Security analyst ,United States,3.9,"Homeland Security and Emergency Services, Division of",Homeland Security Program Analyst 1,"Albany, NY",$65K - $83K (Employer est.),5d,https://www.glassdoor.com/partner/jobListing.htm?pos=128&ao=1136043&s=58&guid=00000195fc73dbedb8cef1708623384a&src=GD_JOB_AD&t=SR&vt=w&cs=1_89fcf4a3&cb=1743697206731&jobListingId=1009689230527&jrtk=5-yul1-0-1inu77n22ljfn802-74741709aac74516,"Minimum Qualifications Non-competitive: bachelor’s degree and two years of experience in intelligence analysis, homeland security, counter terrorism, emergency…&hellip;
      
        Skills: Analysis skills, Intelligence analysis, Intelligence experience
      
    "
 Security analyst ,United States,3.7,Atlantic Casualty Insurance Company,Network Security Analyst I,"Goldsboro, NC",$75K - $104K (Glassdoor est.),24h,https://www.glassdoor.com/partner/jobListing.htm?pos=129&ao=1136043&s=58&guid=00000195fc73dbedb8cef1708623384a&src=GD_JOB_AD&t=SR&vt=w&ea=1&cs=1_06951509&cb=1743697206732&jobListingId=1009694567177&jrtk=5-yul1-0-1inu77n22ljfn802-038d8c45767a3f5c,"Knowledge of the security field’s concepts and principles. BS in computer related field or equivalent work experience. Analyzes traffic to identify anomalies.&hellip;
      
        Skills: Encryption, Information security, Project management, Computer skills, Communication skills
      
    "
 Security analyst ,United States,3.2,American Credit Acceptance,Information Security Analyst I,"Spartanburg, SC",$68K - $97K (Glassdoor est.),5d,https://www.glassdoor.com/partner/jobListing.htm?pos=130&ao=1136043&s=58&guid=00000195fc73dbedb8cef1708623384a&src=GD_JOB_AD&t=SR&vt=w&ea=1&cs=1_9abf06cb&cb=1743697206732&jobListingId=1009689683848&jrtk=5-yul1-0-1inu77n22ljfn802-780e4ad9ec158c0b,"This role routinely uses standard office equipment such as computers, phones, photocopiers, filing cabinets, and fax machines.&hellip;
      
        Skills: Windows, Technical support, Information security, Analysis skills, Computer skills
      
    "
 Security analyst ,United States,4.9,BTS Software Solutions,COMPUTER NETWORK DEFENSE ANALYST (Levels I-IV),"San Antonio, TX",$120K - $260K (Employer est.),24h,https://www.glassdoor.com/partner/jobListing.htm?pos=301&ao=1136043&s=58&guid=00000195fc7448dfabdf3df677aa3634&src=GD_JOB_AD&t=SR&vt=w&cs=1_5dd8a3b7&cb=1743697234638&jobListingId=1009696556815&jrtk=5-yul1-0-1inu78i9igb2a801-9d7eff12ed9e4788,"Relevant experience must be in computer or information systems design/development, programming, information/cyber/network security, vulnerability analysis,…&hellip;
      
        Skills: System design, Analysis skills, Computer networking, Computer skills
      
    "
 Security analyst ,United States,,Strategic Analytix,Cyber Network Defense Analyst (Skill Level 1-4),"Bluffdale, UT",$62K - $95K (Glassdoor est.),30d+,https://www.glassdoor.com/partner/jobListing.htm?pos=302&ao=1136043&s=58&guid=00000195fc7448dfabdf3df677aa3634&src=GD_JOB_AD&t=SR&vt=w&ea=1&cs=1_a1b3f49e&cb=1743697234638&jobListingId=1009573691255&jrtk=5-yul1-0-1inu78i9igb2a801-69d1309f7fbb4945,"Experience in computer or information systems design/development, programming, information/cyber/network security, vulnerability analysis, penetration testing,…&hellip;
      
        Skills: System administration, System design, Russian, IDS, Systems engineering
      
    "
 Security analyst ,United States,,JY Systems LLC,Computer Network Defense Analyst Level 1,"Fort Meade, MD",$90K - $110K (Employer est.),30d+,https://www.glassdoor.com/partner/jobListing.htm?pos=303&ao=1136043&s=58&guid=00000195fc7448dfabdf3df677aa3634&src=GD_JOB_AD&t=SR&vt=w&ea=1&cs=1_1104bff2&cb=1743697234638&jobListingId=1008979797604&jrtk=5-yul1-0-1inu78i9igb2a801-4f0117884bdac0fe,"Relevant experience must be in computer or information systems design/development, programming, information/cyber/network security, vulnerability analysis,…&hellip;
      
        Skills: Computer science, System administration, Encryption, System design, Analysis skills
      
    "
 Security analyst ,United States,4.5,RealmOne,Cyber Defense Analyst 1 (PIPELINE),Maryland,$107K - $160K (Employer est.),30d+,https://www.glassdoor.com/partner/jobListing.htm?pos=304&ao=1136043&s=58&guid=00000195fc7448dfabdf3df677aa3634&src=GD_JOB_AD&t=SR&vt=w&cs=1_2e02ab7e&cb=1743697234639&jobListingId=1009382769110&jrtk=5-yul1-0-1inu78i9igb2a801-65399a378f948d21,"Requires DoD 8570 compliance with CSSP Analyst baseline certification. Requires DoD 8570 compliance with IAT Level I or Level II certification.&hellip;
      
        Skills: Management, Network protocols, Splunk
      
    "
 Security analyst ,United States,3.8,Leidos,Tier 1 AS&W Analyst,Virginia,$55K - $100K (Employer est.),15d,https://www.glassdoor.com/partner/jobListing.htm?pos=305&ao=1136043&s=58&guid=00000195fc7448dfabdf3df677aa3634&src=GD_JOB_AD&t=SR&vt=w&cs=1_84adec88&cb=1743697234640&jobListingId=1009678204362&jrtk=5-yul1-0-1inu78i9igb2a801-456885910c84c2fe,"Emphasis on ability to succinctly and accurately capture technical details and summarize findings for less technical audiences.&hellip;
      
        Skills: LAN, Analysis skills, Intelligence analysis, Computer networking, Counterintelligence
      
    "
