Keyword,Location,rating,Company,Job_title,Place,salary,post_date,Job_URLs,Job_description
 Security analyst ,United States,4.5,"MSA Professional Services, Inc.",Security Analyst,"Baraboo, WI",$62K - $96K (Glassdoor est.),8d,https://www.glassdoor.com/partner/jobListing.htm?pos=1611&ao=1136043&s=58&guid=00000195fc83aaa2ae6c16204e14c6b5&src=GD_JOB_AD&t=SR&vt=w&cs=1_0fa9d5e2&cb=1743698242833&jobListingId=1009685547741&jrtk=5-yul1-0-1inu87atg2dig000-7433fd6bced28332,"Bachelor's degree in Cybersecurity, IT or a related field. Fully understand and can implement policies for Microsoft Entra ID: conditional access, identity…&hellip;
      
        Skills: SSO, Civil engineering, Microsoft Access, Management, Windows
      
    "
 Security analyst ,United States,4.1,"Marotta Controls, Inc.",Information Security Analyst I,United States,,7d,https://www.glassdoor.com/partner/jobListing.htm?pos=1612&ao=1136043&s=58&guid=00000195fc83aaa2ae6c16204e14c6b5&src=GD_JOB_AD&t=SR&vt=w&ea=1&cs=1_d2093a15&cb=1743698242832&jobListingId=1009686689138&jrtk=5-yul1-0-1inu87atg2dig000-b6cb9bf39a0093c8,"Excellent written and verbal skills, including ability to clearly articulate technical issues and activities to technical and non-technical staff.&hellip;
      
        Skills: Software troubleshooting, LAN, Microsoft Office, Information security, SQL
      
    "
 Security analyst ,United States,5.0,"Presidential Staffing Solutions, LLC",IT Operations & Cybersecurity Analyst,"Dallas, TX",$75K - $110K (Employer est.),10d,https://www.glassdoor.com/partner/jobListing.htm?pos=1613&ao=1136043&s=58&guid=00000195fc83aaa2ae6c16204e14c6b5&src=GD_JOB_AD&t=SR&vt=w&ea=1&cs=1_2cc0e109&cb=1743698242832&jobListingId=1009682860778&jrtk=5-yul1-0-1inu87atg2dig000-a0a952318fb38e6d,"A bachelor’s degree in Computer Science or a related field is preferred. Trains users, technicians, and less experienced personnel in using the system; assigns…&hellip;
      
        Skills: Computer science, CSS, XML, System design, Application development
      
    "
 Security analyst ,United States,4.0,Repsol,Corporate Security Sr. Analyst,"Houston, TX",,7d,https://www.glassdoor.com/partner/jobListing.htm?pos=1614&ao=1136043&s=58&guid=00000195fc83aaa2ae6c16204e14c6b5&src=GD_JOB_AD&t=SR&vt=w&cs=1_04b28e20&cb=1743698242832&jobListingId=1009686974005&jrtk=5-yul1-0-1inu87atg2dig000-866b01dec59c273d,"Bachelor’s degree or higher in Criminal Justice or related field. This role is also responsible for leading confidential investigations and acting as liaison…&hellip;
      
        Skills: Spanish, Crisis management, Military, Information security, Analysis skills
      
    "
 Security analyst ,United States,3.7,PISCA Panasonic Information Systems Company America,Security Operations Center Analyst II,United States,$100K - $110K (Employer est.),7d,https://www.glassdoor.com/partner/jobListing.htm?pos=1615&ao=1136043&s=58&guid=00000195fc83aaa2ae6c16204e14c6b5&src=GD_JOB_AD&t=SR&vt=w&cs=1_ddb48467&cb=1743698242834&jobListingId=1009686947647&jrtk=5-yul1-0-1inu87atg2dig000-f5194f0801cf44cf,"Communicate incident status to both technical and non-technical users within the organization. All candidates must have valid authorization to work in the U.S.&hellip;
      
        Skills: System administration, Windows, Java, PHP, C
      
    "
 Security analyst ,United States,4.2,"Technology Security Associates, Inc.",Program Protection Security Analyst,United States,$80K - $85K (Employer est.),7d,https://www.glassdoor.com/partner/jobListing.htm?pos=1616&ao=1136043&s=58&guid=00000195fc83aaa2ae6c16204e14c6b5&src=GD_JOB_AD&t=SR&vt=w&ea=1&cs=1_d71ea9ed&cb=1743698242833&jobListingId=1009687534944&jrtk=5-yul1-0-1inu87atg2dig000-c0fadfa93ed29391,"An allowable substitution is an associate's degree plus 2 years of experience in the field or in a related area. Issue visitor badges to all visitors.&hellip;
      
        Skills: Microsoft Powerpoint, Microsoft Word, Microsoft Excel, Process improvement, Information security
      
    "
 Security analyst ,United States,3.5,Bay County Sheriff's Office,Crime Analyst - BAYROC,"Panama City, FL",$46K (Employer est.),10d,https://www.glassdoor.com/partner/jobListing.htm?pos=1617&ao=1110586&s=58&guid=00000195fc83aaa2ae6c16204e14c6b5&src=GD_JOB_AD&t=SR&vt=w&ea=1&cs=1_55782427&cb=1743698242833&jobListingId=1009683735376&cpc=8795CF9063CD573D&jrtk=5-yul1-0-1inu87atg2dig000-191637731ea91bd9---6NYlbfkN0AKmxbupwLxoWtaqaXo043uU1J8d8zu-9OYE8aNNN8oZHVkBdUhtO_UofCBKYQeMK_a5TP77eUxVK3fpbsNPeIYPCirsvOeB2m5XL2IJYSc2hqvRAWMoVkuuxbzi-Ukq8QRNv1xnHAQ1r_QieFmVskQbQPEgvUEJxx8_5zSqhEmE3k7JmupZYRNVSCauXSCyklr2kdun7kvOp4AlZijqFp72K9h-P1NcHkjg72C9iCYuF6pKinC1AQwk9cowoG3M4yg_Hqk0dHCCS2MebGglQL0rdplxsoxzzfGRW7G-2si7mK91DJQKYIRbpr-8odEzJ2oP1Z-ePsHl7C5tQcfa-6nYCTsKfhq7btRXVgjVQSscJI2VSnA78NPkXjBSeF68IK7hb_Zvg8R_tIa84AdT5Pjs6Qw9FLjQm1RQbM6jddSqlfsPGyfJtgYGXPatZ-uK4myn0-1sp88PAdNsFbl7kaBGzDX7igLEg_zrv-gvPhNGTC8auWkggKYGCDlGEYzYkm8_sjD5GEWUcQnj1kkvrdJphJR_mDvTTgDAI_SEFHQSdRRh0JBH5heBoqUGa4xM5Z4uFyfo2g11vbU8v28LQsZOLGifLakNdhIR6oGACWu5UfJcJk5Pq40TSirN5r1smx4Dg2wo04ovZPQLrglzFtLJRnlZMAliYfvY-_LSEp5qMjDoU_zEkGd55sgVSOqH1vkk5v5XCfTOfEEhe0aGxTeBPTPZwhmtrshoyMZ4RSvzQ%3D%3D,"The analyst runs background information and other necessary information on specific individuals and provide this information to all law enforcement agencies in…&hellip;
      
        Skills: Microsoft Powerpoint, Microsoft Word, Statistics, Microsoft Excel, Social media management
      
    "
 Security analyst ,United States,3.8,Propelled Brands,GRC and Privacy Analyst,"Carrollton, TX",$90K (Employer est.),9d,https://www.glassdoor.com/partner/jobListing.htm?pos=1618&ao=1136043&s=58&guid=00000195fc83aaa2ae6c16204e14c6b5&src=GD_JOB_AD&t=SR&vt=w&ea=1&cs=1_bed7fde2&cb=1743698242834&jobListingId=1009683912805&jrtk=5-yul1-0-1inu87atg2dig000-1d7203271fa678be,"This role routinely uses standard office equipment such as computers,smartphones, video conferencing, webinars, phones, photocopiers, printers, filing cabinets,…&hellip;
      
        Skills: Information security, Analysis skills, NIST standards, IT, Cybersecurity
      
    "
 Security analyst ,United States,3.8,State of South Carolina,Risk Management & Compliance Analyst I / IT Security Risk Analyst - 174821,"Richland, SC",$64K - $67K (Employer est.),12d,https://www.glassdoor.com/partner/jobListing.htm?pos=1619&ao=1136043&s=58&guid=00000195fc83aaa2ae6c16204e14c6b5&src=GD_JOB_AD&t=SR&vt=w&cs=1_387767d9&cb=1743698242834&jobListingId=1009681706780&jrtk=5-yul1-0-1inu87atg2dig000-d9593e594887fbf3,"A bachelor's degree in information security, information management, information systems, information science, computer science, business administration,…&hellip;
      
        Skills: Management, Writing skills, Information security, NIST standards, Security
      
    "
 Security analyst ,United States,3.6,Best Buy,Cybersecurity Senior Analyst - Richfield MN,"Minneapolis, MN",$68K - $121K (Employer est.),8d,https://www.glassdoor.com/partner/jobListing.htm?pos=1620&ao=1136043&s=58&guid=00000195fc83aaa2ae6c16204e14c6b5&src=GD_JOB_AD&t=SR&vt=w&cs=1_57a8ea0a&cb=1743698242833&jobListingId=1009685663833&jrtk=5-yul1-0-1inu87atg2dig000-0e6c00a41d6516c9,"Partner closely with security architects on capability design and implementation. You’ll analyze, design, plan and integrate multiple security platforms into…&hellip;
      
        Skills: Operating systems, Software troubleshooting, Windows, Information security, Network architecture
      
    "
 Security analyst ,United States,2.9,enGen,IT Infrastructure Analyst,Pennsylvania,$50K - $91K (Employer est.),8d,https://www.glassdoor.com/partner/jobListing.htm?pos=1621&ao=1136043&s=58&guid=00000195fc83aaa2ae6c16204e14c6b5&src=GD_JOB_AD&t=SR&vt=w&cs=1_bdf45a60&cb=1743698242833&jobListingId=1009685425200&jrtk=5-yul1-0-1inu87atg2dig000-af535bb71c8a6fbb,"Provides operational support and analysis for the organizations information systems and peripheral equipment, such as servers, desktops, printers and storage…&hellip;
      
        Skills: English, IT
      
    "
 Security analyst ,United States,3.5,Devcare,Information Security Analyst,"Harrisburg, PA",$57.00 - $59.00 Per Hour (Employer est.),7d,https://www.glassdoor.com/partner/jobListing.htm?pos=1622&ao=1136043&s=58&guid=00000195fc83aaa2ae6c16204e14c6b5&src=GD_JOB_AD&t=SR&vt=w&ea=1&cs=1_c3d8f65d&cb=1743698242834&jobListingId=1009686865555&jrtk=5-yul1-0-1inu87atg2dig000-1389b97780f40a8c,"Familiarity with DAST tools such as Rapid 7 AppSpider. Experience with risk assessment methodologies and frameworks (e.g., NIST, FAIR).&hellip;
      
        Skills: TCP, Windows, Information security, Presentation skills, NIST standards
      
    "
 Security analyst ,United States,,"Resource Management Associates, LLC","IT Security Analyst (BCP, COOP, DR/NIST) (NC759792)","Raleigh, NC",$68.00 - $72.00 Per Hour (Employer est.),7d,https://www.glassdoor.com/partner/jobListing.htm?pos=1623&ao=1136043&s=58&guid=00000195fc83aaa2ae6c16204e14c6b5&src=GD_JOB_AD&t=SR&vt=w&ea=1&cs=1_6afc7c04&cb=1743698242834&jobListingId=1009686932020&jrtk=5-yul1-0-1inu87atg2dig000-172c978654fa70e0,"Bachelor’s degree in computer science, management information systems, or related field preferred. Perform NIST and HIPAA based risk assessments - NIST 800-53…&hellip;
      
        Skills: Management, HIPAA, Information security, NIST standards, Business continuity planning
      
    "
 Security analyst ,United States,4.1,Intone Networks,Information Security Analyst II,Delaware,,8d,https://www.glassdoor.com/partner/jobListing.htm?pos=1624&ao=1136043&s=58&guid=00000195fc83aaa2ae6c16204e14c6b5&src=GD_JOB_AD&t=SR&vt=w&cs=1_8b7c549b&cb=1743698242834&jobListingId=1009685359313&jrtk=5-yul1-0-1inu87atg2dig000-c7a21b09ebdb585d,"They are looking for someone who has experience with Zscaler implementation as well as Ansible and Terraform.&hellip;
      
        Skills: Ansible, Information security, Terraform, Communication skills
      
    "
 Security analyst ,United States,4.6,Corps Solutions,Security Cooperation Analyst,"Tampa, FL",,9d,https://www.glassdoor.com/partner/jobListing.htm?pos=1625&ao=1136043&s=58&guid=00000195fc83aaa2ae6c16204e14c6b5&src=GD_JOB_AD&t=SR&vt=w&ea=1&cs=1_c336fc8c&cb=1743698242834&jobListingId=1009684131721&jrtk=5-yul1-0-1inu87atg2dig000-19fefdf8c1261293,"All authorized company drivers must have a valid driver’s license, current automobile insurance, and a driving record that is acceptable to the company’s auto…&hellip;
      
        Skills: Microsoft Powerpoint, Microsoft Word, Microsoft Excel, Military, Microsoft Office
      
    "
 Security analyst ,United States,3.8,"Landstar System Holdings, Inc.",Sr. Network Security Analyst,"Jacksonville, FL",,7d,https://www.glassdoor.com/partner/jobListing.htm?pos=1626&ao=1136043&s=58&guid=00000195fc83aaa2ae6c16204e14c6b5&src=GD_JOB_AD&t=SR&vt=w&cs=1_fe13100a&cb=1743698242834&jobListingId=1009686790048&jrtk=5-yul1-0-1inu87atg2dig000-2911c90535bc03db,"Implement and maintain security tools to protect against cyber threats. Associate degree (A.A.) from a two-year college or technical school or equivalent…&hellip;
      
        Skills: Ceridian, IT, Business requirements, Cybersecurity, Network engineering
      
    "
 Security analyst ,United States,4.2,"Kestra Medical Technologies, Inc",Information Security and Data Privacy Analyst - Contractor,"Kirkland, WA",$50.00 - $90.00 Per Hour (Employer est.),7d,https://www.glassdoor.com/partner/jobListing.htm?pos=1627&ao=1136043&s=58&guid=00000195fc83aaa2ae6c16204e14c6b5&src=GD_JOB_AD&t=SR&vt=w&ea=1&cs=1_26b6ac54&cb=1743698242834&jobListingId=1009687112836&jrtk=5-yul1-0-1inu87atg2dig000-6ad131d1c871cf5f,"Formal certification in Information Security Management, Data Privacy, Information Systems Audit, or related field. Strong teambuilding and influence skills.&hellip;
      
        Skills: Computer science, Lean, HIPAA, Process improvement, HITRUST
      
    "
 Security analyst ,United States,4.3,City of Edinburg,Crime Analyst,"Edinburg, TX",$51K (Employer est.),7d,https://www.glassdoor.com/partner/jobListing.htm?pos=1628&ao=1136043&s=58&guid=00000195fc83aaa2ae6c16204e14c6b5&src=GD_JOB_AD&t=SR&vt=w&ea=1&cs=1_0843803e&cb=1743698242834&jobListingId=1009687439642&jrtk=5-yul1-0-1inu87atg2dig000-d87ffffcfa3fb008,"Must have a current valid class ""C"" driver's license from the Texas Department of Public Safety with a satisfactory driving record.&hellip;
      
        Skills: Bilingual, Spanish, Customer service, English, Analysis skills
      
    "
 Security analyst ,United States,3.8,Lubbock Christian University,Technology Security Analyst,"Lubbock, TX",$61K - $88K (Glassdoor est.),7d,https://www.glassdoor.com/partner/jobListing.htm?pos=1629&ao=1136043&s=58&guid=00000195fc83aaa2ae6c16204e14c6b5&src=GD_JOB_AD&t=SR&vt=w&cs=1_6273a9d8&cb=1743698242835&jobListingId=1009686873244&jrtk=5-yul1-0-1inu87atg2dig000-623e8ffd2163f557,"Bachelor’s degree or higher in computer science, information technology, cybersecurity, or related field. Skill in the installation and maintenance of security…&hellip;
      
        Skills: Network administration, Computer science, Azure, Firewall, IDS
      
    "
 Security analyst ,United States,4.5,i-Link Solutions Inc,VSP - IT Security Analyst 4 - Only Locals,"Richmond, VA",$70K - $116K (Glassdoor est.),13d,https://www.glassdoor.com/partner/jobListing.htm?pos=1630&ao=1136043&s=58&guid=00000195fc83aaa2ae6c16204e14c6b5&src=GD_JOB_AD&t=SR&vt=w&ea=1&cs=1_6bb315ef&cb=1743698242835&jobListingId=1009680241321&jrtk=5-yul1-0-1inu87atg2dig000-e3902ee84a532399,"IT security or risk assessment certifications are advantageous (CISM, CCSP, CISSP, CEH, CompTIA Pentest+ and/or CompTIA Security+).&hellip;
      
        Skills: CSS, Visual Basic, C#, LAN, Information security
      
    "
 Security analyst ,United States,4.0,General Dynamics Information Technology,Cyber Technical Analyst Advisor - TS/SCI w/Poly,"Chantilly, VA",$140K - $169K (Employer est.),5d,https://www.glassdoor.com/partner/jobListing.htm?pos=1701&ao=1136043&s=58&guid=00000195fc83cb9fb778c9dba4a3f285&src=GD_JOB_AD&t=SR&vt=w&cs=1_4cafcf21&cb=1743698251294&jobListingId=1009689752921&jrtk=5-yul1-0-1inu87iv2gmu8800-dac1e30c66a371d6,"Demonstrated experience and the ability to utilize an array of targeting tools, targeting methodologies, and data analysis. TS/SCI with SCI Poly clearance.&hellip;
      
        Skills: Computer science, Management, Data analysis skills, Firewall, Analysis skills
      
    "
 Security analyst ,United States,4.1,Dynamo Technologies,Security Analyst,"Washington, DC",,9d,https://www.glassdoor.com/partner/jobListing.htm?pos=1702&ao=1136043&s=58&guid=00000195fc83cb9fb778c9dba4a3f285&src=GD_JOB_AD&t=SR&vt=w&ea=1&cs=1_781559c0&cb=1743698251294&jobListingId=1009685160214&jrtk=5-yul1-0-1inu87iv2gmu8800-30c32f94e9293845,"Perform clerical and data entry services for the CBP Badge and Credentialing Program in Washington, DC and Glynco, GA. 4 Years of relevant experience.&hellip;
      
        Skills: Information security
      
    "
 Security analyst ,United States,3.0,Zayo Careers,IT Controls and Compliance Analyst,United States,$79K - $112K (Employer est.),7d,https://www.glassdoor.com/partner/jobListing.htm?pos=1703&ao=1136043&s=58&guid=00000195fc83cb9fb778c9dba4a3f285&src=GD_JOB_AD&t=SR&vt=w&cs=1_70c4adb8&cb=1743698251294&jobListingId=1009686809082&jrtk=5-yul1-0-1inu87iv2gmu8800-8bb45e713c78e015,"Provide technical leadership in the assessment, design, and implementation of data integrity requirements within IT Zayo’s systems landscape.&hellip;
      
        Skills: SOX, Analysis skills, IT, Communication skills
      
    "
 Security analyst ,United States,3.4,Ritchie Bros.,Security Analyst,"Westchester, IL",$77K - $115K (Glassdoor est.),12d,https://www.glassdoor.com/partner/jobListing.htm?pos=1704&ao=1136043&s=58&guid=00000195fc83cb9fb778c9dba4a3f285&src=GD_JOB_AD&t=SR&vt=w&cs=1_8bc0815a&cb=1743698251294&jobListingId=1009681763518&jrtk=5-yul1-0-1inu87iv2gmu8800-4a3b6ec10763f605,"Camera troubleshooting with field personnel and remote troubleshooting for software, firmware, hardware, and electrical issues.&hellip;
      
        Skills: Sales, Purchasing
      
    "
 Security analyst ,United States,3.9,Discover Financial Services,Cybersecurity Analyst ( AppSec ),"Riverwoods, IL",$91K - $153K (Employer est.),12d,https://www.glassdoor.com/partner/jobListing.htm?pos=1705&ao=1136043&s=58&guid=00000195fc83cb9fb778c9dba4a3f285&src=GD_JOB_AD&t=SR&vt=w&cs=1_d1172abd&cb=1743698251295&jobListingId=1009682106435&jrtk=5-yul1-0-1inu87iv2gmu8800-83177d831490c0a5,"Internal applicants only: technical proficiency rating of Competent on the Cybersecurity Dreyfus engineering scale. Primarily remain in a stationary position.&hellip;
      
        Skills: Information security, Project management, ServiceNow, IT, Cybersecurity
      
    "
 Security analyst ,United States,4.3,Fixity Technologies,Identity and Access Management Analyst,"Dallas, TX",$40.00 - $62.00 Per Hour (Employer est.),8d,https://www.glassdoor.com/partner/jobListing.htm?pos=1706&ao=1136043&s=58&guid=00000195fc83cb9fb778c9dba4a3f285&src=GD_JOB_AD&t=SR&vt=w&ea=1&cs=1_e865b794&cb=1743698251295&jobListingId=1009685457160&jrtk=5-yul1-0-1inu87iv2gmu8800-97cdc13332fb8a9a,"Experience of designing and implementing IAM solutions across various tools and technologies. Proficiency in data handling and analysis.&hellip;
      
        Skills: Management, Business analysis, Analysis skills, Communication skills, Identity & access management
      
    "
 Security analyst ,United States,4.3,University of Massachusetts Amherst,Senior Information Security Analyst (Hybrid Opportunity),"Amherst, MA",$98K - $142K (Glassdoor est.),8d,https://www.glassdoor.com/partner/jobListing.htm?pos=1707&ao=1136043&s=58&guid=00000195fc83cb9fb778c9dba4a3f285&src=GD_JOB_AD&t=SR&vt=w&cs=1_11723c73&cb=1743698251295&jobListingId=1009686522654&jrtk=5-yul1-0-1inu87iv2gmu8800-df7be7355b16d2ea,"Strong analytical and critical thinking skills to assess security risks and develop mitigation strategies. Experience with security tools such as SIEM, EDR/XDR,…&hellip;
      
        Skills: Azure, PCI, Google Cloud Platform, Information security, AWS
      
    "
 Security analyst ,United States,3.6,GAF Materials Corporation,Senior Cyber Security Risk Analyst,United States,,7d,https://www.glassdoor.com/partner/jobListing.htm?pos=1708&ao=1136043&s=58&guid=00000195fc83cb9fb778c9dba4a3f285&src=GD_JOB_AD&t=SR&vt=w&cs=1_a2984f9b&cb=1743698251295&jobListingId=1009686863786&jrtk=5-yul1-0-1inu87iv2gmu8800-a4a3f8aaf19ab091,"Strong technical risk analysis skills with the ability to identify and understand cybersecurity deficiencies, the potential impact to GAF’s business and…&hellip;
      
        Skills: Cloud infrastructure, PCI, Information security, Risk analysis, ServiceNow
      
    "
 Security analyst ,United States,5.0,Bridge Core (BCore),Cybersecurity Analyst,"McLean, VA",$79K - $111K (Glassdoor est.),13d,https://www.glassdoor.com/partner/jobListing.htm?pos=1709&ao=1136043&s=58&guid=00000195fc83cb9fb778c9dba4a3f285&src=GD_JOB_AD&t=SR&vt=w&cs=1_0c5eb0a2&cb=1743698251296&jobListingId=1009680540533&jrtk=5-yul1-0-1inu87iv2gmu8800-8abd0a9c47eb5c40,"Utilize SIEM systems, network security tools, and log analysis tools to detect, analyze, and respond to security threats. Active TS/SCI with required polygraph.&hellip;
      
        Skills: Operating systems, Analysis skills, Network protocols, SIEM, Cybersecurity
      
    "
 Security analyst ,United States,4.3,Schneider Electric,Senior Cyber Security Analyst - Product Vulnerability Management,"Boston, MA",$93K - $134K (Glassdoor est.),8d,https://www.glassdoor.com/partner/jobListing.htm?pos=1710&ao=1136043&s=58&guid=00000195fc83cb9fb778c9dba4a3f285&src=GD_JOB_AD&t=SR&vt=w&cs=1_7a5eda33&cb=1743698251296&jobListingId=1009685637889&jrtk=5-yul1-0-1inu87iv2gmu8800-9c29ef2010fbeda9,"Responsible for driving Vulnerability Management process execution in the Business Units whether externally reported or Internally discovered (Intake, Triage,…&hellip;
      
        Skills: Computer science, Management, Product management, Risk management, Cybersecurity
      
    "
 Security analyst ,United States,3.7,Adventist Health,Epic Security Analyst III,United States,$99K - $148K (Employer est.),9d,https://www.glassdoor.com/partner/jobListing.htm?pos=1711&ao=1136043&s=58&guid=00000195fc83cb9fb778c9dba4a3f285&src=GD_JOB_AD&t=SR&vt=w&cs=1_cabca8f7&cb=1743698251295&jobListingId=1009684390904&jrtk=5-yul1-0-1inu87iv2gmu8800-3121939ef47be469,"Liaises between technical support, customers, and project teams in the design, implementation, and training of our healthcare information systems and any new…&hellip;
      
        Skills: Software troubleshooting, EHR systems, System design, IT, Epic
      
    "
 Security analyst ,United States,5.0,IB3 Global Solutions,Security and Technical Review Analyst,"Fort Belvoir, VA",$100K - $140K (Employer est.),8d,https://www.glassdoor.com/partner/jobListing.htm?pos=1712&ao=1136043&s=58&guid=00000195fc83cb9fb778c9dba4a3f285&src=GD_JOB_AD&t=SR&vt=w&ea=1&cs=1_7d400dce&cb=1743698251296&jobListingId=1009685470791&jrtk=5-yul1-0-1inu87iv2gmu8800-1cf092131f595597,"Bachelor's degree in Science, Engineering or significant experience in a technical field preferably relating to CBRNE or the CWMD mission.&hellip;
      
        Skills: Patent law
      
    "
 Security analyst ,United States,3.9,Meta,IDC Security Analyst,Remote,$167K - $233K (Employer est.),12d,https://www.glassdoor.com/partner/jobListing.htm?pos=1713&ao=1136043&s=58&guid=00000195fc83cb9fb778c9dba4a3f285&src=GD_JOB_AD&t=SR&vt=w&cs=1_103033af&cb=1743698251296&jobListingId=1009682111314&jrtk=5-yul1-0-1inu87iv2gmu8800-df6350fcc9ce8834,"Bachelors degree in Cyber Security or Computer Science or related technical field or equivalent relevant experience in information security.&hellip;
      
        Skills: Computer science, Data center experience, Data analysis skills, Information security, Machine learning
      
    "
 Security analyst ,United States,3.4,Holtec International,Holtec Security International - Video Surveillance Analyst,"Camden, NJ",$47K - $72K (Glassdoor est.),13d,https://www.glassdoor.com/partner/jobListing.htm?pos=1714&ao=1136043&s=58&guid=00000195fc83cb9fb778c9dba4a3f285&src=GD_JOB_AD&t=SR&vt=w&ea=1&cs=1_27038e63&cb=1743698251296&jobListingId=1009680426923&jrtk=5-yul1-0-1inu87iv2gmu8800-fb91073f051f75eb,"Additional desirable qualifications include: Prior experience in video surveillance, crime analysis, or a related field is preferred; strong attention to detail…&hellip;
      
        Skills: CAD, CCTV, Analysis skills, Surveillance, Intelligence analysis
      
    "
 Security analyst ,United States,3.3,"Maximus Services, LLC",Analyst - Information Security (Remote position - must be flexible to work 3rd shift),"Tysons Corner, VA",$61K - $106K (Glassdoor est.),7d,https://www.glassdoor.com/partner/jobListing.htm?pos=1715&ao=1136043&s=58&guid=00000195fc83cb9fb778c9dba4a3f285&src=GD_JOB_AD&t=SR&vt=w&cs=1_26125b25&cb=1743698251296&jobListingId=1009687746999&jrtk=5-yul1-0-1inu87iv2gmu8800-4494cd70c4484d37,"In this role, you will help maintain compliance specifically FedRAMP, conduct risk assessments, and collaborate with teams to integrate security best practices.&hellip;
      
        Skills: FedRAMP, Information security
      
    "
 Security analyst ,United States,4.3,Firebird AST,Security and Technical Review/ Declassification Analyst,"Lorton, VA",$57K - $90K (Glassdoor est.),9d,https://www.glassdoor.com/partner/jobListing.htm?pos=1716&ao=1136043&s=58&guid=00000195fc83cb9fb778c9dba4a3f285&src=GD_JOB_AD&t=SR&vt=w&cs=1_a18d84c3&cb=1743698251296&jobListingId=1009684151201&jrtk=5-yul1-0-1inu87iv2gmu8800-3fcd86fdc5c181e9,"Bachelor's degree in science, engineering or significant experience in a technical field preferably relating to CBRNE or the CWMD mission.&hellip;
      
        Skills: Patent law, Organizational skills, Time management
      
    "
 Security analyst ,United States,3.2,strada,Vulnerability Management Analyst - Remote,Georgia,$72K - $115K (Employer est.),13d,https://www.glassdoor.com/partner/jobListing.htm?pos=1717&ao=1136043&s=58&guid=00000195fc83cb9fb778c9dba4a3f285&src=GD_JOB_AD&t=SR&vt=w&cs=1_3559ea23&cb=1743698251297&jobListingId=1009680910782&jrtk=5-yul1-0-1inu87iv2gmu8800-a0f1e4a969476f3b,"Pay Transparency Statement: Strada considers a variety of factors in determining whether to extend an offer of employment and in setting the appropriate…&hellip;
      
        Skills: DevOps, Google Cloud Platform, AWS, Nessus, Scripting
      
    "
 Security analyst ,United States,3.8,UF Health,IT Security Analyst L3 | IT Security | Days | Full-time,"Gainesville, FL",,12d,https://www.glassdoor.com/partner/jobListing.htm?pos=1718&ao=1136043&s=58&guid=00000195fc83cb9fb778c9dba4a3f285&src=GD_JOB_AD&t=SR&vt=w&cs=1_810b313d&cb=1743698251297&jobListingId=1009681963258&jrtk=5-yul1-0-1inu87iv2gmu8800-570e866b6ea27077,"The ability to communicate effectively with technical and non-technical personnel at all levels of the organization to resolve information security problems.&hellip;
      
        Skills: Information security, Firewall, Computer skills, VPN
      
    "
